{
  "merchant": {
    "name": "FIVE GUYS",
    "address": "2640 Reynolds Ranch Pkwy Ste 140, Lodi, CA 95240",
    "phone": "(209) 333-9750",
    "tax_id": "",
    "website": "www.fiveguys.com"
  },
  "transaction": {
    "date": "2017-05-25",
    "time": "13:00:17",
    "currency": "USD",
    "payment_method": "MasterCard",
    "subtotal": 30.31,
    "tax": 2.35,
    "tip": 0.0,
    "total": 32.66,
    "accounting_category": "Food & Beverage",
    "category_confidence": 0.95
  },
  "items": [
    {
      "name": "Little Hamburger",
      "quantity": 1,
      "unit_price": 5.19,
      "total_price": 5.19,
      "category": "Food",
      "accounting_category": "Food & Beverage",
      "category_confidence": 0.9
    },
    {
      "name": "Large Fry",
      "quantity": 2,
      "unit_price": 5.79,
      "total_price": 11.58,
      "category": "Food",
      "accounting_category": "Food & Beverage",
      "category_confidence": 0.9
    },
    {
      "name": "Large Soda",
      "quantity": 1,
      "unit_price": 2.69,
      "total_price": 2.69,
      "category": "Beverage",
      "accounting_category": "Food & Beverage",
      "category_confidence": 0.9
    },
    {
      "name": "Cheeseburger",
      "quantity": 1,
      "unit_price": 7.81,
      "total_price": 7.81,
      "category": "Food",
      "accounting_category": "Food & Beverage",
      "category_confidence": 0.9
    },
    {
      "name": "Regular Soda",
      "quantity": 1,
      "unit_price": 3.04,
      "total_price": 3.04,
      "category": "Beverage",
      "accounting_category": "Food & Beverage",
      "category_confidence": 0.9
    }
  ],
  "summary": {
    "total_items": 6,
    "rounding": 0.0,
    "change_due": 0.0
  },
  "ocr_metadata": {
    "source_image": "express_srd_1090-receipt.jpg",
    "extraction_engine": "gpt-4o-vision",
    "model_version": "2024-05-13",
    "confidence": 0.95
  },
  "ocr_raw": {
    "full_text": "FIVE GUYS\nSTORE # CA-1661\n2640 Reynolds Ranch Pkwy - Ste 140\nLodi, CA 95240\nPhone (209) 333-9750\n5/25/2017 1:00:17 PM\nOrder Id: AAAPZP9WAEBP\n47 - FIVE GUYS\nEmployee: Robert C\n\n1 Little Hamburger\t$5.19\nLettuce\t$0.00\nPickles\t$0.00\nTomatoes\t$0.00\nGrilled Onions\t$0.00\nGrilled Mushrooms\t$0.00\nMustard\t$0.00\nKetchup\t$0.00\nJalapeno Peppers\t$0.00\n2 Large Fry (5.79)\t$11.58\n1 Large Soda\t$2.69\n1 Cheeseburger\t$7.81\nMayo\t$0.00\nLettuce\t$0.00\nPickles\t$0.00\nBBQ Sauce\t$0.00\n1 Regular Soda\t$3.04\n\nSub Total\t$30.31\nSales Tax\t$2.35\nOrder Total\t$32.66\nMasterCard\nCard: ************2931\nAuthorization: 728767\n\n-- Order Closed --\n\n*****\nDon't throw away your receipt!!!\nHelp Five Guys and you could win!\nLog online to www.fiveguys.com/survey\nand fill out a brief survey!\n\n10 lucky people will win a\nFive Guys Gift Card each month\nworth $25 each!\n\nNo purchase necessary\nSweepstakes ends 12/31/2017.\nMust be at least 18 years old and\nsubmit survey within 30 days\nof the receipt date to enter.\nPlease visit www.fiveguys.com/survey\nfor Official Rules and how to enter\nwithout making a purchase or\ncompleting a survey.\nVoid where prohibited."
  }
}