{
  "merchant": {
    "name": "Gardenia Bakeries (KL) SDN BHD",
    "address": "Lot 3, Jalan Pelabur 23/1, 40300 Shah Alam, Selangor",
    "phone": "03-55423228",
    "tax_id": "000381399040",
    "website": ""
  },
  "transaction": {
    "date": "2017-10-15",
    "time": "10:54:00",
    "currency": "MYR",
    "payment_method": "",
    "subtotal": 29.66,
    "tax": 0.17,
    "tip": 0.0,
    "total": 23.56,
    "accounting_category": "Groceries",
    "category_confidence": 0.9
  },
  "items": [
    {
      "name": "O.C. White",
      "quantity": 3,
      "unit_price": 2.13,
      "total_price": 6.39,
      "category": "Bakery",
      "accounting_category": "Groceries",
      "category_confidence": 0.9
    },
    {
      "name": "Wholemeal",
      "quantity": 3,
      "unit_price": 2.78,
      "total_price": 8.34,
      "category": "Bakery",
      "accounting_category": "Groceries",
      "category_confidence": 0.9
    },
    {
      "name": "O.C. Jumbo",
      "quantity": 4,
      "unit_price": 2.97,
      "total_price": 11.88,
      "category": "Bakery",
      "accounting_category": "Groceries",
      "category_confidence": 0.9
    },
    {
      "name": "CR-Choclt",
      "quantity": 3,
      "unit_price": 0.72,
      "total_price": 2.16,
      "category": "Confectionery",
      "accounting_category": "Groceries",
      "category_confidence": 0.8
    },
    {
      "name": "CR-Corn",
      "quantity": 1,
      "unit_price": 0.72,
      "total_price": 0.72,
      "category": "Confectionery",
      "accounting_category": "Groceries",
      "category_confidence": 0.8
    }
  ],
  "summary": {
    "total_items": 14,
    "rounding": 0.0,
    "change_due": 0.0
  },
  "ocr_metadata": {
    "source_image": "sroie_X51006557188.jpg",
    "extraction_engine": "gpt-4o-vision",
    "model_version": "2024-05-13",
    "confidence": 0.95
  },
  "ocr_raw": {
    "full_text": "GARDENIA BAKERIES (KL) SDN BHD (139386 X)\nLot 3, Jalan Pelabur 23/1,\n40300 Shah Alam, Selangor.\nTel: 03-55423228 Fax:03-55423213\nGST ID: 000381399040\n\nTAX INVOICE / ADJUSTMENT NOTE\nCash Inv No.: 7015F710\nDate: 15/10/2017\n\nVE0514\nMAKASSAR FRESH MARKET SDN BHD\nGROUND FLOOR, NO. 4 & 6,\nJALAN SS 15/4B,\n47500 SUBANG JAYA, SELANGOR\n\nVD05: Ridzuan (11900)\n\nDD: 15/10/2017 10:54\nDescription U.P Iss Exc D Sale Amt(RM)\nO.C. WHITE 2.13 4 1 0 3 6.39\nWHOLEMEAL 2.78 4 1 0 3 8.34\nO.C JUMBO 2.97 4 0 0 4 11.88\n\nTotal 0% supplies: 26.61\n\nCR-CHOCLT 0.72 0 0 0 3 2.16\nCR-CORN 0.72 0 0 0 1 0.72\n\nTotal 6% supplies (excl. GST): -2.88\nGST: -0.17\nTotal 6% supplies (Inc. GST): -3.05\nTotal 0% supplies: 26.61\n\nTotal Payable: 23.56\n\nE.&O.E\nReceived above goods in good order condition.\nThe recipient of Gardenia's products is\nrequired to make necessary adjustments to its\ninput tax claims, on the basis of the\nadjustments shown in this Tax Invoice /\nAdjustment Note\n\nCUSTOMER'S COPY"
  }
}