{
  "merchant": {
    "name": "Mentai Initial SDN BHD",
    "address": "No.37-1, Plaza Danau Desa 2, Jalan 109f, Taman Danau Desa, 58100 Kuala Lumpur",
    "phone": "",
    "tax_id": "000435761152",
    "website": "www.sispos.com.my"
  },
  "transaction": {
    "date": "2018-04-21",
    "time": "20:40:32",
    "currency": "MYR",
    "payment_method": "VISA",
    "subtotal": 35.6,
    "tax": 2.36,
    "tip": 0.0,
    "total": 41.5,
    "accounting_category": "Food and Beverage",
    "category_confidence": 0.9
  },
  "items": [
    {
      "name": "Green Tea",
      "quantity": 2,
      "unit_price": 1.0,
      "total_price": 2.0,
      "category": "Beverage",
      "accounting_category": "Food and Beverage",
      "category_confidence": 0.9
    },
    {
      "name": "Shiro Ramen",
      "quantity": 1,
      "unit_price": 12.8,
      "total_price": 12.8,
      "category": "Food",
      "accounting_category": "Food and Beverage",
      "category_confidence": 0.9
    },
    {
      "name": "Sushi 1.30",
      "quantity": 10,
      "unit_price": 1.8,
      "total_price": 18.0,
      "category": "Food",
      "accounting_category": "Food and Beverage",
      "category_confidence": 0.9
    },
    {
      "name": "Sushi 2.30",
      "quantity": 1,
      "unit_price": 2.8,
      "total_price": 2.8,
      "category": "Food",
      "accounting_category": "Food and Beverage",
      "category_confidence": 0.9
    }
  ],
  "summary": {
    "total_items": 4,
    "rounding": -0.02,
    "change_due": 0.0
  },
  "ocr_metadata": {
    "source_image": "sroie_X51006466066.jpg",
    "extraction_engine": "gpt-4o-vision",
    "model_version": "2024-05-13",
    "confidence": 0.95
  },
  "ocr_raw": {
    "full_text": "MENTAI INITIAL SDN BHD (1206674-T)\nSUSHI MENTAI PLAZA DANAU\nNO.37-1, PLAZA DANAU DESA 2,\nJALAN 109F, TAMAN DANAU DESA,\n58100 KUALA LUMPUR.\n(GST Reg. No : 000435761152)\nTax Invoice\nTable 12\nOrder#: 152842\nBill#: V031- 551345 Pax(s): 0\nDate : 21-04-2018 20:40:32\nCashier: Khong\nDescription Qty U.price Total TAX\nGreen Tea 2 x 1.00 2.00 SR\nShiro Ramen 1 x 12.80 12.80 SR\nSushi 1.30 10 x 1.80 18.00 SR\nSushi 2.30 1 x 2.80 2.80 SR\nTotal (Excluding GST): 35.60\nServ. Charge (10%): 3.56\nGST Payable: 2.36\nTotal (Inclusive of GST): 41.52\nRounding Adj: -0.02\nTOTAL: 41.50\nClosed: ;201601897 21-04-2018 21:09:20\nServer: Khong\nVISA 41.50\nGST Summary Amount(RM) Tax(RM)\nSR (@ 6%) 39.16 2.36\n(Guest Signature)\nThank you!!!\nPlease Come Again!!!\nPowered By WWW.SISPOS.COM.MY"
  }
}