{
  "merchant": {
    "name": "Gardenia Bakeries (KL) Sdn Bhd",
    "address": "Lot 3, Jalan Pelabur 23/1,\n40300 Shah Alam, Selangor.",
    "phone": "03-55423228",
    "tax_id": "000381399040",
    "website": ""
  },
  "transaction": {
    "date": "2017-09-19",
    "time": "11:09:00",
    "currency": "MYR",
    "payment_method": "",
    "subtotal": 30.01,
    "tax": 1.69,
    "tip": 0.0,
    "total": 22.58,
    "accounting_category": "Groceries",
    "category_confidence": 0.9
  },
  "items": [
    {
      "name": "O.C. WHITE",
      "quantity": 2,
      "unit_price": 2.13,
      "total_price": 4.26,
      "category": "Bakery",
      "accounting_category": "Groceries",
      "category_confidence": 0.9
    },
    {
      "name": "WHOLEMEAL",
      "quantity": -1,
      "unit_price": 2.78,
      "total_price": -2.78,
      "category": "Bakery",
      "accounting_category": "Groceries",
      "category_confidence": 0.9
    },
    {
      "name": "O.C JUMBO",
      "quantity": -3,
      "unit_price": 2.97,
      "total_price": -8.91,
      "category": "Bakery",
      "accounting_category": "Groceries",
      "category_confidence": 0.9
    },
    {
      "name": "CR-VANILLA",
      "quantity": 10,
      "unit_price": 0.72,
      "total_price": 7.2,
      "category": "Snacks",
      "accounting_category": "Groceries",
      "category_confidence": 0.9
    },
    {
      "name": "CR-CORN",
      "quantity": 20,
      "unit_price": 0.72,
      "total_price": 14.4,
      "category": "Snacks",
      "accounting_category": "Groceries",
      "category_confidence": 0.9
    },
    {
      "name": "SQ-CHOCMLT",
      "quantity": 8,
      "unit_price": 0.84,
      "total_price": 6.72,
      "category": "Snacks",
      "accounting_category": "Groceries",
      "category_confidence": 0.9
    }
  ],
  "summary": {
    "total_items": 36,
    "rounding": 0.0,
    "change_due": 0.0
  },
  "ocr_metadata": {
    "source_image": "sroie_X51006556838.jpg",
    "extraction_engine": "gpt-4o-vision",
    "model_version": "2024-05-13",
    "confidence": 0.95
  },
  "ocr_raw": {
    "full_text": "GARDENIA BAKERIES (KL) SDN BHD\nLot 3, Jalan Pelabur 23/1,\n40300 Shah Alam, Selangor.\nTel: 03-55423228 Fax:03-55423213\nGST ID: 000381399040\n\nTAX INVOICE / ADJUSTMENT NOTE\nCash Inv No.: 7919F712\nDate: 19/09/2017\n\nMAKASSAR FRESH MARKET SDN BHD\nGROUND FLOOR, NO. 4 & 6,\nJALAN SS 15/4B,\n47500 SUBANG JAYA, SELANGOR\nVE:05: Ridzuan (11900)\n\nDD: 19/09/2017 11:09\n\nD escription U.P Iss Exc D Sale Amt(RM)\nO.C. WHITE 2.13 2 4 6 2 4.26\nWHOLEMEAL 2.78 2 3 0 -1 -2.78\nO.C JUMBO 2.97 0 3 0 -3 -8.91\nTotal 0% supplies: -7.43\n\nCR-VANILLA 0.72 10 0 0 10 7.20\nCR-CORN 0.72 20 0 0 20 14.40\nSQ-CHOCMLT 0.84 8 0 0 8 6.72\nTotal 6% supplies (excl. GST): 28.32 GST: 1.69\n\nTotal 6% supplies (Inc. GST): 30.01\nTotal 0% supplies: -7.43\nTotal Payable: 22.58\n\nE.&O.E.\nReceived above goods in good order conition.\nThe recipient of Gardenia's products is\nrequired to make necessary adjustments to its\ninput tax claims, on the basic of the\nadjustments shown in this Tax Invoice /\nAdjustment Note\n\nCUSTOMER'S COPY"
  }
}