{
  "merchant": {
    "name": "Gardenia Bakeries (KL) Sdn Bhd",
    "address": "Lot 3, Jalan Pelabur 23/1, 40300 Shah Alam, Selangor",
    "phone": "03-55423228",
    "tax_id": "000381399040",
    "website": ""
  },
  "transaction": {
    "date": "2017-10-02",
    "time": "12:37:00",
    "currency": "MYR",
    "payment_method": "",
    "subtotal": 33.35,
    "tax": 1.23,
    "tip": 0.0,
    "total": 35.58,
    "accounting_category": "Sales",
    "category_confidence": 0.9
  },
  "items": [
    {
      "name": "O.C. WHITE",
      "quantity": 3,
      "unit_price": 2.13,
      "total_price": 6.39,
      "category": "Food",
      "accounting_category": "Bakery",
      "category_confidence": 0.95
    },
    {
      "name": "WHOLEMEAL",
      "quantity": 3,
      "unit_price": 2.78,
      "total_price": 8.34,
      "category": "Food",
      "accounting_category": "Bakery",
      "category_confidence": 0.95
    },
    {
      "name": "O.C JUMBO",
      "quantity": 4,
      "unit_price": 2.97,
      "total_price": 11.88,
      "category": "Food",
      "accounting_category": "Bakery",
      "category_confidence": 0.95
    },
    {
      "name": "DELICIA-B/SCOTCH",
      "quantity": 3,
      "unit_price": 3.72,
      "total_price": 11.16,
      "category": "Food",
      "accounting_category": "Bakery",
      "category_confidence": 0.95
    },
    {
      "name": "CR-CHOCLT",
      "quantity": 20,
      "unit_price": 0.72,
      "total_price": 14.4,
      "category": "Food",
      "accounting_category": "Bakery",
      "category_confidence": 0.95
    },
    {
      "name": "CR-B'SCOTCH",
      "quantity": -7,
      "unit_price": 0.72,
      "total_price": -5.04,
      "category": "Food",
      "accounting_category": "Bakery",
      "category_confidence": 0.95
    }
  ],
  "summary": {
    "total_items": 6,
    "rounding": 0.0,
    "change_due": 0.0
  },
  "ocr_metadata": {
    "source_image": "sroie_X51006557115.jpg",
    "extraction_engine": "gpt-4o-vision",
    "model_version": "2024-05-13",
    "confidence": 0.95
  },
  "ocr_raw": {
    "full_text": "GARDENIA BAKERIES (KL) SDN BHD (139386 X)\nLot 3, Jalan Pelabur 23/1,\n40300 Shah Alam, Selangor.\nTel: 03-55423228 Fax:03-55423213\nGST ID: 000381399040\n\nTAX INVOICE / ADJUSTMENT NOTE\nCash Inv No.: 7002F717\nDate: 02/10/2017\n\nMAKASSAR FRESH MARKET SDN BHD\nGROUND FLOOR, NO. 4 & 6,\nJALAN SS 15/4B,\n47500 SUBANG JAYA, SELANGOR\n\nDD: 02/10/2017 12:37\n\nDescription        U.P Iss Exc D Sale Amt(RM)\n\nO.C. WHITE         2.13 3 6 0 3       6.39\nWHOLEMEAL          2.78 3 3 0 3       8.34\nO.C JUMBO          2.97 4 0 0 4      11.88\n\nTotal 0% supplies:             13.83\n\nDELICIA-B/SCOTCH   3.72 3 3 0 3      11.16\nCR-CHOCLT          0.72 20 0 0 20    14.40\nCR-B'SCOTCH        0.72 0 7 0 -7     -5.04\n\nTotal 6% supplies (excl. GST): 20.52\nGST:                           1.23\nTotal 6% supplies (Inc. GST):  21.75\nTotal 0% supplies:            13.83\nTotal Payable:                35.58\n\nE.& O.E.\nReceived above goods in good order condition.\nThe recipient of Gardenia's products is\nrequired to make necessary adjustments to its\ninput tax claims, on the basic of the\nadjustments shown in this Tax Invoice /\nAdjustment Note\n\nCUSTOMER'S COPY"
  }
}