{
  "merchant": {
    "name": "AA PHARMACY",
    "address": "B-8, Jalan SS15/4D, 47500 Subang Jaya, Selangor",
    "phone": "03-56127718",
    "tax_id": "00185760808",
    "website": ""
  },
  "transaction": {
    "date": "2017-08-11",
    "time": "19:46:00",
    "currency": "MYR",
    "payment_method": "Debit Card",
    "subtotal": 74.06,
    "tax": 4.04,
    "tip": 0.0,
    "total": 78.1,
    "accounting_category": "Healthcare",
    "category_confidence": 0.95
  },
  "items": [
    {
      "name": "Waycare Wound Dressing Waterproof",
      "quantity": 1,
      "unit_price": 57.0,
      "total_price": 57.0,
      "category": "Healthcare",
      "accounting_category": "Wound Care",
      "category_confidence": 0.9
    },
    {
      "name": "Aros Non Woven Swab Alcohol",
      "quantity": 1,
      "unit_price": 5.3,
      "total_price": 5.3,
      "category": "Healthcare",
      "accounting_category": "Swabs",
      "category_confidence": 0.9
    },
    {
      "name": "Pan Mate Cotton Buds",
      "quantity": 3,
      "unit_price": 1.7,
      "total_price": 5.1,
      "category": "Healthcare",
      "accounting_category": "Cotton Buds",
      "category_confidence": 0.9
    },
    {
      "name": "Unigloves Sterile Gauze Swab 10cm",
      "quantity": 1,
      "unit_price": 6.0,
      "total_price": 6.0,
      "category": "Healthcare",
      "accounting_category": "Gauze",
      "category_confidence": 0.9
    },
    {
      "name": "Gentamicin Cream",
      "quantity": 1,
      "unit_price": 6.0,
      "total_price": 6.0,
      "category": "Healthcare",
      "accounting_category": "Cream",
      "category_confidence": 0.9
    }
  ],
  "summary": {
    "total_items": 7,
    "rounding": 0.0,
    "change_due": 0.0
  },
  "ocr_metadata": {
    "source_image": "sroie_X51006555570.jpg",
    "extraction_engine": "gpt-4o-vision",
    "model_version": "2024-05-13",
    "confidence": 0.95
  },
  "ocr_raw": {
    "full_text": "SIMPLIFIED TAX INVOICE\nAA PHARMACY\nSUBANG HEALTHCARE SDN BHD\n1110250-K\nGST NO: 00185760808\nB-8, JALAN SS15/4D,\n47500 SUBANG JAYA, SELANGOR\nTEL: 03-56127718\n\nCASH\n\nRECEIPT # : C900224314 DATE: 11/08/2017\nSALESPERSON : TIME: 19:46:00\nCASHIER : C1\n\nITEM QTY U/P AMOUNT\n(GST) (GST)\n\n1394 1 57.00 57.00 S\n(UNIT) WAYCARE WOUND DRESSING WATERPROOF\n20454799531 1 5.30 5.30 S\n(BOX 100S) AROS NON WOVEN SWAB ALCOHOL P\n9557037001047 1 3.90 3.90 S\n(EACH) PAN MATE COTTON BUDS 40DTIPS\n0896 3 1.70 5.10 S\n(UNIT) UNIGLOVES STERILE GAUZE SWAB 10CM\n9556250921084 1 6.00 6.00 Z\n(1 BOX) GENTAMICIN CREAM\n\nTOTAL QUANTITY 7\n\nSUB-TOTAL 74.06\nDISC 0.00\nGST 4.04\nROUNDING 0.00\nTOTAL 78.10\nDEBIT CARD 78.10\nCHANGE 0.00\n\nGOODS SOLD ARE NOT RETURNABLE,\nTHANK YOU.\nS=STANDARD RATED, Z=ZERO RATED\n\nGST SUMMARY\n\nCODE AMOUNT % TAX/AMT\nSR 67.26 6 4.04\nZRL 6.80 0 0.00\n\nTAX TOTAL: 4.04\n"
  }
}