{
  "merchant": {
    "name": "Syarikat Perniagaan Gin Kee",
    "address": "No 290, Jalan Air Panas, Setapak, 53200, Kuala Lumpur",
    "phone": "03-40210276",
    "tax_id": "000750673920",
    "website": ""
  },
  "transaction": {
    "date": "2018-01-25",
    "time": "14:29:00",
    "currency": "MYR",
    "payment_method": "Cash",
    "subtotal": 180.0,
    "tax": 10.8,
    "tip": 0.0,
    "total": 190.8,
    "accounting_category": "Office Supplies",
    "category_confidence": 0.9
  },
  "items": [
    {
      "name": "12MM 4/8B PLYWOOD",
      "quantity": 3,
      "unit_price": 63.6,
      "total_price": 190.8,
      "category": "Office Supplies",
      "accounting_category": "Office Supplies",
      "category_confidence": 0.9
    }
  ],
  "summary": {
    "total_items": 3,
    "rounding": 0.0,
    "change_due": 0.0
  },
  "ocr_metadata": {
    "source_image": "sroie_X51005675104.jpg",
    "extraction_engine": "gpt-4o-vision",
    "model_version": "2024-05-13",
    "confidence": 0.95
  },
  "ocr_raw": {
    "full_text": "SYARIKAT PERNIAGAAN GIN KEE (81109-A)\nNO 290, JALAN AIR PANAS, SETAPAK,\n53200, KUALA LUMPUR.\nTEL : 03-40210276\nGST ID : 000750673920\nSIMPLIFIED TAX INVOICE\nCASH\nDoc No : CS00012944\tDate: 25/01/2018\nCashier : USER\tTime : 14:29:00\nSalesperson :\tRef. :\nItem\tQty\tS/Price\tAmount\tTax\n1007\t3\t63.60\t190.80\tSR\n12MM 4/8B PLYWOOD\nTotal Qty: 3\t190.80\nTotal Sales (Excluding GST) :\t\t180.00\nDiscount :\t\t0.00\nTotal GST :\t\t10.80\nRounding :\t\t0.00\nTotal Sales (Inclusive of GST) :\t190.80\nCASH :\t190.80\nChange :\t0.00\nGST SUMMARY\nTax Code\t%\tAmt (RM)\t Tax (RM)\nSR\t6\t180.00\t10.80\nTotal :\t180.00\t10.80\nGOODS SOLD ARE NOT RETURNABLE. THANK YOU."
  }
}