{
  "merchant": {
    "name": "Gardenia Bakeries (KL) Sdn Bhd",
    "address": "Lot 3, Jalan Pelabur 23/1, 40300 Shah Alam, Selangor",
    "phone": "03-55423226",
    "tax_id": "000381399040",
    "website": ""
  },
  "transaction": {
    "date": "2017-08-31",
    "time": "12:17:00",
    "currency": "MYR",
    "payment_method": "",
    "subtotal": 13.32,
    "tax": 0.8,
    "tip": 0.0,
    "total": 1.52,
    "accounting_category": "Bakery",
    "category_confidence": 0.9
  },
  "items": [
    {
      "name": "O.C. White",
      "quantity": 2,
      "unit_price": 2.13,
      "total_price": 4.26,
      "category": "Bread",
      "accounting_category": "Bakery",
      "category_confidence": 0.9
    },
    {
      "name": "Wholemeal",
      "quantity": 3,
      "unit_price": 2.78,
      "total_price": 8.34,
      "category": "Bread",
      "accounting_category": "Bakery",
      "category_confidence": 0.9
    },
    {
      "name": "CR-Corn",
      "quantity": 8,
      "unit_price": 0.72,
      "total_price": 5.76,
      "category": "Pastry",
      "accounting_category": "Bakery",
      "category_confidence": 0.9
    },
    {
      "name": "Bun-Sbilis",
      "quantity": 9,
      "unit_price": 0.84,
      "total_price": 7.56,
      "category": "Pastry",
      "accounting_category": "Bakery",
      "category_confidence": 0.9
    }
  ],
  "summary": {
    "total_items": 22,
    "rounding": 0.0,
    "change_due": 0.0
  },
  "ocr_metadata": {
    "source_image": "sroie_X51006555833.jpg",
    "extraction_engine": "gpt-4o-vision",
    "model_version": "2024-05-13",
    "confidence": 0.95
  },
  "ocr_raw": {
    "full_text": "GARDENIA BAKERIES (KL) SDN BHD (139386 X)\nLot 3, Jalan Pelabur 23/1,\n40300 Shah Alam, Selangor.\nTel: 03-55423226 Fax:03-55423213\nGST ID: 000381399040\nTAX INVOICE / ADJUSTMENT NOTE\nCash Inv No.: 7831F712\nDate: 31/08/2017\nVE0514\nMAKASSAR FRESH MARKET SDN BHD\nGROUND FLOOR, NO. 4 & 6,\nJALAN SS 15/4B,\n47500 SUBANG JAYA, SELANGOR\nVE05: Ridzuan (11900)\nDD: 31/08/2017 12:17\nDescription U.P Iss Exc D Sale Amt(RM)\nO.C. WHITE 2.13 0 4.26\nWHOLEMEAL 2.78 3 8.34\nTotal 0% supplies: -12.60\nCR-CORN 0.72 15 5.76\nBUN-SBILIS 0.84 8 7.56\nTotal 6% supplies (excl. GST): 13.32\nGST: 0.80\nTotal 6% supplies (Inc. GST): 14.12\nTotal 0% supplies: -12.60\nTotal Payable: 1.52\nE.&O.E.\nReceived above goods in good order condition.\nThe recipient of Gardenia's products is\nrequired to make necessary adjustments to its\ninput tax claims, on the basis of the\nadjustments shown in this Tax Invoice /\nAdjustment Note\nCUSTOMER'S COPY"
  }
}