{
  "merchant": {
    "name": "Gardenia Bakeries (KL) Sdn Bhd",
    "address": "Lot 3, Jalan Pelabur 23/1, 40300 Shah Alam, Selangor",
    "phone": "03-55423228",
    "tax_id": "000381399040",
    "website": ""
  },
  "transaction": {
    "date": "2017-10-18",
    "time": "11:18:00",
    "currency": "MYR",
    "payment_method": "",
    "subtotal": 30.32,
    "tax": 0.73,
    "tip": 0.0,
    "total": 31.05,
    "accounting_category": "groceries",
    "category_confidence": 0.9
  },
  "items": [
    {
      "name": "O.C. White",
      "quantity": 3,
      "unit_price": 2.13,
      "total_price": 6.39,
      "category": "food",
      "accounting_category": "groceries",
      "category_confidence": 0.9
    },
    {
      "name": "Wholemeal",
      "quantity": 1,
      "unit_price": 2.78,
      "total_price": 2.78,
      "category": "food",
      "accounting_category": "groceries",
      "category_confidence": 0.9
    },
    {
      "name": "O.C Jumbo",
      "quantity": 3,
      "unit_price": 2.97,
      "total_price": 8.91,
      "category": "food",
      "accounting_category": "groceries",
      "category_confidence": 0.9
    },
    {
      "name": "CR-CHOCLT",
      "quantity": 20,
      "unit_price": 0.72,
      "total_price": 14.4,
      "category": "food",
      "accounting_category": "groceries",
      "category_confidence": 0.9
    },
    {
      "name": "CR-CORN",
      "quantity": 3,
      "unit_price": 0.72,
      "total_price": 2.16,
      "category": "food",
      "accounting_category": "groceries",
      "category_confidence": 0.9
    }
  ],
  "summary": {
    "total_items": 5,
    "rounding": 0.0,
    "change_due": 0.0
  },
  "ocr_metadata": {
    "source_image": "sroie_X51006557164.jpg",
    "extraction_engine": "gpt-4o-vision",
    "model_version": "2024-05-13",
    "confidence": 0.95
  },
  "ocr_raw": {
    "full_text": "GARDENIA BAKERIES (KL) SDN BHD (139386 X)\nLot 3, Jalan Pelabur 23/1, 40300 Shah Alam, Selangor.\nTel: 03-55423228 Fax: 03-55423213\nGST ID: 000381399040\nTAX INVOICE / ADJUSTMENT NOTE\nCash Inv No.: 7018F712\nDate: 18/10/2017\nMAKASSAR FRESH MARKET SDN BHD\nGROUND FLOOR, NO. 4 & 6, JALAN SS 15/4B,\n47500 SUBANG JAYA, S'LANGOR\nVE05: Ridzuan (11900)\nDD: 18/10/2017 11:18\nDescription U. P Iss Exc D Sale Amt(RM)\nO.C. WHITE 2.13 3 0 3 6.39\nWHOLEMEAL 2.78 3 0 1 2.78\nO.C. JUMBO 2.97 4 1 3 8.91\nTotal 0% supplies: 18.08\nCR-CHOCLT 0.72 20 20 0 20 14.40\nCR-CORN 0.72 3 3 0 3 2.16\nTotal 6% supplies (excl. GST): 12.24\nGST: 0.73\nTotal 6% supplies (Inc. GST): 12.97\nTotal 0% supplies: 18.08\nTotal Payable: 31.05\nE.&O.E.\nReceived above goods in good order condition.\nThe recipient of Gardenia's products is required to make necessary adjustments to its input tax claims, on the basic of the adjustments shown in this Tax Invoice / Adjustment Note\nCUSTOMER'S COPY"
  }
}