{
  "merchant": {
    "name": "Gardenia Bakeries (KL) Sdn Bhd",
    "address": "Lot 3, Jalan Pelabur 23/1, 40300 Shah Alam, Selangor",
    "phone": "03-55423228",
    "tax_id": "000381399040",
    "website": ""
  },
  "transaction": {
    "date": "2017-10-30",
    "time": "12:30:00",
    "currency": "MYR",
    "payment_method": "",
    "subtotal": 60.57,
    "tax": 2.03,
    "tip": 0.0,
    "total": 62.6,
    "accounting_category": "Groceries",
    "category_confidence": 0.9
  },
  "items": [
    {
      "name": "O.C. White",
      "quantity": 3,
      "unit_price": 2.13,
      "total_price": 6.39,
      "category": "Groceries",
      "accounting_category": "Bakery",
      "category_confidence": 0.9
    },
    {
      "name": "Wholemeal",
      "quantity": 3,
      "unit_price": 2.78,
      "total_price": 8.34,
      "category": "Groceries",
      "accounting_category": "Bakery",
      "category_confidence": 0.9
    },
    {
      "name": "O.C. Jumbo",
      "quantity": 4,
      "unit_price": 2.97,
      "total_price": 11.88,
      "category": "Groceries",
      "accounting_category": "Bakery",
      "category_confidence": 0.9
    },
    {
      "name": "Delicia-B/Scotch",
      "quantity": 3,
      "unit_price": 3.72,
      "total_price": 11.16,
      "category": "Groceries",
      "accounting_category": "Bakery",
      "category_confidence": 0.9
    },
    {
      "name": "CR-CHoclt",
      "quantity": 2,
      "unit_price": 7.2,
      "total_price": 14.4,
      "category": "Groceries",
      "accounting_category": "Bakery",
      "category_confidence": 0.9
    },
    {
      "name": "Bun-Sbilis",
      "quantity": 10,
      "unit_price": 0.84,
      "total_price": 8.4,
      "category": "Groceries",
      "accounting_category": "Bakery",
      "category_confidence": 0.9
    }
  ],
  "summary": {
    "total_items": 6,
    "rounding": 0.0,
    "change_due": 0.0
  },
  "ocr_metadata": {
    "source_image": "sroie_X51006557117.jpg",
    "extraction_engine": "gpt-4o-vision",
    "model_version": "2024-05-13",
    "confidence": 0.95
  },
  "ocr_raw": {
    "full_text": "GARDENIA BAKERIES (KL) SDN BHD (1.99386 X)\nLot 3, Jalan Pelabur 23/1,\n40300 Shah Alam, Selangor.\nTel: 03-55423228 Fax: 03-55423213\nGST ID: 000381399040\n\nTAX INVOICE / ADJUSTMENT NOTE\nCash Inv No.: 7030F715\nDate: 30/10/2017\nMAKASSAR FRESH MARKET SDN BHD\nGROUND FLOOR, NO. 4 & 6,\nJALAN SS 15/4B,\n47500 SUBANG JAYA, SELANGOR\n\nDD: 30/10/2017 12:30\nDescription U/P Iss Exc D Sale Amt(RM)\nO.C. WHITE 2.13 3 0 3 6.39\nWHOLEMEAL 2.78 3 0 3 8.34\nO.C JUMBO 2.97 4 0 4 11.88\n\nTotal 0% supplies: 26.61\nDELlClA-B/SCOTCH 3.72 3 0 3 11.16\nCR-CHOCLT 3.72 20 0 20 14.40\nBUN-SBILIS 0.84 10 0 10 8.40\n\nTotal 6% supplies (excl. GST): 33.96\nGST: 2.03\nTotal 6% supplies (inc. GST): 35.99\nTotal 0% supplies: 26.61\nTotal Payable: 62.60\nCUSTOMER'S COPY"
  }
}