{
  "merchant": {
    "name": "Gardenia Bakeries (KL) Sdn Bhd",
    "address": "Lot 3, Jalan Pelabur 23/1, 40300 Shah Alam, Selangor",
    "phone": "03-55423228",
    "tax_id": "000381399040",
    "website": ""
  },
  "transaction": {
    "date": "2017-09-02",
    "time": "12:57:00",
    "currency": "MYR",
    "payment_method": "",
    "subtotal": 47.97,
    "tax": 0.6,
    "tip": 0.0,
    "total": 48.57,
    "accounting_category": "Retail",
    "category_confidence": 0.95
  },
  "items": [
    {
      "name": "O.C. White",
      "quantity": 15,
      "unit_price": 2.13,
      "total_price": 31.95,
      "category": "Bakery",
      "accounting_category": "Food",
      "category_confidence": 0.95
    },
    {
      "name": "O.C. Jumbo",
      "quantity": 2,
      "unit_price": 2.97,
      "total_price": 5.94,
      "category": "Bakery",
      "accounting_category": "Food",
      "category_confidence": 0.95
    },
    {
      "name": "CR-Vanilla",
      "quantity": 8,
      "unit_price": 0.72,
      "total_price": 5.76,
      "category": "Bakery",
      "accounting_category": "Food",
      "category_confidence": 0.95
    },
    {
      "name": "CR-Corn",
      "quantity": 12,
      "unit_price": 0.72,
      "total_price": 8.64,
      "category": "Bakery",
      "accounting_category": "Food",
      "category_confidence": 0.95
    },
    {
      "name": "Kaya-Pandan",
      "quantity": 3,
      "unit_price": 2.4,
      "total_price": 7.2,
      "category": "Bakery",
      "accounting_category": "Food",
      "category_confidence": 0.95
    }
  ],
  "summary": {
    "total_items": 40,
    "rounding": 0.0,
    "change_due": 0.0
  },
  "ocr_metadata": {
    "source_image": "sroie_X51006556821.jpg",
    "extraction_engine": "gpt-4o-vision",
    "model_version": "2024-05-13",
    "confidence": 0.95
  },
  "ocr_raw": {
    "full_text": "GARDENIA BAKERIES (KL) SDN BHD (139386 X)\nLot 3, Jalan Pelabur 23/1, 40300 Shah Alam, Selangor.\nTel: 03-55423228 Fax:03-55423213\nGST ID: 000381399040\nTAX INVOICE / ADJUSTMENT NOTE\nCash Inv No.: 7902F755\nVE0514 Date: 02/09/2017\nMAKASSAR FRESH MARKET SDN BHD\nGROUND FLOOR, NO. 4 & 6, JALAN SS 15/4B, 47500 SUBANG JAYA, SELANGOR\nVE05: Ridzuan (11900)\nDD: 02/09/2017 12:57\nDescription U.P Iss Exc. D Sale Amt(RM)\nO.C. WHITE 2.13 15 0 0 15 31.95\nO.C. JUMBO 2.97 2 0 0 2 5.94\nTotal 0% supplies: 37.89\nCR-VANILLA 0.72 0 8 0 8 -5.76\nCR-CORN 0.72 3 0 9 12 8.64\nKAYA-PANDAN 2.40 3 0 0 3 7.20\nTotal 6% supplies (excl. GST): 10.08\nGST: 0.60\nTotal 6% supplies (Inc. GST): 10.68\nTotal 0% supplies: 37.89\nTotal Payable: 48.57\nE.&O.E.\nReceived above goods in good order condition.\nThe recipient of Gardenia's products is required to make necessary adjustments to its input tax claims, on the basic of the adjustments shown in this Tax Invoice / Adjustment Note\nCUSTOMER'S COPY"
  }
}