{
  "merchant": {
    "name": "Gardenia Bakeries (KL) Sdn Bhd",
    "address": "Lot 3, Jalan Pelabur 23/1, 40300 Shah Alam, Selangor",
    "phone": "03-55423228",
    "tax_id": "000381399040",
    "website": ""
  },
  "transaction": {
    "date": "2017-10-27",
    "time": "11:00:00",
    "currency": "MYR",
    "payment_method": "",
    "subtotal": 34.8,
    "tax": 0.56,
    "tip": 0.0,
    "total": 35.88,
    "accounting_category": "Groceries",
    "category_confidence": 0.9
  },
  "items": [
    {
      "name": "O.C. WHITE",
      "quantity": 4,
      "unit_price": 2.13,
      "total_price": 8.52,
      "category": "Bread",
      "accounting_category": "Groceries",
      "category_confidence": 0.9
    },
    {
      "name": "WHOLEMEAL",
      "quantity": 2,
      "unit_price": 2.78,
      "total_price": 5.56,
      "category": "Bread",
      "accounting_category": "Groceries",
      "category_confidence": 0.9
    },
    {
      "name": "O.C JUMBO",
      "quantity": 4,
      "unit_price": 2.97,
      "total_price": 11.88,
      "category": "Bread",
      "accounting_category": "Groceries",
      "category_confidence": 0.9
    },
    {
      "name": "CR-CHOCLT",
      "quantity": 13,
      "unit_price": 0.72,
      "total_price": 9.36,
      "category": "Bread",
      "accounting_category": "Groceries",
      "category_confidence": 0.9
    }
  ],
  "summary": {
    "total_items": 4,
    "rounding": 0.0,
    "change_due": 0.0
  },
  "ocr_metadata": {
    "source_image": "sroie_X51006557507.jpg",
    "extraction_engine": "gpt-4o-vision",
    "model_version": "2024-05-13",
    "confidence": 0.95
  },
  "ocr_raw": {
    "full_text": "GARDENIA BAKERIES (KL) SDN BHD (139386 X)\nLot 3, Jalan Pelabur 23/1,\n40300 Shah Alam, Selangor.\nTel: 03-55423228 Fax: 03-55423213\nGST ID: 000381399040\nTAX INVOICE / ADJUSTMENT NOTE\nCash Inv No.: 7027F715\nDate: 27/10/2017\nVEO514\nMAKASSAR FRESH MARKET SDN BHD\nGROUND FLOOR, NO. 4 & 6,\nJALAN SS 15/4B,\n47500 SUBANG JAYA, SELANGOR\nVE05: Ridzuan (11900)\nDD: 27/10/2017 11:00\nDescription U.P Iss Exc D Sale Amt(RM)\nO.C. WHITE 2.13 4 0 0 4 8.52\nWHOLEMEAL 2.78 3 1 0 4 5.56\nO.C JUMBO 2.97 4 0 0 4 11.88\nTotal 0% supplies: 25.96\nCR-CHOCLT 0.72 20 7 0 13 9.36\nTotal 6% supplies (excl. GST): 9.36\nGST: 0.56\nTotal 6% supplies (Inc. GST): 9.92\nTotal 0% supplies: 25.96\nTotal Payable: 35.88\nE.& O.E.\nReceived above goods in good order condition.\nThe recipient of Gardenia’s products is\nrequired to make necessary adjustments to its\ninput tax claims, on the basic of the\nadjustments shown in this Tax Invoice / Adjustment Note\nCUSTOMER’S COPY"
  }
}