{
  "merchant": {
    "name": "Gardenia Bakeries (KL) Sdn Bhd",
    "address": "Lot 3, Jalan Pelabur 23/1, 40300 Shah Alam, Selangor.",
    "phone": "03-55423228",
    "tax_id": "000381399040",
    "website": ""
  },
  "transaction": {
    "date": "2017-10-09",
    "time": "12:36:00",
    "currency": "MYR",
    "payment_method": "",
    "subtotal": 57.85,
    "tax": 2.39,
    "tip": 0.0,
    "total": 60.24,
    "accounting_category": "Groceries",
    "category_confidence": 0.9
  },
  "items": [
    {
      "name": "O.C. WHITE",
      "quantity": 3,
      "unit_price": 2.13,
      "total_price": 6.39,
      "category": "Bakery",
      "accounting_category": "Food",
      "category_confidence": 0.9
    },
    {
      "name": "WHOLEMEAL",
      "quantity": 2,
      "unit_price": 2.78,
      "total_price": 5.56,
      "category": "Bakery",
      "accounting_category": "Food",
      "category_confidence": 0.9
    },
    {
      "name": "O.C JUMBO",
      "quantity": 2,
      "unit_price": 2.97,
      "total_price": 5.94,
      "category": "Bakery",
      "accounting_category": "Food",
      "category_confidence": 0.9
    },
    {
      "name": "DELICIA-B/SCOTCH",
      "quantity": 3,
      "unit_price": 3.72,
      "total_price": 11.16,
      "category": "Bakery",
      "accounting_category": "Food",
      "category_confidence": 0.9
    },
    {
      "name": "CR-CHOCLT",
      "quantity": 20,
      "unit_price": 0.72,
      "total_price": 14.4,
      "category": "Bakery",
      "accounting_category": "Food",
      "category_confidence": 0.9
    },
    {
      "name": "CR-B'SCOTCH",
      "quantity": 20,
      "unit_price": 0.72,
      "total_price": 14.4,
      "category": "Bakery",
      "accounting_category": "Food",
      "category_confidence": 0.9
    }
  ],
  "summary": {
    "total_items": 50,
    "rounding": 0.0,
    "change_due": 0.0
  },
  "ocr_metadata": {
    "source_image": "sroie_X51006557199.jpg",
    "extraction_engine": "gpt-4o-vision",
    "model_version": "2024-05-13",
    "confidence": 0.95
  },
  "ocr_raw": {
    "full_text": "GARDENIA BAKERIES (KL) SDN BHD (139386 X)\nLot 3, Jalan Pelabur 23/1,\n40300 Shah Alam, Selangor.\nTel: 03-55423228 Fax:03-55423213\nGST ID: 000381399040\nTAX INVOICE / ADJUSTMENT NOTE\nCash Inv No.: 7009F714\nDate: 09/10/2017\nVI 1\nMAKASSAR FRESH MARKET SDN BHD\nGROUND FLOOR, NO. 4 & 6,\nJALAN SS 15/4B,\n47500 SUBANG JAYA, SELANGOR\nVE05: Ridzuan (11900)\nDD: 09/10/2017 12:36\nDescription U.P Iss Exc D Sale Amt(RM)\nO.C. WHITE 2.13 3 6.39\nWHOLEMEAL 2.78 2 5.56\nO.C JUMBO 2.97 2 5.94\nTotal 0% supplies: 17.89\nDELICIA-B/SCOTCH 3.72 3 11.16\nCR-CHOCLT 0.72 20 14.40\nCR-B'SCOTCH 0.72 20 14.40\nTotal 6% supplies (excl. GST): 39.96\nGST: 2.39\nTotal 6% supplies (Inc. GST): 42.35\nTotal 0% supplies: 17.89\nTotal Payable: 60.24\nE.&O.E.\nReceived above goods in good order condition.\nThe recipient of Gardenia's products is\nrequired to make necessary adjustments to its\ninput tax claims, on the basic of the\nadjustments shown in this Tax Invoice /\nAdjustment Note\nCUSTOMER'S COPY"
  }
}