{
  "merchant": {
    "name": "Gardenia Bakeries (KL) Sdn Bhd",
    "address": "Lot 3, Jalan Pelabur 23/1, 40300 Shah Alam, Selangor.",
    "phone": "03-55423228",
    "tax_id": "000381399040",
    "website": ""
  },
  "transaction": {
    "date": "2017-10-10",
    "time": "12:07:00",
    "currency": "MYR",
    "payment_method": "",
    "subtotal": 27.68,
    "tax": 1.65,
    "tip": 0.0,
    "total": 27.2,
    "accounting_category": "Purchase",
    "category_confidence": 0.9
  },
  "items": [
    {
      "name": "O.C. WHITE",
      "quantity": 1,
      "unit_price": 2.13,
      "total_price": -2.13,
      "category": "Food",
      "accounting_category": "Goods",
      "category_confidence": 0.9
    },
    {
      "name": "WHOLEMEAL",
      "quantity": 0,
      "unit_price": 2.78,
      "total_price": 0.0,
      "category": "Food",
      "accounting_category": "Goods",
      "category_confidence": 0.9
    },
    {
      "name": "O.C JUMBO",
      "quantity": 0,
      "unit_price": 2.97,
      "total_price": 0.0,
      "category": "Food",
      "accounting_category": "Goods",
      "category_confidence": 0.9
    },
    {
      "name": "DELICIA-B/SCOTCH",
      "quantity": 2,
      "unit_price": 3.72,
      "total_price": 7.44,
      "category": "Food",
      "accounting_category": "Goods",
      "category_confidence": 0.9
    },
    {
      "name": "CR-CORN",
      "quantity": 20,
      "unit_price": 0.72,
      "total_price": 14.4,
      "category": "Food",
      "accounting_category": "Goods",
      "category_confidence": 0.9
    },
    {
      "name": "SQ-CHOCLT",
      "quantity": 11,
      "unit_price": 0.84,
      "total_price": 9.24,
      "category": "Food",
      "accounting_category": "Goods",
      "category_confidence": 0.9
    },
    {
      "name": "TWIG-C.DRM",
      "quantity": 8,
      "unit_price": 1.33,
      "total_price": 10.64,
      "category": "Food",
      "accounting_category": "Goods",
      "category_confidence": 0.9
    }
  ],
  "summary": {
    "total_items": 7,
    "rounding": 0.0,
    "change_due": 0.0
  },
  "ocr_metadata": {
    "source_image": "sroie_X51006557198.jpg",
    "extraction_engine": "gpt-4o-vision",
    "model_version": "2024-05-13",
    "confidence": 0.95
  },
  "ocr_raw": {
    "full_text": "GARDENIA BAKERIES (KL) SDN BHD (139386 X)\nLot 3, Jalan Pelabur 23/1,\n40300 Shah Alam, Selangor.\nTel: 03-55423228 Fax:03-55423213\nGST ID: 000381399040\nTAX INVOICE / ADJUSTMENT NOTE\nCash Inv No.: 7010F714\nDate: 10/10/2017\n....................................... ...---wovouuunmesenen emrenmrcenmnecueneemmmurmeranae mu emeeen mw ren \nMAKASSAR FRESH MARKET SDN BHD\nGROUND FLOOR, NO. 4 & 6,\nJALAN SS 15/4B,\n47500 SUBANG JAYA, SELANGOR\nVE05: Ridzuan (11900)\nDD: 10/10/2017 12:07\nDescription U.P Iss Exc D Sale Amt(RM\nO.C. WHITE 2.13 3 4 0 -1 .2.13\nWHOLEMEAL 2.78 3 3 0 0 0.00\nO.C JUMBO 2.97 3 3 0 0 0.00\nTotal 0% supplies: -2.13\nDELICIA-B/SCOTCH 3.72 O. -2 -7.44\nCR-CORN 0.72 20 26 14.40\nSQ-CHOCLT 0.84 20 22 9.24\nTWIG-C.DRM 1.33 8 8 10.64\nTotal 6% supplies (excl. GST): 27.68\nGST: 1.65\n----------------------------------------------------------\nTotal 6% supplies (Inc. GST): 29.33\nTotal O% supplies: -2.13\nTotal Payable: 27.20\nE.&O.E.\nReceived above goods in good order condition.\nThe recipient of Gardenia's products is\nrequired to make necessary adjustments to its\ninput tax claims, on the basic of the\nadjustments shown in this Tax Invoice /\nAdjustment Note\nCUSTOMER'S COPY"
  }
}