{
  "merchant": {
    "name": "GARDENIA BAKERIES (KL) SDN BHD",
    "address": "Lot 3, Jalan Pelabur 23/1, 40300 Shah Alam, Selangor",
    "phone": "03-55423228",
    "tax_id": "000381399040",
    "website": ""
  },
  "transaction": {
    "date": "2017-09-14",
    "time": "11:40:00",
    "currency": "MYR",
    "payment_method": "",
    "subtotal": 25.84,
    "tax": 0.46,
    "tip": 0.0,
    "total": 25.84,
    "accounting_category": "Supplies",
    "category_confidence": 0.9
  },
  "items": [
    {
      "name": "O.C. WHITE",
      "quantity": 3,
      "unit_price": 2.13,
      "total_price": 6.39,
      "category": "Bakery",
      "accounting_category": "Food",
      "category_confidence": 0.9
    },
    {
      "name": "WHOLEMEAL",
      "quantity": 3,
      "unit_price": 2.78,
      "total_price": 8.34,
      "category": "Bakery",
      "accounting_category": "Food",
      "category_confidence": 0.9
    },
    {
      "name": "O.C. JIMBO",
      "quantity": 1,
      "unit_price": 2.97,
      "total_price": 2.97,
      "category": "Bakery",
      "accounting_category": "Food",
      "category_confidence": 0.9
    },
    {
      "name": "CR-B'SCOTCH",
      "quantity": -1,
      "unit_price": 0.72,
      "total_price": -0.72,
      "category": "Bakery",
      "accounting_category": "Food",
      "category_confidence": 0.9
    },
    {
      "name": "BUN-SB'ILIS",
      "quantity": 10,
      "unit_price": 0.84,
      "total_price": 8.4,
      "category": "Bakery",
      "accounting_category": "Food",
      "category_confidence": 0.9
    }
  ],
  "summary": {
    "total_items": 5,
    "rounding": 0.0,
    "change_due": 0.0
  },
  "ocr_metadata": {
    "source_image": "sroie_X51006556812.jpg",
    "extraction_engine": "gpt-4o-vision",
    "model_version": "2024-05-13",
    "confidence": 0.95
  },
  "ocr_raw": {
    "full_text": "GARDENIA BAKERIES (KL) SDN BHD (139386 X)\nLot 3, Jalan Pelabur 23/1,\n40300 Shah Alam, Selangor.\nTel: 03-55423228 Fax:03-55423213\nGST ID: 000381399040\nTAX INVOICE / ADJUSTMENT NOTE\nCash Inv No.: 7914F713\nDate: 14/09/2017\nMAKASSAR FRESH MARKET SDN BHD\nGROUND FLOOR, NO. 4 & 6,\nJALAN SS 15/4B,\n47500 SUBANG JAYA, SELANGOR\nVEOS: Ridzuan (11900)\nDD: 14/09/2017 11:40\nDescription U.P Iss Exc 0 Sale Amt(RM)\nO.C. WHITE 2.13 6 3 0 3 6.39\nWHOLEMEAL 2.78 3 3 0 3 8.34\nO.C JIMBO 2.97 3 3 0 1 2.97\nTotal 0% supplies: 17.70\nCR-B'SCOTCH 0.72 0 1 0 -1 -0.72\nBUN-SB'ILIS 0.84 10 0 0 10 8.40\nTotal 6% supplies (excl. GST): 7.68\nGST: 0.46\nTotal 6% supplies (Inc. GST) 8.14\nTotal 0% supplies: 17.70\nTotal Payable: 25.84\nCUSTOMER'S COPY"
  }
}