{
  "merchant": {
    "name": "DOMINO'S PIZZA",
    "address": "D-08, M Avenue, Jln 1 / 38A, Segambut Bahagia, 51200 Kuala Lumpur",
    "phone": "1-300-888-333",
    "tax_id": "001694261248",
    "website": "www.dominos.com.my"
  },
  "transaction": {
    "date": "2018-03-26",
    "time": "12:54:37",
    "currency": "MYR",
    "payment_method": "CASH",
    "subtotal": 60.6,
    "tax": 1.87,
    "tip": 0.0,
    "total": 33.0,
    "accounting_category": "Food & Beverage",
    "category_confidence": 0.9
  },
  "items": [
    {
      "name": "9\"HT (BQ) 2P2C-R",
      "quantity": 1,
      "unit_price": 30.3,
      "total_price": 30.3,
      "category": "Pizza",
      "accounting_category": "Food",
      "category_confidence": 0.9
    },
    {
      "name": "9\"NYC (CP) 2P2C-R",
      "quantity": 1,
      "unit_price": 30.3,
      "total_price": 30.3,
      "category": "Pizza",
      "accounting_category": "Food",
      "category_confidence": 0.9
    }
  ],
  "summary": {
    "total_items": 2,
    "rounding": 0.0,
    "change_due": 17.0
  },
  "ocr_metadata": {
    "source_image": "sroie_X51005719917.jpg",
    "extraction_engine": "gpt-4o-vision",
    "model_version": "2024-05-13",
    "confidence": 0.95
  },
  "ocr_raw": {
    "full_text": "TAX INVOICE\nDOMINO'S PIZZA\nGST REF NO : 001694261248\nDOMINO'S PIZZA SEGAMBUT\nD-08, M Avenue , Jln 1 / 38A\nSegambut Bahagia\n51200 Kuala Lumpur\n\nCARRY OUT NOW              Pay By: CASH\nOrder    : 1955   By   : 5224\nOrder Time : 12:54:37   Date : 26/03/18\nName: MS YING\nPickup Time: 13:09:37\nQty Menu Desc Coupon Disc  Price\n1  9\"HT  (BQ) 2P2C-R  30.30\n1  9\"NYC (CP) 2P2C-R  30.30\nTotal Items:\n\nSub-Total : 60.60\nCoupon Discount : 27.60\nGrand Total : 33.00\nPayment : 50.00\nChange Due : 17.00\n*6% GST Included : 1.87\n\nSUPPORT OUR SMILE CAMPAIGN : )\nDid we smile at you?\nLet us know at\nwww.dominos.com.my/smile and\nreceive a 30% off side item e-coupon\nupon survey submission\nSurvey Code: CBC261940195554\n\nThank you for visiting Dominoâ€™s.\nPlease Come Again!\n\n1 - 3 0 0 - 8 8 8 - 3 3 3\nwww.dominos.com.my\n\nWe are compliant to the PDPA 2010.\nVisit www.dominos.com.my/terms\nto view our Personal Data\nProtection Policy.\n\nOwned by\nDommal Food Services Sdn Bhd\nCo. No. 419060-A"
  }
}