{
  "merchant": {
    "name": "Beyond Brothers Hardware",
    "address": "LOT 1-0-2, JLN 1/50, DIAMOND SQUARE, OFF JLN GOMBAK, 53000 KUALA LUMPUR",
    "phone": "03-40211233",
    "tax_id": "001921974272",
    "website": ""
  },
  "transaction": {
    "date": "2018-03-14",
    "time": "16:37:00",
    "currency": "MYR",
    "payment_method": "Cash",
    "subtotal": 565.5,
    "tax": 33.93,
    "tip": 0.0,
    "total": 599.45,
    "accounting_category": "Supplies",
    "category_confidence": 0.9
  },
  "items": [
    {
      "name": "BATU CEMENT (A) 600PCS",
      "quantity": 1,
      "unit_price": 150.0,
      "total_price": 159.0,
      "category": "Building Materials",
      "accounting_category": "Supplies",
      "category_confidence": 0.9
    },
    {
      "name": "PASIR HALUS",
      "quantity": 2,
      "unit_price": 80.0,
      "total_price": 169.6,
      "category": "Building Materials",
      "accounting_category": "Supplies",
      "category_confidence": 0.9
    },
    {
      "name": "YTL CEMENT 50KG (NEW PRICE)",
      "quantity": 6,
      "unit_price": 16.0,
      "total_price": 101.76,
      "category": "Building Materials",
      "accounting_category": "Supplies",
      "category_confidence": 0.9
    },
    {
      "name": "KAPUR A1",
      "quantity": 1,
      "unit_price": 3.0,
      "total_price": 3.18,
      "category": "Building Materials",
      "accounting_category": "Supplies",
      "category_confidence": 0.9
    },
    {
      "name": "SALUNG TANGAN SETAH (PAIR)",
      "quantity": 1,
      "unit_price": 2.0,
      "total_price": 2.12,
      "category": "Tools",
      "accounting_category": "Supplies",
      "category_confidence": 0.9
    },
    {
      "name": "BENANG NYLON #18",
      "quantity": 1,
      "unit_price": 1.0,
      "total_price": 1.27,
      "category": "Tools",
      "accounting_category": "Supplies",
      "category_confidence": 0.9
    },
    {
      "name": "GERMANY SUDU PLASTER",
      "quantity": 1,
      "unit_price": 16.0,
      "total_price": 16.96,
      "category": "Tools",
      "accounting_category": "Supplies",
      "category_confidence": 0.9
    },
    {
      "name": "SUDU PLASTER KAYU (NORMAL)",
      "quantity": 1,
      "unit_price": 6.9,
      "total_price": 7.31,
      "category": "Tools",
      "accounting_category": "Supplies",
      "category_confidence": 0.9
    },
    {
      "name": "PAPAN SIMEN (HITAM)",
      "quantity": 1,
      "unit_price": 4.5,
      "total_price": 4.77,
      "category": "Building Materials",
      "accounting_category": "Supplies",
      "category_confidence": 0.9
    },
    {
      "name": "M'MAN RULE TIMBANG 1E",
      "quantity": 1,
      "unit_price": 19.9,
      "total_price": 21.09,
      "category": "Tools",
      "accounting_category": "Supplies",
      "category_confidence": 0.9
    },
    {
      "name": "KERETA TOLAK H/D (OREN)",
      "quantity": 1,
      "unit_price": 100.0,
      "total_price": 106.0,
      "category": "Tools",
      "accounting_category": "Supplies",
      "category_confidence": 0.9
    },
    {
      "name": "PAKU KAYU 1\" (KECIL)",
      "quantity": 1,
      "unit_price": 1.2,
      "total_price": 1.27,
      "category": "Building Materials",
      "accounting_category": "Supplies",
      "category_confidence": 0.9
    }
  ],
  "summary": {
    "total_items": 20,
    "rounding": 0.02,
    "change_due": 0.0
  },
  "ocr_metadata": {
    "source_image": "sroie_X51005663297.jpg",
    "extraction_engine": "gpt-4o-vision",
    "model_version": "2024-05-13",
    "confidence": 0.95
  },
  "ocr_raw": {
    "full_text": "BEYOND BROTHERS HARDWARE\n(872981-V)\nLOT 1-0-2, JLN 1/50, DIAMOND SQUARE,\nOFF JLN GOMBAK\n53000 KUALA LUMPUR\nTEL: 03-40211233 FAX: 03-40223233\nIVAN_KONG12@HOTMAIL.COM\nGST ID: 001921974272\nTAX INVOICE\nBill To:\nPDP UTEK (M) SDN BHD\nSEBELAH PETRONAS\nAMPANG\nNEAR TO KPJ HOSPITAL\n019-2616 281 MR.NEO\nDoc No.: CS00067741 Date: 14/03/2018\nCashier USER Time: 16:37:00\nSalesperson Ref.\nItem: Qty S/Price (GST) S/Price (GST) Amount Tax\n11028 1 150.00 159.00 159.00 SR\nBATU CEMENT (A) 600PCS\n11046 2 80.00 84.80 169.60 SR\nPASIR HALUS\n1000 6 16.00 16.96 101.76 SR\nYTL CEMENT 50KG (NEW PRICE)\n11036 1 3.00 3.18 3.18 SR\nKAPUR A1\nSALUNG TANGAN SETAH (PAIR)\n1862 1 2.00 2.12 2.12 SR\nBENANG NYLON #18\n2567 1 16.00 16.96 16.96 SR\nGERMANY SUDU PLASTER\n2564 1 6.90 7.31 7.31 SR\nSUDU PLASTER KAYU (NORMAL)\n2686 1 4.50 4.77 4.77 SR\nPAPAN SIMEN (HITAM)\n1521 1 19.90 21.09 21.09 SR\nM'MAN RULE TIMBANG 1E\n3879 1 100.00 106.00 106.00 SR\nKERETA TOLAK H/D (OREN)\n3416 1 1.20 1.27 1.27 SR\nPAKU KAYU 1\" (KECIL)\nTotal Qty: 20 599.43\nTotal Sales (Excluding GST) 565.50\nDiscount 0.00\nTotal GST 33.93\nRounding 0.02\nTotal Sales (Inclusive of GST) 599.45\nCASH 599.45\nChange 0.00\nGST SUMMARY\nTax Code % Amt(RM) Tax(RM)\nSR 6 565.50 33.93\nTotal: 565.50 33.93"
  }
}