{
  "merchant": {
    "name": "Gardenia Bakeries (KL) Sdn Bhd",
    "address": "Lot 3, Jalan Pelabur 23/1, 40300 Shah Alam, Selangor",
    "phone": "03-55423228",
    "tax_id": "000381399040",
    "website": ""
  },
  "transaction": {
    "date": "2017-07-24",
    "time": "12:44:00",
    "currency": "MYR",
    "payment_method": "Cash",
    "subtotal": 26.28,
    "tax": 0.82,
    "tip": 0.0,
    "total": 27.1,
    "accounting_category": "Groceries",
    "category_confidence": 0.9
  },
  "items": [
    {
      "name": "O.C. White",
      "quantity": 2,
      "unit_price": 2.13,
      "total_price": 4.26,
      "category": "Bakery",
      "accounting_category": "Groceries",
      "category_confidence": 0.9
    },
    {
      "name": "Wholemeal",
      "quantity": 3,
      "unit_price": 2.78,
      "total_price": 8.34,
      "category": "Bakery",
      "accounting_category": "Groceries",
      "category_confidence": 0.9
    },
    {
      "name": "O.C. Jumbo",
      "quantity": 2,
      "unit_price": 2.97,
      "total_price": 5.94,
      "category": "Bakery",
      "accounting_category": "Groceries",
      "category_confidence": 0.9
    },
    {
      "name": "Delicia-B/Scotch",
      "quantity": 2,
      "unit_price": 3.72,
      "total_price": 7.44,
      "category": "Bakery",
      "accounting_category": "Groceries",
      "category_confidence": 0.9
    },
    {
      "name": "CR-Chocli",
      "quantity": 1,
      "unit_price": 0.72,
      "total_price": 0.72,
      "category": "Bakery",
      "accounting_category": "Groceries",
      "category_confidence": 0.9
    },
    {
      "name": "CR-B' Scotch",
      "quantity": 2,
      "unit_price": 3.36,
      "total_price": 6.72,
      "category": "Bakery",
      "accounting_category": "Groceries",
      "category_confidence": 0.9
    },
    {
      "name": "SQ-B Berry",
      "quantity": 1,
      "unit_price": 0.84,
      "total_price": 0.84,
      "category": "Bakery",
      "accounting_category": "Groceries",
      "category_confidence": 0.9
    },
    {
      "name": "Bun-Sbilts",
      "quantity": 1,
      "unit_price": 0.84,
      "total_price": 0.84,
      "category": "Bakery",
      "accounting_category": "Groceries",
      "category_confidence": 0.9
    }
  ],
  "summary": {
    "total_items": 14,
    "rounding": 0.0,
    "change_due": 0.0
  },
  "ocr_metadata": {
    "source_image": "sroie_X51006555818.jpg",
    "extraction_engine": "gpt-4o-vision",
    "model_version": "2024-05-13",
    "confidence": 0.95
  },
  "ocr_raw": {
    "full_text": "GARDENIA BAKERIES (KL) SDN BHD\nLot 3, Jalan Pelabur 23/1,\n40300 Shah Alam, Selangor.\nTel: 03-55423228 Fax: 03-55423213\nGST ID: 000381399040\n\nTAX INVOICE / ADJUSTMENT NOTE\n\nCash Inv No.: 7724F717\nDate: 24/07/2017\n\nMAKASSAR FRESH MARKET SDN BHD\nGROUND FLOOR, NO. 4 & 6,\nJALAN SS 15/4B,\n47500 SUBANG JAYA, SELANGOR\nVE05: Ridzuan(1900)\n\nDD: 24/07/2017 12:44\n\nDescription U.P Iss Exc D Sale Amt(RM)\n\nO.C. WHITE 2.13 5 3 0 2 4.26\nWHOLEMEAL 2.78 3 3 2 3 8.34\nO.C JUMBO 2.97 3 3 2 2 5.94\n\nTotal 0% supplies: 12.60\n\nDELICIA-B/SCOTCH 3.72 3 3 2 2 7.44\nCR-CHOCLI 0.72 16 0 16 1 0.72\nCR-B'SCOTCH 0.72 10 0 10 2 6.72\nSQ-B.BERRY 0.84 0 10 0 10 0.84\nBUN-SBILTS 0.84 0 10 0 10 0.84\n\nTotal 6% supplies (excl. GST): 13.68\nGST: 0.82\n\nTotal 6% supplies (Inc. GST): 14.50\nTotal 0% supplies: 12.60\nTotal Payable: 27.10\n\nCUSTOMER'S COPY"
  }
}