{
  "merchant": {
    "name": "LIGHTROOM GALLERY SDN BHD",
    "address": "No: 28, JALAN ASTANA 1C, BANDAR BUKIT RAJA, 41050 KLANG SELANGOR D.E, MALAYSIA",
    "phone": "03-3362 4395",
    "tax_id": "000584089600",
    "website": ""
  },
  "transaction": {
    "date": "2017-12-20",
    "time": "07:10:35",
    "currency": "MYR",
    "payment_method": "Cash",
    "subtotal": 68.87,
    "tax": 4.13,
    "tip": 0.0,
    "total": 73.0,
    "accounting_category": "Office Supplies",
    "category_confidence": 0.9
  },
  "items": [
    {
      "name": "T5 JOINT 2PIN 2PCS",
      "quantity": 1,
      "unit_price": 2.83,
      "total_price": 2.83,
      "category": "Electrical",
      "accounting_category": "Office Supplies",
      "category_confidence": 0.9
    },
    {
      "name": "YE30 BK 7W WW LED TRACK LIGHT",
      "quantity": 2,
      "unit_price": 33.02,
      "total_price": 66.04,
      "category": "Lighting",
      "accounting_category": "Office Supplies",
      "category_confidence": 0.9
    }
  ],
  "summary": {
    "total_items": 2,
    "rounding": 0.0,
    "change_due": 0.0
  },
  "ocr_metadata": {
    "source_image": "sroie_X51005301661.jpg",
    "extraction_engine": "gpt-4o-vision",
    "model_version": "2024-05-13",
    "confidence": 0.95
  },
  "ocr_raw": {
    "full_text": "LIGHTROOM GALLERY SDN BHD\nNo: 28, JALAN ASTANA 1C,\nBANDAR BUKIT RAJA, 41050\nKLANG SELANGOR D.E, MALAYSIA\nROC No. : (1072825-A)\nGST No.: 000584089600\nTel:03-3362 4395 Fax:03-3362 4395\n\nTAX INVOICE\n\nStation: CASHIER Bill No: LCS03908\nCas r: ANGELA Cover : 1\nBill Date: 20/12/2017\nBill Start: 20/12/2017 07:10:35 PM\n\nCode : 300-C0001\nName : CASH\nAddress :\n\nGST No.\n\nCH50514\nT5 JOINT 2PIN 2PCS\nSR\n1 * RM 2.83 UNI ( 0.17)=RM 2.83\nYT51874\nYE30 BK 7W WW LED TRACK LIGHT\n2 * RM 33.02 UNI ( 3.96)=RM 66.04\nSR\n\nSub Total : RM 68.87\nService Charge : RM 0.00\nGST/TAX 6% : RM 4.13\n\nTOTAL : RM 73.00\nCAL : RM 73.00\nCHANGE : RM 0.00\n\nItem Count: 2\nQty Count : 3.0\n\nClosed Bill: 20/12/2017 07:10:51 PM\n\nThank You, Please come again.\nGoods Sold are not refundable, returnable\n\nBANK ACC MBB 5128 4851 2118\nBANK ACC MBB 5626 4732 1744\nBANK ACC AMBANK 888 100 123 3706\n\nGST Summary Amount(RM) Tax(RM)\nSR @ 6% 68.87 4.13\nZR/OS/EZ 0.00 0.00"
  }
}