{
  "merchant": {
    "name": "Beyond Brothers Hardware",
    "address": "Lot 1-0-2, Jln 1/50, Diamond Square, Off Jln Gombak, 53000 Kuala Lumpur",
    "phone": "03-40211233",
    "tax_id": "001921974272",
    "website": ""
  },
  "transaction": {
    "date": "2017-10-01",
    "time": "15:43:00",
    "currency": "MYR",
    "payment_method": "Cash",
    "subtotal": 64.0,
    "tax": 3.84,
    "tip": 0.0,
    "total": 67.85,
    "accounting_category": "Office Supplies",
    "category_confidence": 0.9
  },
  "items": [
    {
      "name": "Pentens Putty Filler 500G",
      "quantity": 1,
      "unit_price": 5.3,
      "total_price": 5.3,
      "category": "Hardware",
      "accounting_category": "Office Supplies",
      "category_confidence": 0.9
    },
    {
      "name": "Papan Cat",
      "quantity": 1,
      "unit_price": 2.12,
      "total_price": 2.12,
      "category": "Hardware",
      "accounting_category": "Office Supplies",
      "category_confidence": 0.9
    },
    {
      "name": "Tupai Roller 7\" Set",
      "quantity": 1,
      "unit_price": 8.48,
      "total_price": 8.48,
      "category": "Hardware",
      "accounting_category": "Office Supplies",
      "category_confidence": 0.9
    },
    {
      "name": "Maxilite 7L 14139",
      "quantity": 1,
      "unit_price": 39.22,
      "total_price": 39.22,
      "category": "Hardware",
      "accounting_category": "Office Supplies",
      "category_confidence": 0.9
    },
    {
      "name": "Arrow Tali Tape 7.5M (Offer)",
      "quantity": 1,
      "unit_price": 8.48,
      "total_price": 8.48,
      "category": "Hardware",
      "accounting_category": "Office Supplies",
      "category_confidence": 0.9
    },
    {
      "name": "Scapper Biasa 3",
      "quantity": 1,
      "unit_price": 4.24,
      "total_price": 4.24,
      "category": "Hardware",
      "accounting_category": "Office Supplies",
      "category_confidence": 0.9
    }
  ],
  "summary": {
    "total_items": 6,
    "rounding": 0.01,
    "change_due": 2.15
  },
  "ocr_metadata": {
    "source_image": "sroie_X51005675914.jpg",
    "extraction_engine": "gpt-4o-vision",
    "model_version": "2024-05-13",
    "confidence": 0.95
  },
  "ocr_raw": {
    "full_text": "BEYOND BROTHERS HARDWARE\n(872981-V)\nLOT 1-0-2, JLN 1/50,\nDIAMOND SQUARE,\nOFF JLN GOMBAK\n53000 KUALA LUMPUR\nTEL: 03-40211233 FAX: 03-40223233\nIVAN_KONG12@HOTMAIL.COM\nGST ID: 001921974272\nTAX INVOICE\nDoc No.: C/S00059502 Date: 10/1/2017\nCashier : USER Time: 15:43:00\nSalesperson : Ref.\nItem Qty S/Price (GST) S/Price (GST) Amount Tax\n1765 1 5.00 5.30 5.30 SR\nPENTENS PUTTY FILLER 500G\n1914 1 2.00 2.12 2.12 SR\nPAPAN CAT\n3801\n1 8.00 8.48 8.48 SR\nTUPAI ROLLER 7'' SET)\n4184\n1 37.00 39.22 39.22 SR\nMAXILITE 7L 14139\n4630\n1 8.00 8.48 8.48\nARROW TALI TAPE 7.5M (OFFER)\n4485\n1 4.00 4.24 4.24 SR\nSCAPPER BIASA 3'\nTotal Qty\n6\n67.94\nTotal Sales (Excluding GST) : 64.00\nDiscount\n0.00\nTotal GST : 3.84\nRounding\n0.01\nTotal Sales (Inclusive of GST) : 67.85\nCASH : 70.00\nChange :\n2.15\nGST SUMMARY\nTax Code\nAmt (RM) Tax (RM)\nSR\n6\n64.00 3.84\nTotal : 64.00 3.84\nGOODS SOLD ARE NOT RETURNABLE. THANK YOU."
  }
}