{
  "merchant": {
    "name": "Gardenia Bakeries (KL) Sdn Bhd",
    "address": "Lot 3, Jalan Pelabur 23/1, 40300 Shah Alam, Selangor",
    "phone": "03-55423228",
    "tax_id": "000381399040",
    "website": ""
  },
  "transaction": {
    "date": "2017-07-27",
    "time": "11:54:00",
    "currency": "MYR",
    "payment_method": "",
    "subtotal": 89.03,
    "tax": 4.16,
    "tip": 0.0,
    "total": 94.19,
    "accounting_category": "Office Supplies",
    "category_confidence": 0.9
  },
  "items": [
    {
      "name": "O.C. White",
      "quantity": 3,
      "unit_price": 2.13,
      "total_price": 6.39,
      "category": "Food",
      "accounting_category": "Groceries",
      "category_confidence": 0.9
    },
    {
      "name": "Wholemeal",
      "quantity": 3,
      "unit_price": 2.78,
      "total_price": 8.34,
      "category": "Food",
      "accounting_category": "Groceries",
      "category_confidence": 0.9
    },
    {
      "name": "O.C. Jumbo",
      "quantity": 2,
      "unit_price": 2.97,
      "total_price": 5.94,
      "category": "Food",
      "accounting_category": "Groceries",
      "category_confidence": 0.9
    },
    {
      "name": "Delicia-B/Scotch",
      "quantity": 3,
      "unit_price": 3.72,
      "total_price": 11.16,
      "category": "Food",
      "accounting_category": "Groceries",
      "category_confidence": 0.9
    },
    {
      "name": "Bun-Sbilts",
      "quantity": 20,
      "unit_price": 0.84,
      "total_price": 16.8,
      "category": "Food",
      "accounting_category": "Groceries",
      "category_confidence": 0.9
    },
    {
      "name": "Hazel Choc",
      "quantity": 6,
      "unit_price": 6.9,
      "total_price": 41.4,
      "category": "Food",
      "accounting_category": "Groceries",
      "category_confidence": 0.9
    }
  ],
  "summary": {
    "total_items": 34,
    "rounding": 0.0,
    "change_due": 0.0
  },
  "ocr_metadata": {
    "source_image": "sroie_X51006555814.jpg",
    "extraction_engine": "gpt-4o-vision",
    "model_version": "2024-05-13",
    "confidence": 0.95
  },
  "ocr_raw": {
    "full_text": "GARDENIA BAKERIES (KL) SDN BHD (193694 V)\nLot 3, Jalan Pelabur 23/1,\n40300 Shah Alam, Selangor.\nTel: 03-55423228 Fax:03-55423213\nGST ID: 000381399040\nTAX INVOICE / ADJUSTMENT NOTE\nCash Inv No.: 7727F713\nDate: 27/07/2017\nMAKASSAR FRESH MARKET SDN BHD\nGROUND FLOOR, NO: 4 & 6,\nJALAN SS 15/4B,\n47500 SUBANG JAYA, SELANGOR\nVE:0514\nDD: 27/07/2017 11:54\nDescription U.P Iss Exc D Sale Amt(RM)\nO.C. WHITE 2.13 6 3 3 6.39\nWHOLEMEAL 2.78 6 3 3 8.34\nO.C JUMBO 2.97 5 3 2 5.94\nTotal 0% supplies: 20.67\nDELICIA-B/SCOTCH 3.72 3 0 3 11.16\nBUN-SBILTS 0.84 20 0 20 16.80\nHAZEL CHOC 6.90 6 0 6 41.40\nTotal 6% supplies (excl. GST): 69.36\nGST: 4.16\nTotal 6% supplies (Inc. GST): 73.52\nTotal 0% supplies: 20.67\nTotal Payable: 94.19\nE.& O.E\nReceived above goods in good order condition.\nThe recipient of Gardenia's products is\nrequired to make necessary adjustments to its\ninput tax claims, on the basis of the\nadjustments shown in this Tax Invoice /\nAdjustment Note\nCUSTOMER'S COPY"
  }
}