{
  "merchant": {
    "name": "Gerbang Alaf Restaurants Sdn Bhd",
    "address": "Level 6, Bangunan TH, Damansara Uptown 3, No.3, Jalan SS21/39,47400 Petaling Jaya, Selangor",
    "phone": "03-4162-2318",
    "tax_id": "000504664064",
    "website": "www.mcdfeedback.com.my"
  },
  "transaction": {
    "date": "2018-01-18",
    "time": "10:27:03",
    "currency": "MYR",
    "payment_method": "Cash",
    "subtotal": 0.0,
    "tax": 1.51,
    "tip": 0.0,
    "total": 26.6,
    "accounting_category": "Food and Beverage",
    "category_confidence": 0.95
  },
  "items": [
    {
      "name": "ChicMcMuffin",
      "quantity": 2,
      "unit_price": 5.5,
      "total_price": 11.0,
      "category": "Food",
      "accounting_category": "Food and Beverage",
      "category_confidence": 0.95
    },
    {
      "name": "M Porridge",
      "quantity": 1,
      "unit_price": 5.6,
      "total_price": 5.6,
      "category": "Food",
      "accounting_category": "Food and Beverage",
      "category_confidence": 0.95
    },
    {
      "name": "BM 2HotCakes",
      "quantity": 1,
      "unit_price": 10.0,
      "total_price": 10.0,
      "category": "Food",
      "accounting_category": "Food and Beverage",
      "category_confidence": 0.95
    },
    {
      "name": "L Coke",
      "quantity": 1,
      "unit_price": 0.0,
      "total_price": 0.0,
      "category": "Beverage",
      "accounting_category": "Food and Beverage",
      "category_confidence": 0.95
    }
  ],
  "summary": {
    "total_items": 5,
    "rounding": 0.0,
    "change_due": 73.4
  },
  "ocr_metadata": {
    "source_image": "sroie_X51005230617.jpg",
    "extraction_engine": "gpt-4o-vision",
    "model_version": "2024-05-13",
    "confidence": 0.95
  },
  "ocr_raw": {
    "full_text": "1950\nGerbang Alaf Restaurants Sdn Bhd\n(65351-M)\nformerly known as\nGolden Arches Restaurants Sdn Bhd\nLicensee of McDonald's\nLevel 6, Bangunan TH, Damansara Uptown3\nNo.3, Jalan SS21/39,47400 Petaling Jaya\nSelangor\n(GST ID No: 000504664064)\nMcDonald's BHP Taman Melawati(#328)\nTel No. 03-4162-2318\nTAX INVOICE\nMFY Side 1\nINV# 003281900229170\nORD #50 - REG #19- 18/01/2018 10:27:03\nQTY ITEM TOTAL\n2 ChicMcMuffin 11.00\n1 M Porridge 5.60\n1 BM 2HotCakes 10.00\n1 L Coke\nTakeOut Total (incl GST) 26.60\nTotal Rounded 26.60\nCash Tendered 100.00\nChange 73.40\nTOTAL INCLUDES 6% GST 1.51\nWe'd love to hear your feedback!\nVisit www.mcdfeedback.com.my\nOR\nDownload My McD Feedback from\nGoogle Play/App Store\nto share your experience\nThank You and Please Come Again.\nCustomer Service Hotline : 03-2726-5600"
  }
}