{
  "merchant": {
    "name": "KEDAI BUKU NEW ACHEIVERS",
    "address": "NO. 12 & 14, JALAN JINJANG 27/54, TAMAN ALAM MEGAH, SEKSYEN 27, 40400 SHAH ALAM, SELANGOR D. E.",
    "phone": "603-51910643",
    "tax_id": "001729572864",
    "website": ""
  },
  "transaction": {
    "date": "2017-12-28",
    "time": "10:50:00",
    "currency": "MYR",
    "payment_method": "CASH",
    "subtotal": 40.0,
    "tax": 2.16,
    "tip": 0.0,
    "total": 38.15,
    "accounting_category": "Office Supplies",
    "category_confidence": 0.95
  },
  "items": [
    {
      "name": "CRE ASTAR LAMINATING FILM A4 100STS",
      "quantity": 1,
      "unit_price": 40.0,
      "total_price": 42.4,
      "category": "Office Supplies",
      "accounting_category": "Office Supplies",
      "category_confidence": 0.95
    }
  ],
  "summary": {
    "total_items": 1,
    "rounding": -0.01,
    "change_due": 11.85
  },
  "ocr_metadata": {
    "source_image": "sroie_X51005705727.jpg",
    "extraction_engine": "gpt-4o-vision",
    "model_version": "2024-05-13",
    "confidence": 0.95
  },
  "ocr_raw": {
    "full_text": "KEDAI BUKU NEW ACHEIVERS\n(CO NO. SA0345444-K)\nNO. 12 & 14, JALAN JINJANG 27/54\nTAMAN ALAM MEGAH, SEKSYEN 27\n40400 SHAH ALAM, SELANGOR D. E.\nTEL: 603-51910643 FAX: 603-51910643\nGST NO : 001729572864\nFULL TAX INVOICE\nBill To :\nReceipt #: CS00310146\nSalesperson: Date: 28/12/2017\nCashier: USER Time: 10:50:00\nItem Qty RSP (GST) (GST)\nRSP Amount\n9555078912508 1 40.00 42.16 42.40\nSR: CRE ASTAR LAMINATING FILM A4 100STS\nTOT QTY: 1 42.16\n(Excluded GST) Sub Total : 40.00\nDiscount : 4.00\nTotal GST : 2.16\nRounding : -0.01\nTotal : 38.15\nCASH : 50.00\nChange : 11.85\nGST SUMMARY\nTax Code % Amount GST\nSR 6 36.00 2.16\nTotal : 36.00 2.16\nGOODS SOLD ARE NOT RETURNABLE,\nTHANK YOU.\n"
  }
}