{
  "merchant": {
    "name": "Gardenia Bakeries (KL) SDN BHD",
    "address": "Lot 3, Jalan Pelabur 23/1, 40300 Shah Alam, Selangor",
    "phone": "03-55423228",
    "tax_id": "000381399040",
    "website": ""
  },
  "transaction": {
    "date": "2017-08-19",
    "time": "10:38:00",
    "currency": "MYR",
    "payment_method": "",
    "subtotal": 49.29,
    "tax": 1.31,
    "tip": 0.0,
    "total": 50.6,
    "accounting_category": "Food & Beverage",
    "category_confidence": 0.9
  },
  "items": [
    {
      "name": "O.C. WHITE",
      "quantity": 2,
      "unit_price": 2.13,
      "total_price": 4.26,
      "category": "Bakery",
      "accounting_category": "Food & Beverage",
      "category_confidence": 0.9
    },
    {
      "name": "WHOLEMEAL",
      "quantity": 3,
      "unit_price": 2.78,
      "total_price": 8.34,
      "category": "Bakery",
      "accounting_category": "Food & Beverage",
      "category_confidence": 0.9
    },
    {
      "name": "O.C JUMBO",
      "quantity": 5,
      "unit_price": 2.97,
      "total_price": 14.85,
      "category": "Bakery",
      "accounting_category": "Food & Beverage",
      "category_confidence": 0.9
    },
    {
      "name": "DELICIA-B/SCOTCH",
      "quantity": 2,
      "unit_price": 3.72,
      "total_price": 7.44,
      "category": "Bakery",
      "accounting_category": "Food & Beverage",
      "category_confidence": 0.9
    },
    {
      "name": "CR-B'SCOTCH",
      "quantity": 20,
      "unit_price": 0.72,
      "total_price": 14.4,
      "category": "Bakery",
      "accounting_category": "Food & Beverage",
      "category_confidence": 0.9
    }
  ],
  "summary": {
    "total_items": 32,
    "rounding": 0.0,
    "change_due": 0.0
  },
  "ocr_metadata": {
    "source_image": "sroie_X51006556650.jpg",
    "extraction_engine": "gpt-4o-vision",
    "model_version": "2024-05-13",
    "confidence": 0.95
  },
  "ocr_raw": {
    "full_text": "GARDENIA BAKERIES (KL) SDN BHD (139386 X)\nLot 3, Jalan Pelabur 23/1, 40300 Shah Alam, Selangor.\nTel: 03-55423228 Fax:03-55423213\nGST ID: 000381399040\n\nTAX INVOICE / ADJUSTMENT NOTE\nCash Inv No.: 7819F712\nDate: 19/08/2017\nMAKASSAR FRESH MARKET SDN BHD\nGROUND FLOOR, NO. 4 & 6,\nJALAN SS 15/4B,\n47500 SUBANG JAYA, SELANGOR\nVE05: Ridzuan(1900)\n\nDD: 19/08/2017 10:38\n\nDescription U.P Iss Exc D Sale Amt(RM)\nO.C. WHITE 2.13 5 3 0 2 4.26\nWHOLEMEAL 2.78 3 0 0 3 8.34\nO.C JUMBO 2.97 5 0 0 5 14.85\nTotal 0% supplies: 27.45\n\nDELICIA-B/SCOTCH 3.72 2 0 0 2 7.44\nCR-B'SCOTCH 0.72 20 0 0 20 14.40\n\nTotal 6% supplies (excl. GST): 21.84\nGST: 1.31\nTotal 6% supplies (Inc. GST): 23.15\nTotal 0% supplies: 27.45\nTotal Payable: 50.60\n\nE.&O.E.\nReceived above goods in good order condition.\nThe recipient of Gardenia's products is\nrequired to make necessary adjustments to its\ninput tax claims, on the basic of the\nadjustments shown in this Tax Invoice /\nAdjustment Note\nCUSTOMER'S COPY"
  }
}