{
  "merchant": {
    "name": "Subway",
    "address": "A-G-06, Dataran Glomac, Jalan SS6/5A, Pusat Bandar Kelana Jaya, 47301 Petaling Jaya, Selangor, Malaysia",
    "phone": "03-78870693",
    "tax_id": "000220499968",
    "website": ""
  },
  "transaction": {
    "date": "2018-02-14",
    "time": "11:13:31",
    "currency": "MYR",
    "payment_method": "Cash",
    "subtotal": 11.23,
    "tax": 0.67,
    "tip": 0.0,
    "total": 11.9,
    "accounting_category": "Food & Beverage",
    "category_confidence": 0.95
  },
  "items": [
    {
      "name": "EDV Meal",
      "quantity": 1,
      "unit_price": 11.9,
      "total_price": 11.9,
      "category": "Meal",
      "accounting_category": "Food & Beverage",
      "category_confidence": 0.95
    }
  ],
  "summary": {
    "total_items": 1,
    "rounding": 0.0,
    "change_due": 0.0
  },
  "ocr_metadata": {
    "source_image": "sroie_X51005745244.jpg",
    "extraction_engine": "gpt-4o-vision",
    "model_version": "2024-05-13",
    "confidence": 0.95
  },
  "ocr_raw": {
    "full_text": "Subway#42210-0 Phone 03-78870693\nURBAN IDEA SDN BHO (417940-M),\nA-G-06, DATARAN GLOMAC,\nJALAN SS6/5A, PUSAT BANDAR KELANA JAYA,\n47301 PETALING JAYA, SELANGOR, Malaysia\nServed by: JOSEPH 14/02/2018 11:13:31\nTax Invoice# 1/A-42210-138075\n\nGST ID: 000220499968\n\nQty Size Item\n--- ---- ----\n1 (MY) EDV Meal RM11.90\n    6\" -Meatball Sub\n    -16oz Fountain Drink\n    -1 Cookies\n\nTotal (Eat In) RM11.90\nCash RM11.90\nChange RM0.00\n\nTax Info:\n\nGST 6% (6%) RM0.67\nTotal-Excl-GST RM11.23\n\nTake our 1 Minute Survey at\nwww.tellsubway.my and get a FREE COOKIE\nwith next purchase.Redemption of 1\ncookie per transaction"
  }
}