{
  "merchant": {
    "name": "Gardenia Bakeries (KL) SDN BHD",
    "address": "Lot 3, Jalan Pelabur 23/1, 40300 Shah Alam, Selangor",
    "phone": "03-55423228",
    "tax_id": "000381399040",
    "website": ""
  },
  "transaction": {
    "date": "2017-08-03",
    "time": "11:10:00",
    "currency": "MYR",
    "payment_method": "",
    "subtotal": 51.88,
    "tax": 1.81,
    "tip": 0.0,
    "total": 51.88,
    "accounting_category": "groceries",
    "category_confidence": 0.9
  },
  "items": [
    {
      "name": "O.C. WHITE",
      "quantity": 4,
      "unit_price": 2.13,
      "total_price": 8.52,
      "category": "bread",
      "accounting_category": "groceries",
      "category_confidence": 0.9
    },
    {
      "name": "WHOLEMEAL",
      "quantity": 3,
      "unit_price": 2.78,
      "total_price": 8.34,
      "category": "bread",
      "accounting_category": "groceries",
      "category_confidence": 0.9
    },
    {
      "name": "O.C JUMBO",
      "quantity": 1,
      "unit_price": 2.97,
      "total_price": 2.97,
      "category": "bread",
      "accounting_category": "groceries",
      "category_confidence": 0.9
    },
    {
      "name": "DELICIA-B/SCOTCH",
      "quantity": 2,
      "unit_price": 3.72,
      "total_price": 7.44,
      "category": "bread",
      "accounting_category": "groceries",
      "category_confidence": 0.9
    },
    {
      "name": "CR-B'SCOTCH",
      "quantity": 16,
      "unit_price": 0.72,
      "total_price": 11.52,
      "category": "bread",
      "accounting_category": "groceries",
      "category_confidence": 0.9
    },
    {
      "name": "BUN-SBILIS",
      "quantity": 10,
      "unit_price": 0.84,
      "total_price": 8.4,
      "category": "bread",
      "accounting_category": "groceries",
      "category_confidence": 0.9
    },
    {
      "name": "KAYA-PANDN",
      "quantity": 3,
      "unit_price": 2.4,
      "total_price": 7.2,
      "category": "bread",
      "accounting_category": "groceries",
      "category_confidence": 0.9
    }
  ],
  "summary": {
    "total_items": 39,
    "rounding": -0.09,
    "change_due": 0.0
  },
  "ocr_metadata": {
    "source_image": "sroie_X51006556738.jpg",
    "extraction_engine": "gpt-4o-vision",
    "model_version": "2024-05-13",
    "confidence": 0.95
  },
  "ocr_raw": {
    "full_text": "GARDENIA BAKERIES (KL) SDN BHD (139386 X)\nLot 3, Jalan Pelabur 23/1,\n40300 Shah Alam, Selangor.\nTel: 03-55423228 Fax:03-55423213\nGST ID: 000381399040\nTAX INVOICE / ADJUSTMENT NOTE\nCash Inv No.: 7803F712\nDate: 03/08/2017\nVE0514\nMAKASSAR FRESH MARKET SDN BHD\nGROUND FLOOR, NO. 4 & 6,\nJALAN SS 15/4B,\n47500 SUBANG JAYA, SELANGOR\nVE05: Ridzuan(11900)\nDD: 03/08/2017 11:10\nDescription U.P Iss Exc D Sale Amt(RM)\nO.C. WHITE 2.13 5 1 0 4 8.52\nWHOLEMEAL 2.78 5 2 0 3 8.34\nO.C JUMBO 2.97 3 3 2 1 2.97\nTotal 0% supplies: 19.83\nDELICIA-B/SCOTCH 3.72 2 0 0 2 7.44\nCR-B'SCOTCH 0.72 10 6 0 10 7.20\nBUN-SBILIS 0.84 6 1 0 10 8.40\nKAYA-PANDN 2.40 3 5 0 3 7.20\nTotal 6% supplies (excl. GST): 30.24\nGST: 1.81\nTotal 6% supplies (Inc. GST): 32.05\nTotal 0% supplies: 19.83\nTotal Payable: 51.83 51.88\nE.&O.E.\nReceived above goods in good order\ncondition. The recipient of Gardenia's\nproducts is required to make necessary\nadjustments to its input tax claims, on the\nbasis of the adjustments shown in this Tax\nInvoice / Adjustment Note\nCUSTOMER'S COPY"
  }
}