{
  "merchant": {
    "name": "Gardenia Bakeries (KL) Sdn Bhd",
    "address": "Lot 3, Jalan Pelabur 23/1, 40300 Shah Alam, Selangor",
    "phone": "03-55423228",
    "tax_id": "000381399040",
    "website": ""
  },
  "transaction": {
    "date": "2017-08-24",
    "time": "11:33:00",
    "currency": "MYR",
    "payment_method": "Cash",
    "subtotal": 39.78,
    "tax": 0.95,
    "tip": 0.0,
    "total": 39.78,
    "accounting_category": "Groceries",
    "category_confidence": 0.9
  },
  "items": [
    {
      "name": "O.C. White",
      "quantity": 4,
      "unit_price": 2.13,
      "total_price": 8.52,
      "category": "Food",
      "accounting_category": "Groceries",
      "category_confidence": 0.9
    },
    {
      "name": "Wholemeal",
      "quantity": 2,
      "unit_price": 2.78,
      "total_price": 5.56,
      "category": "Food",
      "accounting_category": "Groceries",
      "category_confidence": 0.9
    },
    {
      "name": "O.C. Jumbo",
      "quantity": 3,
      "unit_price": 2.97,
      "total_price": 8.91,
      "category": "Food",
      "accounting_category": "Groceries",
      "category_confidence": 0.9
    },
    {
      "name": "Delicia-B/Scotch",
      "quantity": 2,
      "unit_price": 3.72,
      "total_price": 7.44,
      "category": "Food",
      "accounting_category": "Groceries",
      "category_confidence": 0.9
    },
    {
      "name": "Bun-Sbilis",
      "quantity": 10,
      "unit_price": 0.84,
      "total_price": 8.4,
      "category": "Food",
      "accounting_category": "Groceries",
      "category_confidence": 0.9
    }
  ],
  "summary": {
    "total_items": 21,
    "rounding": 0.0,
    "change_due": 0.0
  },
  "ocr_metadata": {
    "source_image": "sroie_X51006556604.jpg",
    "extraction_engine": "gpt-4o-vision",
    "model_version": "2024-05-13",
    "confidence": 0.95
  },
  "ocr_raw": {
    "full_text": "GARDENIA BAKERIES (KL) SDN BHD (139386 X)\nLot 3, Jalan Pelabur 23/1,\n40300 Shah Alam, Selangor.\nTel: 03-55423228 Fax: 03-55423213\nGST ID: 000381399040\nTAX INVOICE / ADJUSTMENT NOTE\nCash Inv No.: 7824F715\nDate: 24/08/2017\nVE0514\nMAKASSAR FRESH MARKET SDN BHD\nGROUND FLOOR, NO. 4 & 6,\nJALAN SS 15/4B,\n47500 SUBANG JAYA, SELANGOR\nVE05: Ridzuan(11900)\nDD: 24/08/2017 11:33\nDescription U.P Iss Exc D Sale Amt(RM)\nO.C. WHITE 2.13 5 0 4 8.52\nWHOLEMEAL 2.78 5 3 2 5.56\nO.C. JUMBO 2.97 5 1 3 8.91\nTotal 0% supplies: 22.99\nDELICIA-B/SCOTCH 3.72 10 0 2 7.44\nBUN-SBILIS 0.84 10 0 10 8.40\nTotal 6% supplies (excl. GST): 15.84\nGST: 0.95\nTotal 6% supplies (Inc. GST): 16.79\nTotal 0% supplies: 22.99\nTotal Payable: 39.78\nE.&O.E.\nReceived above goods in good order condition.\nThe recipient of Gardenia's products is\nrequired to make necessary adjustments to its\ninput tax claims, on the basic of the\nadjustments shown in this Tax Invoice /\nAdjustment Note\nCUSTOMER'S COPY"
  }
}