{
  "merchant": {
    "name": "Gardenia Bakeries (KL) Sdn Bhd",
    "address": "Lot 3, Jalan Pelabur 23/1, 40300 Shah Alam, Selangor",
    "phone": "03-55423228",
    "tax_id": "000381399040",
    "website": ""
  },
  "transaction": {
    "date": "2017-10-19",
    "time": "11:29:00",
    "currency": "MYR",
    "payment_method": "",
    "subtotal": 68.63,
    "tax": 1.01,
    "tip": 0.0,
    "total": 68.63,
    "accounting_category": "Groceries",
    "category_confidence": 0.95
  },
  "items": [
    {
      "name": "O.C. WHITE",
      "quantity": 6,
      "unit_price": 2.13,
      "total_price": 12.78,
      "category": "Bakery",
      "accounting_category": "Groceries",
      "category_confidence": 0.95
    },
    {
      "name": "WHOLEMEAL",
      "quantity": 3,
      "unit_price": 2.78,
      "total_price": 8.34,
      "category": "Bakery",
      "accounting_category": "Groceries",
      "category_confidence": 0.95
    },
    {
      "name": "O.C JUMBO",
      "quantity": 10,
      "unit_price": 2.97,
      "total_price": 29.7,
      "category": "Bakery",
      "accounting_category": "Groceries",
      "category_confidence": 0.95
    },
    {
      "name": "BUN-SB1LIS",
      "quantity": 20,
      "unit_price": 0.84,
      "total_price": 16.8,
      "category": "Bakery",
      "accounting_category": "Groceries",
      "category_confidence": 0.95
    }
  ],
  "summary": {
    "total_items": 39,
    "rounding": 0.0,
    "change_due": 0.0
  },
  "ocr_metadata": {
    "source_image": "sroie_X51006557184.jpg",
    "extraction_engine": "gpt-4o-vision",
    "model_version": "2024-05-13",
    "confidence": 0.95
  },
  "ocr_raw": {
    "full_text": "GARDENIA BAKERIES (KL) SDN BHD (139386 X)\nLot 3, Jalan Pelabur 23/1,\n40.300 Shah Alam, Selangor.\nTel: 03-55423228 Fax:03-55423213\nGST ID: 000381399040\n\nTAX INVOICE / ADJUSTMENT NOTE\n\nCash Inv No.: 7019F712\nDate: 19/10/2017\n\nV#0514\nMAKASSAR FRESH MARKET SDN BHD\nGROUND FLOOR, NO. 4 & 6,\nJALAN SS 15/4B,\n47500 SUBANG JAYA, SELANGOR\nV#05: Ridzuan (11900)\n\nDD: 19/10/2017 11:29\n\nDescription U.P Iss Exc D Sale Amt(RM)\nO.C. WHITE 2.13 0 0 6 12.78\nWHOLEMEAL 2.78 3 0 0 3 8.34\nO.C JUMBO 2.97 10 0 0 10 29.70\n\nTotal 0% supplies: 50.82\nBUN-SB1LIS 0.84 20 0 0 20 16.80\nTotal 6% supplies (excl. GST): 16.80\nGST: 1.01\nTotal 6% supplies (Inc. GST): 17.81\nTotal 0% supplies: 50.82\nTotal Payable: 68.63\n\nE & O.E.\nReceived above goods in good order condition.\nThe recipient of Gardenia's products is\nrequired to make necessary adjustments to its\ninput tax claims, on the basic of the\nadjustments shown in this Tax Invoice /\nAdjustment Note\n\nCUSTOMER'S COPY"
  }
}