{
  "merchant": {
    "name": "Gardenia Bakeries (KL) Sdn Bhd",
    "address": "Lot 3, Jalan Pelabur 23/1, 40300 Shah Alam, Selangor.",
    "phone": "03-55423228",
    "tax_id": "000381399040",
    "website": ""
  },
  "transaction": {
    "date": "2017-09-28",
    "time": "11:28:00",
    "currency": "MYR",
    "payment_method": "",
    "subtotal": 46.84,
    "tax": 1.01,
    "tip": 0.0,
    "total": 48.04,
    "accounting_category": "Supplies",
    "category_confidence": 0.9
  },
  "items": [
    {
      "name": "O.C. WHITE",
      "quantity": 2,
      "unit_price": 2.13,
      "total_price": 4.26,
      "category": "Bakery",
      "accounting_category": "Food",
      "category_confidence": 0.9
    },
    {
      "name": "WHOLEMEAL",
      "quantity": 4,
      "unit_price": 2.79,
      "total_price": 11.12,
      "category": "Bakery",
      "accounting_category": "Food",
      "category_confidence": 0.9
    },
    {
      "name": "O.C JUMBO",
      "quantity": 5,
      "unit_price": 2.97,
      "total_price": 14.85,
      "category": "Bakery",
      "accounting_category": "Food",
      "category_confidence": 0.9
    },
    {
      "name": "BUN-SBILIS",
      "quantity": 20,
      "unit_price": 0.84,
      "total_price": 16.8,
      "category": "Bakery",
      "accounting_category": "Food",
      "category_confidence": 0.9
    }
  ],
  "summary": {
    "total_items": 31,
    "rounding": 0.0,
    "change_due": 0.0
  },
  "ocr_metadata": {
    "source_image": "sroie_X51006556825.jpg",
    "extraction_engine": "gpt-4o-vision",
    "model_version": "2024-05-13",
    "confidence": 0.95
  },
  "ocr_raw": {
    "full_text": "GARDENIA BAKERIES (KL) SDN BHD (139386 X)\nLot 3, Jalan Pelabur 23/1,\n40300 Shah Alam, Selangor.\nTel: 03-55423228 Fax:03-55423213\nGST ID: 000381399040\nTAX INVOICE / ADJUSTMENT NOTE\nCash Inv No.: 7928F713\nVEO514\nDate: 28/09/2017\nMAKASSAR FRESH MARKET SDN BHD\nGROUND FLOOR, NO. 4 & 6,\nJALAN SS 15/4B,\n47500 SUBANG JAYA, SELANGOR\nVEO5: Ridzuan (11900)\nDD: 28/09/2017 11:28\nDescription U.P Iss Exc D Sale Amt(RM)\nO.C. WHITE 2.13 4 2 0 2 4.26\nWHOLEMEAL 2.79 4 0 0 4 11.12\nO.C JUMBO 2.97 4 0 0 5 14.85\nTotal 0% supplies: 30.23\nBUN-SBILIS 0.84 20 0 0 20 16.80\nTotal 6% supplies (excl. GST): 16.80\nGST: 1.01\nTotal 6% supplies (Inc. GST): 17.81\nTotal 0% supplies: 30.23\nTotal Payable: 48.04\nE.&O.E\nReceived above goods in good order condition.\nThe recipient of Gardeniaâ€™s products is\nrequired to make necessary adjustments to its\ninput tax claims, on the basic of the adjustments\nshown in this Tax Invoice / Adjustment Note\nCUSTOMER'S COPY"
  }
}