{
  "merchant": {
    "name": "Gardenia Bakeries (KL) Sdn Bhd",
    "address": "Lot 3, Jalan Pelabur 23/1, 40300 Shah Alam, Selangor",
    "phone": "03-55423228",
    "tax_id": "000381399040",
    "website": ""
  },
  "transaction": {
    "date": "2017-09-11",
    "time": "11:48:00",
    "currency": "MYR",
    "payment_method": "",
    "subtotal": 62.23,
    "tax": 2.27,
    "tip": 0.0,
    "total": 65.5,
    "accounting_category": "Retail",
    "category_confidence": 0.9
  },
  "items": [
    {
      "name": "O.C. WHITE",
      "quantity": 1,
      "unit_price": 2.13,
      "total_price": 2.13,
      "category": "Bakery",
      "accounting_category": "Bakery",
      "category_confidence": 0.9
    },
    {
      "name": "WHOLEMEAL",
      "quantity": 3,
      "unit_price": 2.78,
      "total_price": 8.34,
      "category": "Bakery",
      "accounting_category": "Bakery",
      "category_confidence": 0.9
    },
    {
      "name": "O.C. JUMBO",
      "quantity": 5,
      "unit_price": 2.97,
      "total_price": 14.85,
      "category": "Bakery",
      "accounting_category": "Bakery",
      "category_confidence": 0.9
    },
    {
      "name": "DELICIA-B/SCOTCH",
      "quantity": 2,
      "unit_price": 3.72,
      "total_price": 7.44,
      "category": "Bakery",
      "accounting_category": "Bakery",
      "category_confidence": 0.9
    },
    {
      "name": "CR-CHOCLT",
      "quantity": 20,
      "unit_price": 0.72,
      "total_price": 14.4,
      "category": "Bakery",
      "accounting_category": "Bakery",
      "category_confidence": 0.9
    },
    {
      "name": "CR B SCOTCH",
      "quantity": 17,
      "unit_price": 0.66,
      "total_price": 11.24,
      "category": "Bakery",
      "accounting_category": "Bakery",
      "category_confidence": 0.9
    },
    {
      "name": "SQ-S BERRY",
      "quantity": 14,
      "unit_price": 0.79,
      "total_price": 11.06,
      "category": "Bakery",
      "accounting_category": "Bakery",
      "category_confidence": 0.9
    },
    {
      "name": "BUN-SB/TRY",
      "quantity": 2,
      "unit_price": 0.84,
      "total_price": 1.68,
      "category": "Bakery",
      "accounting_category": "Bakery",
      "category_confidence": 0.9
    },
    {
      "name": "MUFFIN B&W",
      "quantity": 3,
      "unit_price": 0.75,
      "total_price": 2.25,
      "category": "Bakery",
      "accounting_category": "Bakery",
      "category_confidence": 0.9
    }
  ],
  "summary": {
    "total_items": 67,
    "rounding": 0.0,
    "change_due": 0.0
  },
  "ocr_metadata": {
    "source_image": "sroie_X51006556852.jpg",
    "extraction_engine": "gpt-4o-vision",
    "model_version": "2024-05-13",
    "confidence": 0.95
  },
  "ocr_raw": {
    "full_text": "GARDENIA BAKERIES (KL) SDN BHD (139386 X)\nLot 3, Jalan Pelabur 23/1, 40300 Shah Alam, Selangor.\nTel: 03-55423228 Fax:03-55423213\nGST ID: 000381399040\n\nTAX INVOICE / ADJUSTMENT NOTE\nCash Inv No.: 7911F714\nDate: 11/09/2017\nVI\nMAKJASA FRESH MARKET SDN BHD\nGROUND FLOOR, NO. 4 & 6, JALAN SS 15/4B,\n47500 SUBANG JAYA, SELANGOR\nVE05: Ridzuan (11900)\n\nDD: 11/09/2017 11:48\n\nDescription U.P Iss Exc O Sale Amt(RM)\nO.C. WHITE 2.13 3 0 1 2.13\nWHOLEMEAL 2.78 3 0 3 8.34\nO.C JUMBO 2.97 5 0 5 14.85\nTotal 6% supplies: 25.32\n\nDELICIA-B/SCOTCH 3.72 2/0 2 7.44\nCR-CHOCLT 0.72 2060 20 14.40\nCR B SCOTCH 0.66 2040 17 11.24\nSQ-S BERRY 0.79 2144 14 11.06\nBUN-SB/TRY 0.84 20 2 1.68\nMUFFIN B&W 1.25 0 3 2.25\n\nTotal 6% supplies (excl. GST): 37.91\nGST: 2.27\nTotal 6% supplies (inc. GST): 40.18\nTotal 0% supplies: 25.32\n\nTotal Payable: 65.50\n\nE & O.E.\nReceived above goods in good order condition.\nThe recipient of Gardenia's products is\nrequired to make necessary adjustments to its\ninput tax claims, on the basis of the\nadjustments shown in this Tax lnvoice /\nAdjustment Note\nCUSTOMER'S COPY"
  }
}