{
  "merchant": {
    "name": "Gardenia Bakeries (KL) Sdn Bhd",
    "address": "Lot 3, Jalan Pelabur 23/1, 40300 Shah Alam, Selangor",
    "phone": "03-55423228",
    "tax_id": "000381390048",
    "website": ""
  },
  "transaction": {
    "date": "2017-09-18",
    "time": "12:33:00",
    "currency": "MYR",
    "payment_method": "",
    "subtotal": 15.52,
    "tax": 0.88,
    "tip": 0.0,
    "total": 5.9,
    "accounting_category": "Groceries",
    "category_confidence": 0.9
  },
  "items": [
    {
      "name": "O.C. WHITE",
      "quantity": 6,
      "unit_price": 2.13,
      "total_price": 12.78,
      "category": "Bakery",
      "accounting_category": "Groceries",
      "category_confidence": 0.9
    },
    {
      "name": "WHOLEMEAL",
      "quantity": 1,
      "unit_price": 2.78,
      "total_price": 2.78,
      "category": "Bakery",
      "accounting_category": "Groceries",
      "category_confidence": 0.9
    },
    {
      "name": "O.C. JUMBO",
      "quantity": 2,
      "unit_price": 2.97,
      "total_price": 5.94,
      "category": "Bakery",
      "accounting_category": "Groceries",
      "category_confidence": 0.9
    },
    {
      "name": "DELICIA-B/SCOTCH",
      "quantity": 2,
      "unit_price": 3.72,
      "total_price": 7.44,
      "category": "Bakery",
      "accounting_category": "Groceries",
      "category_confidence": 0.9
    },
    {
      "name": "CR-CHOCLT",
      "quantity": 10,
      "unit_price": 0.72,
      "total_price": 7.2,
      "category": "Bakery",
      "accounting_category": "Groceries",
      "category_confidence": 0.9
    }
  ],
  "summary": {
    "total_items": 5,
    "rounding": 0.0,
    "change_due": 0.0
  },
  "ocr_metadata": {
    "source_image": "sroie_X51006556839.jpg",
    "extraction_engine": "gpt-4o-vision",
    "model_version": "2024-05-13",
    "confidence": 0.95
  },
  "ocr_raw": {
    "full_text": "GARDENIA BAKERIES (KL) SDN BHD (139386 X)\nLot 3, Jalan Pelabur 23/1,\n40300 Shah Alam, Selangor.\nTel: 03-55423228 Fax:03-55423213\nGST ID: 000381390048\n\nTAX INVOICE / ADJUSTMENT NOTE\nCash Inv No.: 7918F715\nDate: 18/09/2017\nMAKASSAR FRESH MARKET SDN BHD\nGROUND FLOOR, NO. 4 & 6,\nJALAN SS 15/4B,\n47500 SUBANG JAYA, SELANGOR\nVC/05: Azlan(3737)\n\nDD: 18/09/2017 12:33\nDescription  U.P Iss Exc D Sale Amt(RM)\nQ.C. WHITE 2.13 2 0 0 -6 -12.78\nWHOLEMEAL 2.78 0 1 0 1 -2.78\nO.C JUMBO 2.97 0 0 0 2 5.94\n\nTotal 0% supplies: -9.62\nDELICIA-B/SCOTCH 3.72 2 0 0 2 7.44\nCR-CHOCLT 0.72 10 0 0 10 7.20\n\nTotal 6% supplies (excl. GST): 14.64\nGST: 0.88\nTotal 6% supplies (Inc. GST): 15.52\nTotal 0% supplies: -9.62\nTotal Payable: 5.90\n\nE.& O.E.\nReceived above goods in good order condition.\nThe recipient of Gardenia's products is\nrequired to make necessary adjustments to its\ninput tax claims, of the basic of the\nadjustments shown in this Tax Invoice /\nAdjustment Note\nCUSTOMER'S COPY"
  }
}