{
  "merchant": {
    "name": "Syarikat Perniagaan Gin Kee",
    "address": "No 290, Jalan Air Panas, Setapak, 53200, Kuala Lumpur.",
    "phone": "03-40210276",
    "tax_id": "000750673920",
    "website": ""
  },
  "transaction": {
    "date": "2018-01-13",
    "time": "15:52:00",
    "currency": "MYR",
    "payment_method": "Cash",
    "subtotal": 12.0,
    "tax": 0.72,
    "tip": 0.0,
    "total": 12.72,
    "accounting_category": "Office Supplies",
    "category_confidence": 0.9
  },
  "items": [
    {
      "name": "Glove 1200 (Per Pair)",
      "quantity": 6,
      "unit_price": 2.12,
      "total_price": 12.72,
      "category": "Office Supplies",
      "accounting_category": "Office Supplies",
      "category_confidence": 0.9
    }
  ],
  "summary": {
    "total_items": 6,
    "rounding": 0.0,
    "change_due": 0.0
  },
  "ocr_metadata": {
    "source_image": "sroie_X51005676547.jpg",
    "extraction_engine": "gpt-4o-vision",
    "model_version": "2024-05-13",
    "confidence": 0.95
  },
  "ocr_raw": {
    "full_text": "SYARIKAT PERNIAGAAN GIN KEE\n(81109-A)\nNO 290, JALAN AIR PANAS,\nSETAPAK,\n53200, KUALA LUMPUR.\nTEL : 03-40210276\nGST ID : 000750673920\nSIMPLIFIED TAX INVOICE\nCASH\nDoc No. : CS00012726 Date: 13/01/2018\nCashier : USER Time: 15:52:00\nSalesperson : Ref. :\nItem Qty S/Price Amount Tax\n1432 6 2.12 12.72 SR\nGLOVE 1200 (PER PAIR)\nTotal Qty 6 12.72\nTotal Sales (Excluding GST) : 12.00\nDiscount : 0.00\nTotal GST : 0.72\nRounding :\nTotal Sales (Inclusive of GST) : 12.72\nCASH : 12.72\nChange : 0.00\nGST SUMMARY\nTax Code % Amt (RM) Tax (RM)\nSR 6 12.00 0.72\nTotal : 12.00 0.72\nGOODS SOLD ARE NOT RETURNABLE, THANK YOU."
  }
}