{
  "merchant": {
    "name": "Gardenia Bakeries (KL) Sdn Bhd",
    "address": "Lot 3, Jalan Pelabur 23/1, 40300 Shah Alam, Selangor",
    "phone": "03-55423228",
    "tax_id": "000381399040",
    "website": ""
  },
  "transaction": {
    "date": "2017-09-21",
    "time": "12:28:00",
    "currency": "MYR",
    "payment_method": "",
    "subtotal": 42.22,
    "tax": 1.14,
    "tip": 0.0,
    "total": 43.36,
    "accounting_category": "Groceries",
    "category_confidence": 0.95
  },
  "items": [
    {
      "name": "O.C. White",
      "quantity": 2,
      "unit_price": 2.13,
      "total_price": 0.0,
      "category": "Bakery",
      "accounting_category": "Groceries",
      "category_confidence": 0.95
    },
    {
      "name": "Wholemeal",
      "quantity": 2,
      "unit_price": 2.78,
      "total_price": 5.56,
      "category": "Bakery",
      "accounting_category": "Groceries",
      "category_confidence": 0.95
    },
    {
      "name": "O.C. Jumbo",
      "quantity": 6,
      "unit_price": 2.97,
      "total_price": 17.82,
      "category": "Bakery",
      "accounting_category": "Groceries",
      "category_confidence": 0.95
    },
    {
      "name": "Delicia-B/Scotch",
      "quantity": 2,
      "unit_price": 3.72,
      "total_price": 7.44,
      "category": "Bakery",
      "accounting_category": "Groceries",
      "category_confidence": 0.95
    },
    {
      "name": "CR-Corn",
      "quantity": 24,
      "unit_price": 0.72,
      "total_price": 17.28,
      "category": "Bakery",
      "accounting_category": "Groceries",
      "category_confidence": 0.95
    }
  ],
  "summary": {
    "total_items": 36,
    "rounding": 0.0,
    "change_due": 0.0
  },
  "ocr_metadata": {
    "source_image": "sroie_X51006556809.jpg",
    "extraction_engine": "gpt-4o-vision",
    "model_version": "2024-05-13",
    "confidence": 0.95
  },
  "ocr_raw": {
    "full_text": "GARDENIA BAKERIES (KL) SDN BHD (139386 X)\nLot 3, Jalan Pelabur 23/1,\n40300 Shah Alam, Selangor,\nTel: 03- 55423228 Fax:03- 55423213\nGST ID: 000381399040\n\nTAX INVOICE / ADJUSTMENT NOTE\nCash Inv No.: 7921F714\nVERNI Date: 21/09/2017\n\nMAKASSAR FRESH MARKET SDN BHD\nGROUND FLOOR, NO. 4 & 6,\nJALAN SS 15/4B,\n47500 SUBANG JAYA, SELANGOR\nV E05: Ridzuan (11900)\n\nDD: 21/09/2017 12:28\n\nDescription U.P Iss Exc D Sale Amt(RM)\nO.C. WHITE 2.13 2 0 0 2 0.00\nWHOLEMEAL 2.78 2 0 2 5.56 O.C JUMBO 2.97 6 0 0 6 17.82\n\nTotal 0% supplies: 23.38\n\nDELICIA-B/SCOTCH 3.72 2 0 0 2 7.44 CR-CORN 0.72 36 0 24 17.28\nSQ-CHOCLMT 0.84 7 0 7 -7 -5.88\n\nTotal 6% supplies (excl. GST): 18.84\n\nGST: 1.14\n\nTotal 6% supplies (inc. GST): 19.98\nTotal 0% supplies: 23.38\nTotal Payable: 43.36\n\nE.&O.E.\nReceived above goods in good order condition.\nThe recipient of Gardenia's products is\nrequired to make necessary adjustments to its\ninput tax claims, on the basis of the\nadjustments shown in this Tax Invoice /\nAdjustment Note\nRE-PRINT"
  }
}