{
  "merchant": {
    "name": "AA Pharmacy",
    "address": "No.47, Jalan 3/36, Bukit Sri Bintang, Kepong 52100, Kuala Lumpur",
    "phone": "03-6263 8480",
    "tax_id": "001930047488",
    "website": ""
  },
  "transaction": {
    "date": "2018-01-29",
    "time": "12:09:00",
    "currency": "MYR",
    "payment_method": "Cash",
    "subtotal": 44.94,
    "tax": 1.26,
    "tip": 0.0,
    "total": 46.2,
    "accounting_category": "Pharmacy",
    "category_confidence": 0.95
  },
  "items": [
    {
      "name": "Ibuprofen Film Coated Tab",
      "quantity": 4,
      "unit_price": 3.0,
      "total_price": 12.0,
      "category": "Medication",
      "accounting_category": "Medicines",
      "category_confidence": 0.95
    },
    {
      "name": "Febricol - RX 10x10's",
      "quantity": 4,
      "unit_price": 3.0,
      "total_price": 12.0,
      "category": "Medication",
      "accounting_category": "Medicines",
      "category_confidence": 0.95
    },
    {
      "name": "Noflux Tablet",
      "quantity": 6,
      "unit_price": 3.49,
      "total_price": 20.94,
      "category": "Medication",
      "accounting_category": "Medicines",
      "category_confidence": 0.95
    }
  ],
  "summary": {
    "total_items": 3,
    "rounding": 0.0,
    "change_due": 0.0
  },
  "ocr_metadata": {
    "source_image": "sroie_X51005719823.jpg",
    "extraction_engine": "gpt-4o-vision",
    "model_version": "2024-05-13",
    "confidence": 0.95
  },
  "ocr_raw": {
    "full_text": "SIMPLIFIED TAX INVOICE\nAA PHARMACY\n1188096-W\nGST NO: 001930047488\nNO.47, JALAN 3/36,\nBUKIT SRI BINTANG,\nKEPONG 52100, KUALA LUMPUR\nTEL: 03-6263 8480 FAX: 03-6263 8480\nCASH\nRECEIPT #: C500123688 DATE: 29/01/2018\nSALESPERSON : C2 TIME: 12:09:00\nCASHIER : C2\nITEM QTY U/P AMOUNT\n930602 4 3.00 12.00 Z\nIBUPROFEN FILM COATED TAB\n9556492002837 4 3.00 12.00 Z\nFEBRICOL - RX 10X10'S\n940152 6 3.49 20.94 S\nNOFLUX TABLET\nTOTAL QUANTITY 14\nSUB-TOTAL 44.94\nDISC 0.00\nGST 1.26\nROUNDING 0.00\nTOTAL 46.20\nGOODS SOLD ARE NOT RETURNABLE,\nTHANK YOU.\nS=STANDARD RATED, Z=ZERO RATED\nGST SUMMARY\nCODE AMOUNT % TAX/AMT\nSR 20.94 6 1.26\nZRL 24.00 0 0.00\nTAX TOTAL: 1.26"
  }
}