{
  "merchant": {
    "name": "MYDIN",
    "address": "4-20, Jalan Ria 25/62 Taman Sri Muda, Seksyen 25, 40400 Shah Alam Selangor",
    "phone": "03-51217970",
    "tax_id": "000429165592",
    "website": ""
  },
  "transaction": {
    "date": "2017-08-10",
    "time": "15:26:21",
    "currency": "MYR",
    "payment_method": "Cash",
    "subtotal": 20.19,
    "tax": 1.21,
    "tip": 0.0,
    "total": 21.4,
    "accounting_category": "Office Supplies",
    "category_confidence": 0.9
  },
  "items": [
    {
      "name": "PARTNER E/LOPE 4.5INX9.5IN W429Z",
      "quantity": 2,
      "unit_price": 2.6,
      "total_price": 5.2,
      "category": "Office Supplies",
      "accounting_category": "Office Supplies",
      "category_confidence": 0.9
    },
    {
      "name": "PLASTIC BAG",
      "quantity": 1,
      "unit_price": 0.2,
      "total_price": 0.2,
      "category": "Miscellaneous",
      "accounting_category": "Office Supplies",
      "category_confidence": 0.7
    },
    {
      "name": "TEN O E/LOPE 15INX10IN TQ-S1015",
      "quantity": 2,
      "unit_price": 2.5,
      "total_price": 5.0,
      "category": "Office Supplies",
      "accounting_category": "Office Supplies",
      "category_confidence": 0.9
    },
    {
      "name": "UMOE S/NT 100MX75M, N/GRN",
      "quantity": 1,
      "unit_price": 3.0,
      "total_price": 3.0,
      "category": "Office Supplies",
      "accounting_category": "Office Supplies",
      "category_confidence": 0.9
    },
    {
      "name": "UMOE S/NT 100MX75M, N/YLW",
      "quantity": 1,
      "unit_price": 3.0,
      "total_price": 3.0,
      "category": "Office Supplies",
      "accounting_category": "Office Supplies",
      "category_confidence": 0.9
    },
    {
      "name": "UMOE S/NT 50MX38M, N/YLW",
      "quantity": 1,
      "unit_price": 2.5,
      "total_price": 2.5,
      "category": "Office Supplies",
      "accounting_category": "Office Supplies",
      "category_confidence": 0.9
    },
    {
      "name": "UMOE S/NT 75MX50M, N/PINK",
      "quantity": 1,
      "unit_price": 2.5,
      "total_price": 2.5,
      "category": "Office Supplies",
      "accounting_category": "Office Supplies",
      "category_confidence": 0.9
    }
  ],
  "summary": {
    "total_items": 9,
    "rounding": 0.0,
    "change_due": 28.6
  },
  "ocr_metadata": {
    "source_image": "sroie_X51005705760.jpg",
    "extraction_engine": "gpt-4o-vision",
    "model_version": "2024-05-13",
    "confidence": 0.95
  },
  "ocr_raw": {
    "full_text": "MYDIN\nTRI SHAAS SDN BHD (728515-M)\nMYDIN MART SRI MUDA\n4-20, Jalan Ria 25/62 Taman Sri Muda\nSeksyen 25, 40400 Shah Alam Selangor\nTel : 03-51217970 Fax : 03-51218059\nGST ID: 000429165592\nRECEIPT\nTerminal : 195 - 5505P0S011\nTrans # : 322563\nDate : 10/08/2017 03:26:21PM\nCashier : CHI07004\nMSM - ALMIDAH\n-------------------------------------------------\nPARTNER E/LOPE 4.5INX9.5IN W429Z EA .S\n955023304662 2 * 2.60 5.20\nPLASTIC BAG RM0.20 EA .S\n2300000017984 1 * 0.20 0.20\nTEN O E/LOPE 15INX10IN TQ-S1015 EA .S\n955023307724 2 * 2.50 5.00\nUMOE S/NT 100MX75M, N/GRN EA .S\n955495401722 1 * 3.00 3.00\nUMOE S/NT 100MX75M, N/YLW EA .S\n955495401395 1 * 3.00 3.00\nUMOE S/NT 50MX38M, N/YLW EA .S\n955495401961 1 * 2.50 2.50\nUMOE S/NT 75MX50M, N/PINK EA .S\n955495401814 1 * 2.50 2.50\n-------------------------------------------------\nItem Count 9\nTotal (RM) 21.40\nRounding Adjustment 0.00\nTotal After Rounding 21.40\nCash 50.00\nCHANGE 28.60\nGST Rate Amt Excl GST(RM) Tax(RM)\nS = 6% 20.19 1.21\nZ = 0% 0.00 0.00\nPoints Missed: 20\nJoin our Meriah Loyalty Programme today!\nPrint Date: 10/08/2017 03:26:22PM\nAny request for production of full tax\ninvoice or related payment information\nshall be made within 3 months from the\ndate of purchase, failing which MYDIN at\nits absolute discretion as deem fit may\nreject or refuse to entertain such\nrequest\nThank You and Please Come Again"
  }
}