{
  "merchant": {
    "name": "SUPER SEVEN CASH & CARRY SDN BHD",
    "address": "NO. 1 Jalan Euro 1 Off Jalan Batu Tiga Sungai Buloh Seksyen U3 Shah Alam, 40150",
    "phone": "03-78590861",
    "tax_id": "000639090688",
    "website": "http://www.super7.com.my"
  },
  "transaction": {
    "date": "2018-03-01",
    "time": "09:23:06",
    "currency": "MYR",
    "payment_method": "MASTER CARD",
    "subtotal": 395.88,
    "tax": 12.57,
    "tip": 0.0,
    "total": 408.45,
    "accounting_category": "Goods and Services",
    "category_confidence": 0.95
  },
  "items": [
    {
      "name": "TENDERLOIN",
      "quantity": 1,
      "unit_price": 43.37,
      "total_price": 43.37,
      "category": "Meat",
      "accounting_category": "Food",
      "category_confidence": 0.95
    },
    {
      "name": "TENDERLOIN",
      "quantity": 1,
      "unit_price": 49.42,
      "total_price": 49.42,
      "category": "Meat",
      "accounting_category": "Food",
      "category_confidence": 0.95
    },
    {
      "name": "TENDERLOIN",
      "quantity": 1,
      "unit_price": 43.9,
      "total_price": 43.9,
      "category": "Meat",
      "accounting_category": "Food",
      "category_confidence": 0.95
    },
    {
      "name": "TENDERLOIN",
      "quantity": 1,
      "unit_price": 49.66,
      "total_price": 49.66,
      "category": "Meat",
      "accounting_category": "Food",
      "category_confidence": 0.95
    },
    {
      "name": "AYAMAS CHICKEN FRANKFURTER 340G",
      "quantity": 8,
      "unit_price": 4.3,
      "total_price": 34.4,
      "category": "Meat",
      "accounting_category": "Food",
      "category_confidence": 0.95
    },
    {
      "name": "BUTTERCUP LUXURY SPREAD 500G",
      "quantity": 1,
      "unit_price": 9.9,
      "total_price": 9.9,
      "category": "Spread",
      "accounting_category": "Food",
      "category_confidence": 0.95
    },
    {
      "name": "BUTTERCUP LUXURY SPREAD 500G",
      "quantity": 1,
      "unit_price": 9.9,
      "total_price": 9.9,
      "category": "Spread",
      "accounting_category": "Food",
      "category_confidence": 0.95
    },
    {
      "name": "QY CINCAU 2KG",
      "quantity": 1,
      "unit_price": 3.9,
      "total_price": 3.9,
      "category": "Beverage",
      "accounting_category": "Food",
      "category_confidence": 0.95
    },
    {
      "name": "CRAB NUGGET 500G MUSHROOM",
      "quantity": 20,
      "unit_price": 8.2,
      "total_price": 164.0,
      "category": "Seafood",
      "accounting_category": "Food",
      "category_confidence": 0.95
    }
  ],
  "summary": {
    "total_items": 35,
    "rounding": 0.0,
    "change_due": 0.0
  },
  "ocr_metadata": {
    "source_image": "sroie_X51005746203.jpg",
    "extraction_engine": "gpt-4o-vision",
    "model_version": "2024-05-13",
    "confidence": 0.95
  },
  "ocr_raw": {
    "full_text": "SUPER SEVEN CASH & CARRY SDN BHD\n(590150-A)\nPASARAYA BORONG SUPER SEVEN\nNO. 1 Jalan Euro 1\nOff Jalan Batu Tiga\nSungai Buloh Seksyen U3 Shah Alam,40150\nhttp://www.super7.com.my\nTEL : 03-78590861\nFAX : 03-78590864\nGST ID : 000639090688\nTAX INVOICE\nCustomer : [77853745]\nMrs. ONG GUAT CHYE\nTAX INVOICE NO : 179509  COUNTER :004\nOPERATOR :[NUR ATIQAH BINTI MUH-CASHIER]\n01-03-2018 09:23:06 AM\n(RM)\nTENDERLOIN @43.37\n4C212 *1 43.37 ZR\n4C240 *1 49.42 ZR\n4C240 *1 43.90 ZR\n4C240 *1 49.66 ZR\nAYAMAS CHICKEN FRANKFURTER 340G @4.30\n9556276020392 *8 34.40 SR\nBUTTERCUP LUXURY SPREAD 500G @9.90\nE888010995552 *1 9.90 SR\nBUTTERCUP LUXURY SPREAD 500G @9.90\nE888010995552 *1 9.90 SR\nQY CINCAU 2KG @3.90\n9554100149455 *1 3.90 SR\nCRAB NUGGET 500G MUSHROOM @8.20\n9557240160502 *20 164.00 SR\nQUANTITY : 35 Units\nTotal Sales (Incl. GST @6%) RM408.45\nRounding Adjustment RM0.00\nNet Total RM408.45\nPayment Method MASTER CARD\nGST Summary Sales Amt Tax Amt\n(RM) (RM)\nZR (0%) 186.35 0.00\nSR (6%) 209.53 12.57\nPLEASE VERIFY YOUR RECEIPT\nBEFORE LEAVING THE COUNTER.\nGOODS SOLD ARE NOT RETURNABLE.\nTHANK YOU"
  }
}