{
  "merchant": {
    "name": "ASO ELECTRICAL TRADING SDN BHD",
    "address": "NO 31G, JALAN SEPADU C 25/C, SECTION 26, TAMAN INDUSTRIES, AXIS 40400 SHAH ALAM, SELANGOR",
    "phone": "03-51221701, 51313091",
    "tax_id": "000683900928",
    "website": ""
  },
  "transaction": {
    "date": "2017-10-13",
    "time": "11:37:00",
    "currency": "MYR",
    "payment_method": "CASH",
    "subtotal": 89.26,
    "tax": 5.36,
    "tip": 0.0,
    "total": 94.6,
    "accounting_category": "Office Supplies",
    "category_confidence": 0.9
  },
  "items": [
    {
      "name": "CABLE LUG 50MM(M10)",
      "quantity": 10,
      "unit_price": 1.43,
      "total_price": 15.12,
      "category": "Electrical",
      "accounting_category": "Office Supplies",
      "category_confidence": 0.9
    },
    {
      "name": "CRIMPING TOOL, HS-38, 5.5MM - 38MM",
      "quantity": 1,
      "unit_price": 75.0,
      "total_price": 79.5,
      "category": "Tools",
      "accounting_category": "Office Supplies",
      "category_confidence": 0.9
    }
  ],
  "summary": {
    "total_items": 11,
    "rounding": -0.02,
    "change_due": 5.4
  },
  "ocr_metadata": {
    "source_image": "sroie_X51005705729.jpg",
    "extraction_engine": "gpt-4o-vision",
    "model_version": "2024-05-13",
    "confidence": 0.95
  },
  "ocr_raw": {
    "full_text": "ASO ELECTRICAL TRADING SDN BHD\n1000131-K\nNO 31G, JALAN SEPADU C 25/C,\nSECTION 26, TAMAN INDUSTRIES,\nAXIS 40400 SHAH ALAM, SELANGOR.\nTEL: 03-51221701, 51313091 FAX: 03-51215716\nGST NO: 000683900928\nTAX INVOICE\nBill To:\nReceipt #: CS00088810 Date: 13/10/2017\nSalesperson: Time: 11:37:00\nCashier: USER\nItem Qty RSP (GST) (GST)\nRSP Amount\n101861 10 1.43 1.51 15.12\nSR: CABLE LUG 50MM(M10)\n107645 1 75.00 79.50 79.50\nSR: CRIMPING TOOL, HS-38, 5.5MM - 38MM\nTOT QTY: 11 94.62\n(Excluded GST) Sub Total : 89.26\nDiscount : 0.00\nTotal GST : 5.36\nRounding : -0.02\nTotal : 94.60\nCASH : 100.00\nChange : 5.40\nGST SUMMARY\nTax Code % Amount GST\nSR 6 89.26 5.36\nTotal : 89.26 5.36\nGOODS SOLD ARE NOT RETURNABLE,\nTHANK YOU."
  }
}