{
  "merchant": {
    "name": "Gardenia Bakeries (KL) Sdn Bhd",
    "address": "Lot 3, Jalan Pelabur 23/1, 40300 Shah Alam, Selangor",
    "phone": "03-55423228",
    "tax_id": "000381399040",
    "website": ""
  },
  "transaction": {
    "date": "2017-09-29",
    "time": "10:23:00",
    "currency": "MYR",
    "payment_method": "",
    "subtotal": 12.98,
    "tax": 0.84,
    "tip": 0.0,
    "total": -1.73,
    "accounting_category": "Adjustment",
    "category_confidence": 0.9
  },
  "items": [
    {
      "name": "O.C. WHITE",
      "quantity": 2,
      "unit_price": 2.13,
      "total_price": 4.26,
      "category": "Bakery",
      "accounting_category": "Product",
      "category_confidence": 0.9
    },
    {
      "name": "WHOLEMEAL",
      "quantity": 1,
      "unit_price": 2.78,
      "total_price": 2.78,
      "category": "Bakery",
      "accounting_category": "Product",
      "category_confidence": 0.9
    },
    {
      "name": "O.C. JUMBO",
      "quantity": 2,
      "unit_price": 2.97,
      "total_price": 5.94,
      "category": "Bakery",
      "accounting_category": "Product",
      "category_confidence": 0.9
    }
  ],
  "summary": {
    "total_items": 5,
    "rounding": 0.0,
    "change_due": 0.0
  },
  "ocr_metadata": {
    "source_image": "sroie_X51006556824.jpg",
    "extraction_engine": "gpt-4o-vision",
    "model_version": "2024-05-13",
    "confidence": 0.95
  },
  "ocr_raw": {
    "full_text": "GARDENIA BAKERIES (KL) SDN BHD (139386 X)\nLot 3, Jalan Pelabur 23/1,\n40300 Shah Alam, Selangor.\nTel: 03-55423228 Fax:03- 55423213\nGST ID: 000381399040\nTAX INVOICE / ADJUSTMENT NOTE\nCash Inv No.: 7929F714\nVE0514 Date: 29/09/2017\nMAKASSAR FRESH MARKET SDN BHD\nGROUND FLOOR, NO. 4 & 6,\nJALAN SS 15/4B,\n47500 SUBANG JAYA, SELANGOR\nVE05: Ridzlan (11906)\nDD: 29/09/2017 10:23\nDescription UP Iss Exc D Sale Amt(RM)\nO.C. WHITE 2.13 3 1 0 2 4.26\nWHOLEMEAL 2.78 3 2 1 0 2.78\nO.C JUMBO 2.97 3 1 0 2 5.94\nTotal 0% supplies: 12.98\nDELICIA-B/SCOTCH 3.72 0 0 0 -1 -3.72\nCR-CHOCLT 0.25 26 0 0 20 -11.40\nMUFFIN C&W 0.75 14 0 0 20 -11.25\nTWG T'MISU 1.33 0 10 0 -10 -13.30\nTotal 6% supplies (excl. GST): -13.87\nGST: -0.84\nTotal 6% supplies (Inc. GST): -14.71\nTotal 0% supplies: 12.98\nTotal Payable: -1.73\nE.&O.E.\nReceived above goods in good order condition.\nThe recipient of Gardenia's products is\nrequired to make necessary adjustments to its\ninput tax claims, on the basic of the\nadjustments shown in this Tax Invoice /\nAdjustment Note\nCUSTOMER'S COPY"
  }
}