{
  "merchant": {
    "name": "Gardenia Bakeries (KL) Sdn Bhd",
    "address": "Lot 3, Jalan Pelabur 23/1, 40300 Shah Alam, Selangor",
    "phone": "03-55423228",
    "tax_id": "000381399040",
    "website": ""
  },
  "transaction": {
    "date": "2017-08-16",
    "time": "11:41:00",
    "currency": "MYR",
    "payment_method": "",
    "subtotal": 58.45,
    "tax": 0.86,
    "tip": 0.0,
    "total": 59.31,
    "accounting_category": "Retail",
    "category_confidence": 0.9
  },
  "items": [
    {
      "name": "O.C. White",
      "quantity": 3,
      "unit_price": 2.13,
      "total_price": 6.39,
      "category": "Bakery",
      "accounting_category": "Food",
      "category_confidence": 0.9
    },
    {
      "name": "Wholemeal",
      "quantity": 5,
      "unit_price": 2.78,
      "total_price": 13.9,
      "category": "Bakery",
      "accounting_category": "Food",
      "category_confidence": 0.9
    },
    {
      "name": "Bonz Saver",
      "quantity": 8,
      "unit_price": 2.97,
      "total_price": 23.76,
      "category": "Bakery",
      "accounting_category": "Food",
      "category_confidence": 0.9
    },
    {
      "name": "Cr-Choclt",
      "quantity": 20,
      "unit_price": 0.72,
      "total_price": 14.4,
      "category": "Bakery",
      "accounting_category": "Food",
      "category_confidence": 0.9
    }
  ],
  "summary": {
    "total_items": 36,
    "rounding": 0.0,
    "change_due": 0.0
  },
  "ocr_metadata": {
    "source_image": "sroie_X51006556657.jpg",
    "extraction_engine": "gpt-4o-vision",
    "model_version": "2024-05-13",
    "confidence": 0.95
  },
  "ocr_raw": {
    "full_text": "GARDENIA BAKERIES (KL) SDN BHD (139386 X)\nLot 3, Jalan Pelabur 23/1, 40300 Shah Alam, Selangor. Tel: 03-55423228 Fax: 03-55423213\nGST ID: 000381399040\nTAX INVOICE / ADJUSTMENT NOTE\nCash Inv No.: 7816F712\nDate: 16/08/2017\nVE0514\nMAKASSAR FRESH MARKET SDN BHD\nGROUND FLOOR, NO. 4 & 6, JALAN SS 15/4B,\n47500 SUBANG JAYA, SELANGOR VE05: Ridzuan(11900)\nDD: 16/08/2017 11:41\nDescription U.P lss Exc D Sale Amt(RM)\nO.C. WHITE 2.13 5 2 0 3 6.39\nWHOLEMEAL 2.78 5 0 0 5 13.90\nBONZ SAVER 2.97 8 0 0 8 23.76\nTotal 0% supplies: 44.05\nCR-CHOCLT 0.72 20 0 0 20 14.40\nTotal 6% supplies (excl. GST): 14.40\nGST: 0.86\nTotal 6% supplies (Inc. GST): 15.26\nTotal 0% supplies: 44.05\nTotal Payable: 59.31\nE.&O.E.\nReceived above goods in good order condition. The recipient of Gardenia's products is required to make necessary adjustments to its input tax claims, on the basic of the adjustments shown in this Tax Invoice / Adjustment Note\nCUSTOMER'S COPY"
  }
}