{
  "merchant": {
    "name": "Gardenia Bakeries (KL) Sdn Bhd",
    "address": "Lot 3, Jalan Pelabur 23/1, 40300 Shah Alam, Selangor",
    "phone": "03-55423228",
    "tax_id": "000381399040",
    "website": ""
  },
  "transaction": {
    "date": "2017-07-21",
    "time": "11:10:00",
    "currency": "MYR",
    "payment_method": "",
    "subtotal": 24.0,
    "tax": 1.44,
    "tip": 0.0,
    "total": 33.05,
    "accounting_category": "Food and Beverage",
    "category_confidence": 0.9
  },
  "items": [
    {
      "name": "O.C. White",
      "quantity": 2,
      "unit_price": 2.13,
      "total_price": 4.26,
      "category": "Bakery",
      "accounting_category": "Food and Beverage",
      "category_confidence": 0.9
    },
    {
      "name": "Wholemeal",
      "quantity": 2,
      "unit_price": 2.78,
      "total_price": 5.56,
      "category": "Bakery",
      "accounting_category": "Food and Beverage",
      "category_confidence": 0.9
    },
    {
      "name": "O.C. Jumbo",
      "quantity": 3,
      "unit_price": 2.97,
      "total_price": 8.91,
      "category": "Bakery",
      "accounting_category": "Food and Beverage",
      "category_confidence": 0.9
    },
    {
      "name": "CR-CHOCLT",
      "quantity": 20,
      "unit_price": 0.72,
      "total_price": 14.4,
      "category": "Confectionery",
      "accounting_category": "Food and Beverage",
      "category_confidence": 0.9
    },
    {
      "name": "KAYA-ORI",
      "quantity": 4,
      "unit_price": 0.24,
      "total_price": 0.96,
      "category": "Confectionery",
      "accounting_category": "Food and Beverage",
      "category_confidence": 0.9
    }
  ],
  "summary": {
    "total_items": 5,
    "rounding": 0.0,
    "change_due": 0.0
  },
  "ocr_metadata": {
    "source_image": "sroie_X51006555780.jpg",
    "extraction_engine": "gpt-4o-vision",
    "model_version": "2024-05-13",
    "confidence": 0.95
  },
  "ocr_raw": {
    "full_text": "GARDENIA BAKERIES (KL) SDN BHD (139386 X)\nLot 3, Jalan Pelabur 23/1, 40300 Shah Alam, Selangor\nTel: 03-55423228 Fax: 03-55423213\nGST ID: 000381399040\n\nTAX INVOICE / ADJUSTMENT NOTE\nCash Inv No.: 7721F711\nDate: 21/07/2017\nMAKASSAR FRESH MARKET SDN BHD\nGROUND FLOOR, NO 4 & 6,\nJALAN SS 15/4B,\n47500 SUBANG JAYA, SELANGOR\n\nDescription  U  P Iss Exc  D Sale Amt(RM)\nO.C. WHITE  2.13  10  8  2  4.26\nWHOLEMEAL  2.78  2  4  2  5.56\nO.C. JUMBO  2.97  10  7  3  8.91\n\nTotal 0% supplies: 7.61\nCR-CHOCLT 0.72 0  20  14.40\nKAYA-ORI 0.40 4  0  4  0.96\n\nTotal 6% supplies (excl. GST): 24.00\nGST: 1.44\nTotal 6% supplies (Inc. GST): 25.44\nTotal 0% supplies: 7.61\nTotal Payable: 33.05\n\nE & O E.\nReceived above goods in good order condition.\nThe recipient of Gardenia's products is\nrequired to make necessary adjustments to its\ninput tax claims, on the basis of the\nadjustments shown in this Tax Invoice /\nAdjustment Note\nCUSTOMER'S COPY"
  }
}