{
  "merchant": {
    "name": "Gardenia Bakeries (KL) Sdn Bhd",
    "address": "Lot 3, Jalan Pelabur 23/1, 40300 Shah Alam, Selangor",
    "phone": "03-55423228",
    "tax_id": "000381399040",
    "website": ""
  },
  "transaction": {
    "date": "2017-09-24",
    "time": "10:47:00",
    "currency": "MYR",
    "payment_method": "Cash",
    "subtotal": 42.37,
    "tax": 0.22,
    "tip": 0.0,
    "total": 38.55,
    "accounting_category": "Sales",
    "category_confidence": 0.9
  },
  "items": [
    {
      "name": "O.C. White",
      "quantity": 5,
      "unit_price": 2.13,
      "total_price": 10.65,
      "category": "Groceries",
      "accounting_category": "Food",
      "category_confidence": 0.9
    },
    {
      "name": "Wholemeal",
      "quantity": 5,
      "unit_price": 2.78,
      "total_price": 13.9,
      "category": "Groceries",
      "accounting_category": "Food",
      "category_confidence": 0.9
    },
    {
      "name": "O.C Jumbo",
      "quantity": 6,
      "unit_price": 2.97,
      "total_price": 17.82,
      "category": "Groceries",
      "accounting_category": "Food",
      "category_confidence": 0.9
    },
    {
      "name": "CR-CHOC LT",
      "quantity": -5,
      "unit_price": 0.72,
      "total_price": -3.6,
      "category": "Groceries",
      "accounting_category": "Food",
      "category_confidence": 0.9
    }
  ],
  "summary": {
    "total_items": 11,
    "rounding": 0.0,
    "change_due": 0.0
  },
  "ocr_metadata": {
    "source_image": "sroie_X51006556829.jpg",
    "extraction_engine": "gpt-4o-vision",
    "model_version": "2024-05-13",
    "confidence": 0.95
  },
  "ocr_raw": {
    "full_text": "GARDENIA BAKERIES (KL) SDN BHD (139386 X)\nLot 3, Jalan Pelabur 23/1,\n40300 Shah Alam, Selangor.\nTel: 03-55423228 Fax:03-55423213\nGST ID: 000381399040\nTAX INVOICE / ADJUSTMENT NOTE\nCash Inv No.: 7924F710\nV E0514 Date: 24/09/2017\nMAKASSAR FRESH MARKET SDN BHD\nGROUND FLOOR, NO. 4 & 6,\nJALAN SS 15/4B,\n47500 SUBANG JAYA, SELANGOR\nVEO5: Ridzuan (11900)\nDD: 24/09/2017 10:47\nDescription U.P Iss Exc D Sale Amt(RM)\nO.C. WHITE 2.13 5 0 5 10.65\nWHOLEMEAL 2.78 5 0 5 13.90\nO.C JUMBO 2.97 6 0 6 17.82\nTotal 0% supplies: 42.37\nCR-CHOCLT 0.72 5 0 5 -3.60\nTotal 6% supplies (excl. GST): -3.60\nGST: -0.22\nTotal 6% supplies (Inc. GST): -3.82\nTotal 0% supplies: 42.37\nTotal Payable: 38.55\nE.&O.E.\nReceived above goods in good order condition.\nThe recipient of Gardenia's products is required to make necessary adjustments to its input tax claims, on the basic of the adjustments shown in this Tax Invoice / Adjustment Note\nCUSTOMER'S COPY"
  }
}