{
  "merchant": {
    "name": "TED HENG STATIONERY & BOOKS",
    "address": "NO. 53, JALAN BESAR, 45600 BATANG BERJUNTAI, SELANGOR DARUL EHSAN",
    "phone": "03-3271 9872",
    "tax_id": "000689913856",
    "website": ""
  },
  "transaction": {
    "date": "2018-01-27",
    "time": "",
    "currency": "MYR",
    "payment_method": "Cash",
    "subtotal": 25.8,
    "tax": 1.55,
    "tip": 0.0,
    "total": 27.35,
    "accounting_category": "Office Supplies",
    "category_confidence": 0.9
  },
  "items": [
    {
      "name": "DOUBLE SIDE FOAM TAPE 18MM",
      "quantity": 1,
      "unit_price": 3.96,
      "total_price": 3.8,
      "category": "Office Supplies",
      "accounting_category": "Office Supplies",
      "category_confidence": 0.9
    },
    {
      "name": "CAMIS SQ BOOK 200",
      "quantity": 5,
      "unit_price": 2.74,
      "total_price": 13.0,
      "category": "Office Supplies",
      "accounting_category": "Office Supplies",
      "category_confidence": 0.9
    },
    {
      "name": "EAGLE F4 200 FOOLSCAP BOOK",
      "quantity": 1,
      "unit_price": 5.47,
      "total_price": 5.2,
      "category": "Office Supplies",
      "accounting_category": "Office Supplies",
      "category_confidence": 0.9
    },
    {
      "name": "EAGLE F4 120 NUMBERING FOOLSCAP BOOK",
      "quantity": 1,
      "unit_price": 3.96,
      "total_price": 3.8,
      "category": "Office Supplies",
      "accounting_category": "Office Supplies",
      "category_confidence": 0.9
    }
  ],
  "summary": {
    "total_items": 8,
    "rounding": 0.0,
    "change_due": 0.0
  },
  "ocr_metadata": {
    "source_image": "sroie_X51005361906.jpg",
    "extraction_engine": "gpt-4o-vision",
    "model_version": "2024-05-13",
    "confidence": 0.95
  },
  "ocr_raw": {
    "full_text": "TED HENG STATIONERY & BOOKS\n(000751837-M)\nNO. 53, JALAN BESAR, 45600 BATANG BERJUNTAI\nSELANGOR DARUL EHSAN\nTEL: 03-3271 9872 FAX: 03-32719481\nGST NO.: 000689913856\nSIMPLIFIED TAX INVOICE\nCASH\nReceipt No.: CS1801/27175 Date: 27/01/2018\nITEM QTY U/P DISC % AMOUNT\n(RM)\n1355 1 3.96 4.09 3.80 *\n- DOUBLE SIDE FOAM TAPE 18MM\n9557950605126 5 2.74 4.96 13.00 *\n- CAMIS SQ BOOK 200\n9557369319029 1 5.47 4.96 5.20 *\n- EAGLE F4 200 FOOLSCAP BOOK\n9557369305006 1 3.96 4.09 3.80 *\n- EAGLE F4 120 NUMBERING FOOLSCAP\nBOOK\nTotal Qty.: 8 25.80\nSUB-TOTAL (EX): 25.80\nTOTAL TAX : 1.55\nROUNDING: 0.00\nTOTAL : 27.35\nCASH : 27.35\nCHANGE : 0.00\nGST SUMMARY\nTAX CODE % AMOUNT TAX\n(RM) (RM)\nSR 6.00 25.80 1.55\nTOTAL : 25.80 1.55\nNote: (*) Indicated The Item Sold Has Been Related\nTo GST (Goods & Services Tax).\nGOODS SOLD ARE NOT RETURNABLE.\nTHANK YOU."
  }
}