{
  "merchant": {
    "name": "Gardenia Bakeries (KL) Sdn Bhd (139386 X)",
    "address": "Lot 3, Jalan Pelabur 23/1, 40300 Shah Alam, Selangor",
    "phone": "03-55423228",
    "tax_id": "000381399040",
    "website": ""
  },
  "transaction": {
    "date": "2017-09-20",
    "time": "12:18:00",
    "currency": "MYR",
    "payment_method": "",
    "subtotal": 24.55,
    "tax": 0.09,
    "tip": 0.0,
    "total": 23.02,
    "accounting_category": "Grocery",
    "category_confidence": 0.9
  },
  "items": [
    {
      "name": "O.C. White",
      "quantity": 5,
      "unit_price": 2.13,
      "total_price": 10.65,
      "category": "Bakery",
      "accounting_category": "Grocery",
      "category_confidence": 0.9
    },
    {
      "name": "Wholemeal",
      "quantity": 5,
      "unit_price": 2.78,
      "total_price": 13.9,
      "category": "Bakery",
      "accounting_category": "Grocery",
      "category_confidence": 0.9
    },
    {
      "name": "CR-CHOCLT",
      "quantity": 2,
      "unit_price": 0.72,
      "total_price": -1.44,
      "category": "Discount",
      "accounting_category": "Grocery",
      "category_confidence": 0.9
    }
  ],
  "summary": {
    "total_items": 3,
    "rounding": 0.0,
    "change_due": 0.0
  },
  "ocr_metadata": {
    "source_image": "sroie_X51006556810.jpg",
    "extraction_engine": "gpt-4o-vision",
    "model_version": "2024-05-13",
    "confidence": 0.95
  },
  "ocr_raw": {
    "full_text": "GARDENIA BAKERIES (KL) SDN BHD (139386 X)\nLot 3, Jalan Pelabur 23/1,\n40300 Shah Alam, Selangor.\nTel: 03-55423228 Fax:03-55423213\nGST ID: 000381399040\nTAX INVOICE / ADJUSTMENT NOTE\nCash Inv No.: 7920F714\nDate: 20/09/2017\nVE0514\nMAKASSAR FRESH MARKET SDN BHD\nGROUND FLOOR, NO. 4 & 6,\nJALAN SS 15/4B,\n47500 SUBANG JAYA, SELANGOR\nVE05: Ridzuan (11900)\nDD: 20/09/2017 12:18\nDescription U.P Iss Exc D Sale Amt(RM)\nO.C. WHITE 2.13 5 0 0 5 10.65\nWHOLEMEAL 2.78 5 0 0 5 13.90\nTotal 0% supplies: 24.55\nCR-CHOCLT 0.72 0 2 0 -2 -1.44\nTotal 6% supplies (excl. GST) -1.44\nGST: -0.09\nTotal 6% supplies (Inc. GST): -1.53\nTotal 0% supplies: 24.55\nTotal Payable: 23.02\n\nCUSTOMER'S COPY"
  }
}