{
  "merchant": {
    "name": "SYARIKAT PERNIAGAAN GIN KEE",
    "address": "NO 290, JALAN AIR PANAS, SETAPAK, 53200, KUALA LUMPUR",
    "phone": "03-40210276",
    "tax_id": "000750673920",
    "website": ""
  },
  "transaction": {
    "date": "2018-04-01",
    "time": "15:39:00",
    "currency": "MYR",
    "payment_method": "CASH",
    "subtotal": 42.2,
    "tax": 2.53,
    "tip": 0.0,
    "total": 44.73,
    "accounting_category": "Office Supplies",
    "category_confidence": 0.9
  },
  "items": [
    {
      "name": "25MM GI NIPPLE",
      "quantity": 1,
      "unit_price": 3.71,
      "total_price": 3.71,
      "category": "Plumbing",
      "accounting_category": "Office Supplies",
      "category_confidence": 0.9
    },
    {
      "name": "SEAL TAPE",
      "quantity": 2,
      "unit_price": 0.64,
      "total_price": 1.27,
      "category": "Plumbing",
      "accounting_category": "Office Supplies",
      "category_confidence": 0.9
    },
    {
      "name": "32MM POLY SOCKET",
      "quantity": 1,
      "unit_price": 5.83,
      "total_price": 5.83,
      "category": "Plumbing",
      "accounting_category": "Office Supplies",
      "category_confidence": 0.9
    },
    {
      "name": "1\" BALL VALVE",
      "quantity": 1,
      "unit_price": 33.92,
      "total_price": 33.92,
      "category": "Plumbing",
      "accounting_category": "Office Supplies",
      "category_confidence": 0.9
    }
  ],
  "summary": {
    "total_items": 5,
    "rounding": 0.0,
    "change_due": 0.0
  },
  "ocr_metadata": {
    "source_image": "sroie_X51005676538.jpg",
    "extraction_engine": "gpt-4o-vision",
    "model_version": "2024-05-13",
    "confidence": 0.95
  },
  "ocr_raw": {
    "full_text": "SYARIKAT PERNIAGAAN GIN KEE\n(81109-A)\nNO 290, JALAN AIR PANAS,\nSETAPAK,\n53200, KUALA LUMPUR.\nTEL : 03-40210276\nGST ID : 000750673920\nSIMPLIFIED TAX INVOICE\nCASH\nDoc No. : CS00012543 Date: 04/01/2018\nCashier : USER Time: 15:39:00\nSalesperson : Ref. :\nItem Qty S/Price Amount Tax\n2402 1 3.71 3.71 SR\n25MM GI NIPPLE\n1462 2 0.64 1.27 SR\nSEAL TAPE\n1748 1 5.83 5.83 SR\n32MM POLY SOCKET\n2247 1 33.92 33.92 SR\n1\" BALL VALVE\nTotal Qty: 5 44.73\nTotal Sales (Excluding GST) : 42.20\nDiscount : 0.00\nTotal GST : 2.53\nRounding : 0.00\nTotal Sales (Inclusive of GST) : 44.73\nCASH : 44.73\nChange : 0.00\nGST SUMMARY\nTax Code % Amt (RM) Tax (RM)\nSR 6 42.20 2.53\nTotal : 42.20 2.53 /\nGOODS SOLD ARE NOT RETURNABLE, THANK YOU."
  }
}