{
  "merchant": {
    "name": "SANYU STATIONERY SHOP",
    "address": "No. 31G & 33G, Jalan Setia Indah X, U13/X, 40170 Setia Alam",
    "phone": "+603-3362 4137",
    "tax_id": "001531760640",
    "website": ""
  },
  "transaction": {
    "date": "2017-09-20",
    "time": "",
    "currency": "MYR",
    "payment_method": "Cash",
    "subtotal": 11.32,
    "tax": 0.68,
    "tip": 0.0,
    "total": 12.0,
    "accounting_category": "Office Supplies",
    "category_confidence": 0.95
  },
  "items": [
    {
      "name": "Photocopy Services - A4 Size",
      "quantity": 100,
      "unit_price": 0.1,
      "total_price": 10.0,
      "category": "Services",
      "accounting_category": "Office Supplies",
      "category_confidence": 0.95
    },
    {
      "name": "Cutting Charges",
      "quantity": 1,
      "unit_price": 2.0,
      "total_price": 2.0,
      "category": "Services",
      "accounting_category": "Office Supplies",
      "category_confidence": 0.95
    }
  ],
  "summary": {
    "total_items": 2,
    "rounding": 0.0,
    "change_due": 3.0
  },
  "ocr_metadata": {
    "source_image": "sroie_X51007339126.jpg",
    "extraction_engine": "gpt-4o-vision",
    "model_version": "2024-05-13",
    "confidence": 0.95
  },
  "ocr_raw": {
    "full_text": "SANYU STATIONERY SHOP\nNo. 31G&33G, JALAN SETIA INDAH X, U13/X\n40170 SETIA ALAM\nMobile /Whatsapp : +6012-918 7937\nTel: +603-3362 4137\nGST ID NO: 001531760640\nTAX INVOICE\nOwned By :\nSANYU SUPPLY SDN BHD (1135772-K)\nCASH SALES COUNTER\n1. 5000-0001 PHOTOCOPY SERVICES - A4 SIZE\n100 X 0.1000 10.00\n2. 9100-0007 CUTTING CHARGES\n1 X 2.0000 2.00\nTotal Sales Inclusive GST @6% 12.00\nDiscount 0.00\nTotal 12.00\nRound Adj 0.00\nFinal Total 12.00\nCASH 15.00\nCHANGE 3.00\nGST Summary Amount(RM) Tax(RM)\nSR @ 6% 11.32 0.68\nINV NO: CS-SA-0112230 Date: 20/09/2017\nGoods sold are not Returnable & Refundable\nTHANK YOU FOR YOUR PATRONAGE\nPLEASE COME AGAIN.\nTERIMA KASIH SILA DATANG LAGI\n** PLEASE KEEP THIS RECEIPT FOR PROVE OF\nPURCHASE DATE FOR I.T PRODUCT WARRANTY\nPURPOSE **\nFollow us in Facebook : Sanyu.Stationery"
  }
}