{
  "merchant": {
    "name": "BENS INDEPENDENT GROCER SDN. BHD",
    "address": "Lot 6, Jalan Batai, Plaza Batai, Damansara Heights, 50490, Kuala Lumpur",
    "phone": "03-2093 7358",
    "tax_id": "000243941376",
    "website": "BIG.COM.MY"
  },
  "transaction": {
    "date": "2018-12-03",
    "time": "20:29:59",
    "currency": "MYR",
    "payment_method": "Cash",
    "subtotal": 77.2,
    "tax": 3.03,
    "tip": 0.0,
    "total": 77.2,
    "accounting_category": "Groceries",
    "category_confidence": 0.9
  },
  "items": [
    {
      "name": "Dole Pineapple Pcs",
      "quantity": 3,
      "unit_price": 7.9,
      "total_price": 23.7,
      "category": "Fruit",
      "accounting_category": "Groceries",
      "category_confidence": 0.9
    },
    {
      "name": "Evian Mineral Water 6x1.25L",
      "quantity": 1,
      "unit_price": 53.5,
      "total_price": 53.5,
      "category": "Beverages",
      "accounting_category": "Groceries",
      "category_confidence": 0.9
    }
  ],
  "summary": {
    "total_items": 2,
    "rounding": 0.0,
    "change_due": 22.8
  },
  "ocr_metadata": {
    "source_image": "sroie_X51005444033.jpg",
    "extraction_engine": "gpt-4o-vision",
    "model_version": "2024-05-13",
    "confidence": 0.95
  },
  "ocr_raw": {
    "full_text": "BENS INDEPENDENT GROCER SDN. BHD (913144-A) Lot 6, Jalan Batai, Plaza Batai, Damansara Heights, 50490, Kuala Lumpur T: 03-2093 7358 | F: 03-2093 7359 (GST REG NO 000243941376) Tax Invoice : BAT02201803120255 12/03/18 Cashier : Fatin Sy 20:29:59 Dole Pineapple Pcs 8809069300708 7.90*3 23.70 Z Evian Mineral Water 6x1.25L 3068320113784 53.50*1 53.50 S Item 2 Total with GST @ 6% 77.20 Qty 4 Rounding 0.00 Total Saving 0.00 Total 77.20 Tender Cash 100.00 Change 22.80 GST Analysis Goods Tax Amount S = 6% 50.47 3.03 Z = 0% 23.70 0.00 BIG.COM.MY FACEBOOK.COM/THEBIGGROUP EXCHANGE & REFUND MAY BE ALLOWED WITHIN 3 DAYS WITH ORIGINAL TAX INVOICE THANK YOU, PLEASE COME AGAIN"
  }
}