{
  "merchant": {
    "name": "Gardenia Bakeries (KL) Sdn Bhd",
    "address": "Lot 3, Jalan Pelabur 23/1, 40300 Shah Alam, Selangor",
    "phone": "03-55423228",
    "tax_id": "000381399040",
    "website": ""
  },
  "transaction": {
    "date": "2017-07-23",
    "time": "11:23:00",
    "currency": "MYR",
    "payment_method": "",
    "subtotal": 31.39,
    "tax": 0.27,
    "tip": 0.0,
    "total": 26.58,
    "accounting_category": "Food & Beverage",
    "category_confidence": 0.9
  },
  "items": [
    {
      "name": "O.C. White",
      "quantity": 11,
      "unit_price": 2.13,
      "total_price": 23.43,
      "category": "Bakery",
      "accounting_category": "Food & Beverage",
      "category_confidence": 0.9
    },
    {
      "name": "Wholemeal",
      "quantity": 5,
      "unit_price": 2.78,
      "total_price": 13.9,
      "category": "Bakery",
      "accounting_category": "Food & Beverage",
      "category_confidence": 0.9
    },
    {
      "name": "O.C. JUMBO",
      "quantity": -2,
      "unit_price": 2.97,
      "total_price": -5.94,
      "category": "Bakery",
      "accounting_category": "Food & Beverage",
      "category_confidence": 0.9
    },
    {
      "name": "CR-CHOCLT",
      "quantity": 12,
      "unit_price": 0.72,
      "total_price": 7.2,
      "category": "Bakery",
      "accounting_category": "Food & Beverage",
      "category_confidence": 0.9
    },
    {
      "name": "TWIG-CHOC",
      "quantity": 2,
      "unit_price": 1.33,
      "total_price": 2.66,
      "category": "Bakery",
      "accounting_category": "Food & Beverage",
      "category_confidence": 0.9
    }
  ],
  "summary": {
    "total_items": 28,
    "rounding": 0.0,
    "change_due": 0.0
  },
  "ocr_metadata": {
    "source_image": "sroie_X51006555819.jpg",
    "extraction_engine": "gpt-4o-vision",
    "model_version": "2024-05-13",
    "confidence": 0.95
  },
  "ocr_raw": {
    "full_text": "GARDENIA BAKERIES (KL) SDN BHD (13986 X)\nLot 3, Jalan Pelabur 23/1,\n40300 Shah Alam, Selangor.\nTel: 03-55423228 Fax:03-55423213\nGST ID: 000381399040\nTAX INVOICE / ADJUSTMENT NOTE\nCash Inv No.: 7723F712\nVE0514 Date: 23/07/2017\nMAKASSAR FRESH MARKET SDN BHD\nGROUND FLOOR, NO. & 6,\nJALAN SS 15/4B,\n47500 SUBANG JAYA, SELANGOR\nVE05: Ridzuwan(1900)\nDD: 23/07/2017 11:23\nDescription         U.P  Iss  Exc  D Sale  Amt(RM)\nO.C. WHITE      2.13 15 * 4 0  11  23.43\nWHOLEMEAL       2.78  6 * 4 0  5  13.90\nO.C JUMBO       2.97  5  7  0 -2 -5.94\nTotal 0% supplies: 31.39\nCR-CHOCLT       0.72 10 * 0 10% 0 12 7.20\nTWIG-CHOC       1.33  20  18.0  2  2.66\nTotal 6% supplies (excl. GST): -4.54\nGST: -0.27\nTotal 6% supplies (Inc. GST): -4.81\nTotal 0% supplies: 31.39\nTotal Payable: 26.58\nE.&O.E\nReceived above goods in good order condition.\nThe recipient of Gardenia's products is\nrequired to make necessary adjustments to its\ninput tax claims, on the basis of the\nadjustments shown in this Tax Invoice /\nAdjustment Note\nCUSTOMER'S COPY"
  }
}