{
  "merchant": {
    "name": "ENW Hardware Centre (M) Sdn. Bhd.",
    "address": "No: G3, Blk G, Jln PJU 1A/3, Ara Damansara, 47301, Petaling Jaya, Selangor Darul Ehsan.",
    "phone": "03-7832 6929, 012-659 9829",
    "tax_id": "000155453440",
    "website": ""
  },
  "transaction": {
    "date": "2018-04-14",
    "time": "",
    "currency": "MYR",
    "payment_method": "Cash",
    "subtotal": 147.17,
    "tax": 8.83,
    "tip": 0.0,
    "total": 156.0,
    "accounting_category": "Supplies",
    "category_confidence": 0.9
  },
  "items": [
    {
      "name": "5L. T. 'Nippon' Vinilex EasyWash",
      "quantity": 1,
      "unit_price": 99.0,
      "total_price": 99.0,
      "category": "Paint",
      "accounting_category": "Supplies",
      "category_confidence": 0.9
    },
    {
      "name": "Cristin 4\" Blue Stripe Roller Refill",
      "quantity": 1,
      "unit_price": 30.0,
      "total_price": 30.0,
      "category": "Tools",
      "accounting_category": "Supplies",
      "category_confidence": 0.9
    },
    {
      "name": "1\" Nylon Paint Brush",
      "quantity": 1,
      "unit_price": 3.5,
      "total_price": 3.5,
      "category": "Tools",
      "accounting_category": "Supplies",
      "category_confidence": 0.9
    },
    {
      "name": "4\" x 24\" Roller Handle",
      "quantity": 1,
      "unit_price": 2.5,
      "total_price": 2.5,
      "category": "Tools",
      "accounting_category": "Supplies",
      "category_confidence": 0.9
    },
    {
      "name": "'Clipsal' 4g 1w Switch",
      "quantity": 1,
      "unit_price": 21.0,
      "total_price": 21.0,
      "category": "Electrical",
      "accounting_category": "Supplies",
      "category_confidence": 0.9
    }
  ],
  "summary": {
    "total_items": 5,
    "rounding": 0.0,
    "change_due": 0.0
  },
  "ocr_metadata": {
    "source_image": "sroie_X51007225399.jpg",
    "extraction_engine": "gpt-4o-vision",
    "model_version": "2024-05-13",
    "confidence": 0.95
  },
  "ocr_raw": {
    "full_text": "ENW Hardware Centre (M) Sdn. Bhd. Co. Reg. No.: 795225-A GST Reg. No.: 000155453440 No: G3, Blk G, Jln PJU 1A/3, Ara Damansara, 47301, Petaling Jaya, Selangor Darul Ehsan. TEL: 03-7832 6929, 012-659 9829 14/04/2018 Tax Invoice No: CS00233521 Cash Sale (Ara D'sara) Tel: 03-7832 6929 H/P: 012-659 9829 Item Qty U.Price RM V EWT5 1.00 99.00 99.00 SR 5L. T. 'Nippon' Vinilex EasyWash. NP N 1882T 000605 1.00 30.00 30.00 SR Cristin 4\" Blue Stripe Roller Refill 002882 1.00 3.50 3.50 SR 1\" Nylon Paint Brush. 001065 1.00 2.50 2.50 SR 4\" x 24\" Roller Handle. 001741 1.00 21.00 21.00 SR 'Clipsal' 4g 1w Switch Total Amt Incl. GST @ 6 % : 156.00 Rounding Adjustment: 0.00 Total Amt Payable : 156.00 Total Qty Tender : 5 GST Summary Amount (RM) GST (RM) SR = 6 % 147.17 8.83 POIN 0.00 'Goods sold are not returnable Thank you for shopping at ENW Hardware Centre (M) Sdn Bhd."
  }
}