{
  "merchant": {
    "name": "ASO Electrical Trading SDN BHD",
    "address": "NO 31G, Jalan Sepadu C 25/C, Section 25, Taman Industries, Axis 40400 Shah Alam, Selangor.",
    "phone": "03-51221701, 51313091",
    "tax_id": "000683900928",
    "website": ""
  },
  "transaction": {
    "date": "2017-09-27",
    "time": "10:51:00",
    "currency": "MYR",
    "payment_method": "Cash",
    "subtotal": 234.0,
    "tax": 14.04,
    "tip": 0.0,
    "total": 248.05,
    "accounting_category": "Office Supplies",
    "category_confidence": 0.9
  },
  "items": [
    {
      "name": "Hager Timer, 24hrs Power Reserve",
      "quantity": 3,
      "unit_price": 78.0,
      "total_price": 248.04,
      "category": "Electrical Supplies",
      "accounting_category": "Office Supplies",
      "category_confidence": 0.9
    }
  ],
  "summary": {
    "total_items": 3,
    "rounding": 0.01,
    "change_due": 0.0
  },
  "ocr_metadata": {
    "source_image": "sroie_X51005705722.jpg",
    "extraction_engine": "gpt-4o-vision",
    "model_version": "2024-05-13",
    "confidence": 0.95
  },
  "ocr_raw": {
    "full_text": "ASO ELECTRICAL TRADING SDN BHD\n1000131-K\nNO 31G, JALAN SEPADU C 25/C,\nSECTION 25, TAMAN INDUSTRIES,\nAXIS 40400 SHAH ALAM, SELANGOR.\nTEL: 03-51221701, 51313091 FAX: 03-51215716\nGST NO: 000683900928\nTAX INVOICE\nBill To:\nReceipt #: CS00087400 Date: 27/09/2017\nSalesperson: Time: 10:51:00\nCashier: USER\n(GST) (GST)\nItem Qty RSP RSP Amount\n107636 3 78.00 82.68 248.04\nSR: HAGER TIMER, 24HRS POWER RESERVE\nTOT QTY: 3 248.04\n(Excluded GST) Sub Total : 234.00\nDiscount : 0.00\nTotal GST : 14.04\nRounding : 0.01\nTotal : 248.05\nCASH : 248.05\nChange : 0.00\nGST SUMMARY\nTax Code % Amount GST\nSR 6 234.00 14.04\nTotal: 234.00 14.04\nGOODS SOLD ARE NOT RETURNABLE,\nTHANK YOU."
  }
}