{
  "merchant": {
    "name": "SUPERMERCADO ROCHA S.A.",
    "address": "Rua 1 de Dezembro 45-3, 1249-057 Lisboa",
    "phone": "",
    "tax_id": "500403201",
    "website": ""
  },
  "transaction": {
    "date": "2019-05-18",
    "time": "14:13:13",
    "currency": "EUR",
    "payment_method": "Cartão",
    "subtotal": 8.74,
    "tax": 0.54,
    "tip": 0.0,
    "total": 9.38,
    "accounting_category": "Groceries",
    "category_confidence": 0.9
  },
  "items": [
    {
      "name": "SCHAR PAO FORMA S.G CLASSICO 300G",
      "quantity": 1,
      "unit_price": 3.29,
      "total_price": 3.29,
      "category": "Gluten Free",
      "accounting_category": "Groceries",
      "category_confidence": 0.9
    },
    {
      "name": "BEBIDA SOJA 1L BIO ADOC.MACA C CALCIO",
      "quantity": 1,
      "unit_price": 1.99,
      "total_price": 1.99,
      "category": "Beverages",
      "accounting_category": "Groceries",
      "category_confidence": 0.9
    },
    {
      "name": "SCHAR QUEQUES S.G MUFFINS 260G",
      "quantity": 1,
      "unit_price": 3.99,
      "total_price": 3.99,
      "category": "Gluten Free",
      "accounting_category": "Groceries",
      "category_confidence": 0.9
    },
    {
      "name": "SACO PAPEL GRANDE 34x32x11",
      "quantity": 3,
      "unit_price": 0.11,
      "total_price": 0.33,
      "category": "Supplies",
      "accounting_category": "Groceries",
      "category_confidence": 0.9
    }
  ],
  "summary": {
    "total_items": 4,
    "rounding": 0.0,
    "change_due": 0.0
  },
  "ocr_metadata": {
    "source_image": "zenodo_20210428_225229.jpg",
    "extraction_engine": "gpt-4o-vision",
    "model_version": "2024-05-13",
    "confidence": 0.95
  },
  "ocr_raw": {
    "full_text": "SUPERMERCADO ROCHA S.A.\nRua 1 de Dezembro 45-3\n1249-057 Lisboa\nContribuinte: 500403201\nEstabelecimento: 1 DEZEMBRO\n\nFatura\n2019-05-18 14:13 FT 20192003/203\nV/N.Contribuinte: 510776914\nFLIKEHOME\n\nDescrição Taxa Quant Preco Valor\nProduto sem Gluten\nSCHAR PAO FORMA S.G CLASSICO 300G\n329156 1 1 3.29 3.29\nBEBIDA SOJA 1L BIO ADOC.MACA C CALCIO\n139809 1 1 1.99 1.99\nProduto sem Gluten\nSCHAR QUEQUES S.G MUFFINS 260G\n380478 1 1 3.99 3.99\nSACO PAPEL GRANDE 34x32x11\n352956 3 1 0.11 0.11\n\nTotal Euros.................. 9.38\n\nTaxa B.Tributável Imposto Total\n1- 6.00% 8.745 0.525 9.27\n3-23.00% 0.089 0.021 0.11\nTotais.................. 0.545 9.38\n\nWRK+Processado por programa\nCertificado Nr. 2129/AT\n\nProdutos de Agricultura Biológica\nControlados por PT-BIO-03\n\nCarga: 18-05-2019 14:13:13\n\nDevoluções ou troca só no prazo de 15\ndias por desconformidade do mesmo\nmediante apresentação do talão e de\npreferência na loja onde o adquiriu.\nCompras pagas com o cartão têm direito\nao difeito a troca por outros\nprodutos nas condições anteriores.\n\nM.Banco....................9.38\nTroco.......................0.0"
  }
}