{
  "merchant": {
    "name": "PROPEL Produtos de Petroleo, Lda.",
    "address": "A2 - Km 193/Sub-Lanco Castro Verde 7701 Almodovar",
    "phone": "",
    "tax_id": "500223840",
    "website": ""
  },
  "transaction": {
    "date": "2019-03-01",
    "time": "15:11:27",
    "currency": "EUR",
    "payment_method": "DINHEIRO",
    "subtotal": 16.52,
    "tax": 3.8,
    "tip": 0.0,
    "total": 20.32,
    "accounting_category": "Fuel",
    "category_confidence": 0.95
  },
  "items": [
    {
      "name": "S-CH 95",
      "quantity": 1,
      "unit_price": 1.549,
      "total_price": 20.32,
      "category": "Fuel",
      "accounting_category": "Fuel",
      "category_confidence": 0.95
    }
  ],
  "summary": {
    "total_items": 1,
    "rounding": 0.0,
    "change_due": 0.0
  },
  "ocr_metadata": {
    "source_image": "zenodo_20210428_191730.jpg",
    "extraction_engine": "gpt-4o-vision",
    "model_version": "2024-05-13",
    "confidence": 0.95
  },
  "ocr_raw": {
    "full_text": "PROPEL Produtos de Petroleo, Lda.\nCapital Social 224,459,05 Euros\nC.R.C de Lisboa Sob 500223840\n63376 P.A. ALMODOVAR II ( nascente)\nN.CONTRIB: 500223840\nA2 - Km 193/Sub-Lanco Castro Verde\n7701 Almodovar\nUnid. Codigo Artigo Preço Valor\n13.12 023574 03 S-CH 95 1.549 20.32\nTOTAL: EUR 20.32\nIVA 23.0% Base: 16.52 Imposto: 3.80\nTOTAL A PAGAR: EUR 20.32\nDINHEIRO EUR 20.32\nCaixa: 713992\nRecibo:..0.2.0.131 01/03/2019 15:11:27\nRef:... 0834000168 TSO... 0000447219\nNome: FLlKEHOME MEDIACAO IMOBIL. LD\nNIF: 510776914\nMATRICULA: 20-ID-84\nMORADA:\nDATA: 01/03/2019 15:11:27\nFATURA NR:\nFT 63376100012019/00001440\ni Joon - Processado por Programa\nCertificado N°: 1299/AT\nPROTECAO DE DADOS PESSOAIS\nSe e uma pessoa singular, informamos que os seus dados\nsefrara tratados com a finalidade de gerir a relaceo co-\nmercial con a Sociedade do Grupo Cepsa emissora deste\ndocumento, cfr. politika de privacidad em\nwww.cepsa.com. Os seus dados poderan ser cedidos a ter-\nceiros: Bancos, Administracio Publica e sociedades de\ncobranqa, bem como as sociedades do Grupo Cepsa, cfr.\nwww.cepsa.com. Os dados pessoais serao conservados en-\nquanto se mantenha a relacao comercial e nao serao\neliminados sem sejam necessarios co cumprimento de\nobrigagoes legais ou para a petigao, exercicio e de-\nfesa de reclamagoes. Pode exercer os direitos\nde acceso, retificacao, coppapo, alteragdo e cancela-\nmento, bem como a limitacao ao tratamento, revogacao,\nportabilidadé nao estar sujeito a decisoes indivi-\nduais automatizadas, para o correio eletronico:\nderechos.arco@cepsa.com\nMUITO OBRIGADO"
  }
}