{
  "merchant": {
    "name": "Tomas Ribeiro",
    "address": "Pt. 213136180, Pingo Doce - Distribuicao Alimentar, S.A., Sede: R Actor António Silva, N7, 1649-033 Lisboa",
    "phone": "",
    "tax_id": "500829993",
    "website": ""
  },
  "transaction": {
    "date": "2019-07-27",
    "time": "14:04:00",
    "currency": "EUR",
    "payment_method": "",
    "subtotal": 15.66,
    "tax": 1.61,
    "tip": 0.0,
    "total": 13.06,
    "accounting_category": "Grocery",
    "category_confidence": 0.95
  },
  "items": [
    {
      "name": "CAFE DELTA CUBA 220G",
      "quantity": 3,
      "unit_price": 3.09,
      "total_price": 9.27,
      "category": "Groceries",
      "accounting_category": "Groceries",
      "category_confidence": 0.9
    },
    {
      "name": "CAFE LT CHAV M 250G",
      "quantity": 1,
      "unit_price": 2.94,
      "total_price": 2.94,
      "category": "Groceries",
      "accounting_category": "Groceries",
      "category_confidence": 0.9
    },
    {
      "name": "IOG GREGO NAT P500G",
      "quantity": 4,
      "unit_price": 1.34,
      "total_price": 5.36,
      "category": "Dairy",
      "accounting_category": "Dairy",
      "category_confidence": 0.9
    },
    {
      "name": "COMPAL LARANJA 1 LT",
      "quantity": 1,
      "unit_price": 0.99,
      "total_price": 0.99,
      "category": "Beverages",
      "accounting_category": "Beverages",
      "category_confidence": 0.9
    },
    {
      "name": "CO S/30 SACO PLAST RECICL PD",
      "quantity": 1,
      "unit_price": 0.1,
      "total_price": 0.1,
      "category": "Household",
      "accounting_category": "Household",
      "category_confidence": 0.9
    }
  ],
  "summary": {
    "total_items": 10,
    "rounding": 0.0,
    "change_due": 36.94
  },
  "ocr_metadata": {
    "source_image": "zenodo_20210429_200356.jpg",
    "extraction_engine": "gpt-4o-vision",
    "model_version": "2024-05-13",
    "confidence": 0.95
  },
  "ocr_raw": {
    "full_text": "TOMAS RIBEIRO\nTel .: 213136180\nPingo Doce - Distribuição Alimentar, S.A.\nSede : R Actor António Silva, N 7, 1649-033 Lisboa\nRegisto C.R.C. Lisboa-Matricula/NIPC: 500829993\nANREEE: PT001730 \nV. Social : 33,808,115 EUR\nArtigos\nMERCER IA E PET FOOD\nE 23% CAFE DELTA CUBA 220G\n3 x 3.09 9.27\nPoupança Imediata (4.65)\nE 23% CAFE LT CHAV M 250G\n2.94\nPoupança Imediata (0.95)\nPRODUTOS LACTEOS\nC 6% IOG GREGO NAT P500G\n4 x 1.34 5.36\nBEBIDAS\nC 6% COMPAL LARANJA 1 LT\n0.99\nDETERGE & PROD. LIMPEZA\nC 23% SACO PLAST RECICL PD\n0.10\nResumo\nTOTAL 15.66\nTOTAL POUPANÇA (5.60)\nTOTAL A PAGAR 13.06\nPagamentos\nTOTAL PAGO 50.00\nTROCO 36.94\nEURO\nResumo IVA\nTaxa Valor s/IVA Valor IVA Valor c/IVA\nC 6% 5.99 0.36 6.35\nE 23% 5.71 1.25 6.71\nNESTA COMPRA POUPOU\n5.60 €\nAtendido por: Geralda Duarte\n002079 2019-07-27 14:04 0038 0003 0440\nVify-Processado por programa certificado 369/AT\nFactura Simplificada FS 0440003197021225/001698\n1ª Via Original Data de emissão:27-07-2019\nN. Contribuinte: 510776914\nFactura necessária para troca em 15 dias\n(Artigos Têxtil e Calçado prazo 30 dias)\nNão se trocam medicamentos e artigos assinalados\nApoio ao Cliente\n808 20 45 45 / 210 11 44 11 (24 horas)"
  }
}