{
  "merchant": {
    "name": "AZ DE COMER",
    "address": "RUA ALMEIDA E SOUSA, 32, 1350-012 CAMPO DE OURIQUE",
    "phone": "Tel.213856496",
    "tax_id": "501692070",
    "website": ""
  },
  "transaction": {
    "date": "2018-06-17",
    "time": "17:06:09",
    "currency": "EUR",
    "payment_method": "",
    "subtotal": 9.68,
    "tax": 1.72,
    "tip": 0.0,
    "total": 11.4,
    "accounting_category": "Food & Beverage",
    "category_confidence": 0.9
  },
  "items": [
    {
      "name": "SALSICHA",
      "quantity": 1,
      "unit_price": 1.3,
      "total_price": 1.3,
      "category": "Food",
      "accounting_category": "Snacks",
      "category_confidence": 0.8
    },
    {
      "name": "FOLHADO CHAVE",
      "quantity": 1,
      "unit_price": 1.45,
      "total_price": 1.45,
      "category": "Food",
      "accounting_category": "Pastry",
      "category_confidence": 0.8
    },
    {
      "name": "Cola Lata",
      "quantity": 1,
      "unit_price": 1.6,
      "total_price": 1.6,
      "category": "Drink",
      "accounting_category": "Beverages",
      "category_confidence": 0.8
    },
    {
      "name": "Compal",
      "quantity": 1,
      "unit_price": 1.6,
      "total_price": 1.6,
      "category": "Drink",
      "accounting_category": "Beverages",
      "category_confidence": 0.8
    },
    {
      "name": "Mini AZ",
      "quantity": 1,
      "unit_price": 0.75,
      "total_price": 0.75,
      "category": "Food",
      "accounting_category": "Snacks",
      "category_confidence": 0.8
    },
    {
      "name": "SALGADINHOS",
      "quantity": 1,
      "unit_price": 0.85,
      "total_price": 0.85,
      "category": "Food",
      "accounting_category": "Snacks",
      "category_confidence": 0.8
    },
    {
      "name": "parra",
      "quantity": 1,
      "unit_price": 1.2,
      "total_price": 1.2,
      "category": "Food",
      "accounting_category": "Snacks",
      "category_confidence": 0.8
    },
    {
      "name": "cafe",
      "quantity": 1,
      "unit_price": 1.4,
      "total_price": 1.4,
      "category": "Drink",
      "accounting_category": "Beverages",
      "category_confidence": 0.8
    },
    {
      "name": "Aguas Gaz",
      "quantity": 2,
      "unit_price": 1.25,
      "total_price": 2.5,
      "category": "Drink",
      "accounting_category": "Beverages",
      "category_confidence": 0.8
    }
  ],
  "summary": {
    "total_items": 9,
    "rounding": 0.0,
    "change_due": 0.0
  },
  "ocr_metadata": {
    "source_image": "zenodo_20210508_205205.jpg",
    "extraction_engine": "gpt-4o-vision",
    "model_version": "2024-05-13",
    "confidence": 0.95
  },
  "ocr_raw": {
    "full_text": "AZ DE COMER\nAZ DE COMER - ACT. HOT., LDA\nRUA ALMEIDA E SOUSA, 32\n1350-012 CAMPO DE OURIQUE Tel.213856496\nN. Contrib. 501692070\nRegistro na Cons. n.\nCapital Social Euros\nN.C. 510776914\n\nFatura simplificada FS 002/562373\n2018-06-17 <> 17:06:09\n\nQt Artigo IV Total\n1 SALSICHA 13 1.30\n1 FOLHADO CHAVE 13 1.45\n1 Cola Lata 23 1.60\n1 Compal 23 1.60\n1 Mini AZ 13 0.75\n1 SALGADINHOS 13 0.85\n1 parra 13 1.20\n2 cafe 13 1.40\n2 Aguas Gaz 23 1.25\nTotal 11.40\nTroco 0.00\n\nNumeraÃÅrio 11.40\n\nTaxa Base IVA Total\n13.00 5.08 0.67 5.75\n23.00 4.60 1.05 5.65\nTotal 9.68 1.72 11.40\n\nEmp. Gerente\nMesa: 42\n\nIVA incluido\n\nconsultas:\nDC_002/277450\n\nFUIK-Processado por programa\ncertificado n. 0071/AT\nCopyright GrupoPIE, SA\n"
  }
}