{
  "merchant": {
    "name": "Pingo Doce",
    "address": "R. Actor Antonio Silva, N7, 1649-033 Lisboa",
    "phone": "213 247 330",
    "tax_id": "500892993",
    "website": ""
  },
  "transaction": {
    "date": "2018-10-12",
    "time": "12:53:00",
    "currency": "EUR",
    "payment_method": "Multibanco",
    "subtotal": 4.65,
    "tax": 0.56,
    "tip": 0.0,
    "total": 2.97,
    "accounting_category": "Groceries",
    "category_confidence": 0.9
  },
  "items": [
    {
      "name": "Prossegur Imediata",
      "quantity": 1,
      "unit_price": 1.55,
      "total_price": 1.55,
      "category": "Groceries",
      "accounting_category": "Groceries",
      "category_confidence": 0.9
    },
    {
      "name": "Item 1",
      "quantity": 1,
      "unit_price": 3.1,
      "total_price": 3.1,
      "category": "Groceries",
      "accounting_category": "Groceries",
      "category_confidence": 0.9
    }
  ],
  "summary": {
    "total_items": 2,
    "rounding": 0.0,
    "change_due": 0.0
  },
  "ocr_metadata": {
    "source_image": "zenodo_20210508_144849.jpg",
    "extraction_engine": "gpt-4o-vision",
    "model_version": "2024-05-13",
    "confidence": 0.95
  },
  "ocr_raw": {
    "full_text": "1 Dezembro\nTel. 213 247 330\nPingo Doce Distribuicao Alimentar, S.A.\nSe R. Actor Antonio Silva, N7, 1649-033 Lisboa\nRegisto: R. Lisboa Matricuka/NIPC 500892993\nANREE: 510071730 - Capital Sociai 33,808,115 EUR\n------------ Artigos ------------\nMERCERIA\nE 23% IVA SAI 170 UK\n3.10 x 1 3.10 4.65\nProssegur Imediata 1 1,55 1.55\nResumo\nTOTAL 4.65\nTOTAL POUPANcA 1.68\nTOTAL A PAGAR 2.97\nPagamentos\nTOTAL PAGO 2.97\nMultibanco\nResumo IVA\nTaxa Valor s/IVA Valor c/IVA IR Valor d/IVA\nE 23% 2.41 0.56 2.97\n---------------\nNESTA COMPRA POUPOU\n1.68 â‚¬\nPoupaMais\nCartao no: ######462\nCombustivel banho na compra: 0 EUR\nSaldo disponivel: 0 EUR\nData: 12-11-2018 0 EUR\nBeneficie dos descontos BP ou usufruir\nresgate dos seus pontos Poupa Mais.\n---- Atendido por: BENEDITE MANUEL ----\n180573 2018-10-12 12:53:003 0003 0002 0451\n9457 10 Outubro\n---- MFMPROCESSADOR ----\n-----------------------------------\nTerminal 08 12 15 03:\n-----------------------------------\nFLIKEHOME\nMorada\nLISBOA\nLocal carga: 12 Outubro\nLocal descarga: Morada do cliente\nData: 2018 10 10 Hora: 12:53\nPingo Doce\n1 Dezembro\n12 15:03\n2018-10-12 15:03 B_H08 T0H0 IH1M03149\nID 105 002 C: 105 \n6-112 15-15 03\nAREIA 6 033\nN 1649-033\nLisboa\nRA\nPOSUTILMAN I GREEN\n33,808,115 EUR\nFatura necessaria para Troca no 15 dias\nArtigos Textile L paizado pedido\nT\nAno! Se 20000000002\nMPS Processo:\nA000000000\nRESUMO DE TESOURARIA\nREDUNDANCIA DE CONFIANCA\nINSIRA CODIGO MANUAL\nPOSUTILMAN I GRENEE\nPROCESSADO VIA SIBS\nFACTURA NECESSARIA PARA TROCA DE 15 DAS ARTIGOS (TEXTILE) TAILFIADO PAIZADO PEDIDO."
  }
}