{
  "merchant": {
    "name": "Verde Gaio",
    "address": "Rua XXXX, Lisboa, Portugal",
    "phone": "",
    "tax_id": "510776914",
    "website": "verdegaio1@gmail.com"
  },
  "transaction": {
    "date": "2019-04-30",
    "time": "14:16:03",
    "currency": "EUR",
    "payment_method": "Numerario",
    "subtotal": 40.36,
    "tax": 5.47,
    "tip": 0.0,
    "total": 45.85,
    "accounting_category": "Food and Beverage",
    "category_confidence": 0.9
  },
  "items": [
    {
      "name": "Café",
      "quantity": 1,
      "unit_price": 0.75,
      "total_price": 0.75,
      "category": "Beverage",
      "accounting_category": "Food and Beverage",
      "category_confidence": 0.9
    },
    {
      "name": "Descafeinado",
      "quantity": 1,
      "unit_price": 0.8,
      "total_price": 0.8,
      "category": "Beverage",
      "accounting_category": "Food and Beverage",
      "category_confidence": 0.9
    },
    {
      "name": "Morangos",
      "quantity": 1,
      "unit_price": 3.5,
      "total_price": 3.5,
      "category": "Food",
      "accounting_category": "Food and Beverage",
      "category_confidence": 0.9
    },
    {
      "name": "Peixe",
      "quantity": 2,
      "unit_price": 9.5,
      "total_price": 19.0,
      "category": "Food",
      "accounting_category": "Food and Beverage",
      "category_confidence": 0.9
    },
    {
      "name": "Água s/Gas",
      "quantity": 1,
      "unit_price": 1.2,
      "total_price": 1.2,
      "category": "Beverage",
      "accounting_category": "Food and Beverage",
      "category_confidence": 0.9
    },
    {
      "name": "Azeitonas",
      "quantity": 1,
      "unit_price": 1.5,
      "total_price": 1.5,
      "category": "Food",
      "accounting_category": "Food and Beverage",
      "category_confidence": 0.9
    },
    {
      "name": "Empadas",
      "quantity": 2,
      "unit_price": 7.0,
      "total_price": 14.0,
      "category": "Food",
      "accounting_category": "Food and Beverage",
      "category_confidence": 0.9
    },
    {
      "name": "Imperial",
      "quantity": 2,
      "unit_price": 1.25,
      "total_price": 2.5,
      "category": "Beverage",
      "accounting_category": "Food and Beverage",
      "category_confidence": 0.9
    }
  ],
  "summary": {
    "total_items": 11,
    "rounding": 0.0,
    "change_due": 0.0
  },
  "ocr_metadata": {
    "source_image": "zenodo_20210428_195027.jpg",
    "extraction_engine": "gpt-4o-vision",
    "model_version": "2024-05-13",
    "confidence": 0.95
  },
  "ocr_raw": {
    "full_text": "Rua XXXX, Lisboa, Portugal\nN.C. 510776914\nFatura simplificada FS 002/26014\nOriginal\n2019-04-30 14:16:03\nQt Artigo IV Total\n1 Café 13 e 0.75\n1 Descafeinado 13 e 0.80\n1 Morangos 13 e 3.50\n1 Peixe 13 e 9.50\n1 Peixe 13 e 9.50\n1 Água s/Gas 13 e 1.20\n1 Azeitonas 13 e 1.50\n2 Empadas 13 e 7.00\n2 Imperial 23 e 1.25\nTotal: e 45.85\nTroco: e 0.00\nTaxa Base IVA Total\n13.00 e 38.27 e 4.98 e 43.25\n23.00 e 2.11 e 0.49 e 2.60\nTotal e 40.36 e 5.47 e 45.85\nPagamento efetuado em:\nNumerario\nMesa: 7\nHora: 14:18 Atendido por: Jorge Remedios\nConsultas: DC 002/71503\nZ4•WS-Processado por programa\ncertificado n. 0071/AT\nCopyright GrupoPIE, SA"
  }
}