{
  "merchant": {
    "name": "Delta Q - Lisboa Avenida",
    "address": "Avenida da Liberdade, 144, 1250-146, Lisboa",
    "phone": "800 20 20 50",
    "tax_id": "510776914",
    "website": "info@mydeltaq.com"
  },
  "transaction": {
    "date": "2019-08-09",
    "time": "14:03:00",
    "currency": "EUR",
    "payment_method": "Cartao de Debito",
    "subtotal": 28.3,
    "tax": 4.1,
    "tip": 0.0,
    "total": 32.4,
    "accounting_category": "Food & Beverage",
    "category_confidence": 0.9
  },
  "items": [
    {
      "name": "Ovos Benedict com Salmao",
      "quantity": 1,
      "unit_price": 15.0,
      "total_price": 15.0,
      "category": "Food",
      "accounting_category": "Food & Beverage",
      "category_confidence": 0.9
    },
    {
      "name": "Menu Classico",
      "quantity": 1,
      "unit_price": 1.65,
      "total_price": 1.65,
      "category": "Food",
      "accounting_category": "Food & Beverage",
      "category_confidence": 0.9
    },
    {
      "name": "Pao Simples Misto",
      "quantity": 1,
      "unit_price": 1.35,
      "total_price": 1.35,
      "category": "Food",
      "accounting_category": "Food & Beverage",
      "category_confidence": 0.9
    },
    {
      "name": "Expresso Qaldus",
      "quantity": 2,
      "unit_price": 0.8,
      "total_price": 1.6,
      "category": "Beverage",
      "accounting_category": "Food & Beverage",
      "category_confidence": 0.9
    },
    {
      "name": "Sumo Natural Laranja",
      "quantity": 1,
      "unit_price": 2.6,
      "total_price": 2.6,
      "category": "Beverage",
      "accounting_category": "Food & Beverage",
      "category_confidence": 0.9
    },
    {
      "name": "Agua Vimeiro c/Gas",
      "quantity": 1,
      "unit_price": 1.2,
      "total_price": 1.2,
      "category": "Beverage",
      "accounting_category": "Food & Beverage",
      "category_confidence": 0.9
    },
    {
      "name": "Taca de Acai e Pudim de Chia",
      "quantity": 1,
      "unit_price": 9.0,
      "total_price": 9.0,
      "category": "Food",
      "accounting_category": "Food & Beverage",
      "category_confidence": 0.9
    }
  ],
  "summary": {
    "total_items": 8,
    "rounding": 0.0,
    "change_due": 0.0
  },
  "ocr_metadata": {
    "source_image": "zenodo_20210429_181657.jpg",
    "extraction_engine": "gpt-4o-vision",
    "model_version": "2024-05-13",
    "confidence": 0.95
  },
  "ocr_raw": {
    "full_text": "Delta Q - Lisboa Avenida\nAvenida da Liberdade, 144, 1250-146, Lisboa\nManuel Rui Azinhais Nabeiro, Lda.\nMarques de Pombal\ninfo@mydeltaq.com\nNIF: 500 853 975\nCapital Social: 2,500,000.00 EUR\n\n2019-08-09 FATURA SIMPLIFICADA N:\n12:05 MESA N: 10/10\n28.00/\n\nContribuinte: 510776914\n\nQTD UNI DESCRICAO IVA VALOR\n\nOVOS BENEDICT COM SALMAO 1 13% 15.00\nPreco: 7.50/unidade\n\nMENU CLASSICO 1 13% 1.65\nPreco: 1.65/unidade\n\nPAO SIMPLES MISTO 1 23% 1.35\n+ EXPRESSO QALDUS\n+ SUMO NATURAL LARANJA\n\nSUMO VIMEIRO C/GAS 25 CL 1 23% 1.20\nPreco: 1.20/unidade\n\nTACA DE ACAI E PUDIM DE CHIA\n\n1 13% 9.00\n\nSUMO NATURAL ABACAXI/LARANJA/MANJERICAO\n\nPreco: 2.60/unidade 23% 2.60\n\n+ EXPRESSO QALDUS 2 13% 1.60\nPreco: 0.80/unidade\n\nTAXA IVA INCID\n3% 3.14 24.12\n23% 0.96 4.19\nTOTAL INCIDENCIAS: 4.10 28.30\n\nTOTAL: 32.40 â‚¬\n\nVendido por: Renato Dantas\n\nPago por Cartao de Debito\n\nLinha Apoio Cliente: 0800 20 20 50\ninfo@mydeltaq.com\nFree Wi-Fi:\nSSID: Delta Q | Password: umdiafeliz\n\nASCP-Processado por programa\ncertificado n. 196/AT\n\nREFERENTE A:\nCM 2A1904/3602\n\nLda Ancestes Manuel Rui Azinhais Nabeiro,\n\nContribuinte: 500853975"
  }
}