{
  "merchant": {
    "name": "Casa do Preto",
    "address": "Estrada de Chao de Meninos n.40, 2710-194 Sintra",
    "phone": "219 230 436",
    "tax_id": "502911263",
    "website": ""
  },
  "transaction": {
    "date": "2018-07-15",
    "time": "12:22:41",
    "currency": "EUR",
    "payment_method": "",
    "subtotal": 13.23,
    "tax": 2.47,
    "tip": 0.0,
    "total": 15.7,
    "accounting_category": "Food and Beverage",
    "category_confidence": 0.9
  },
  "items": [
    {
      "name": "Travesseiro",
      "quantity": 4,
      "unit_price": 1.4,
      "total_price": 5.6,
      "category": "Bakery",
      "accounting_category": "Food and Beverage",
      "category_confidence": 0.9
    },
    {
      "name": "Queijadas",
      "quantity": 0.27,
      "unit_price": 30.23,
      "total_price": 8.1,
      "category": "Bakery",
      "accounting_category": "Food and Beverage",
      "category_confidence": 0.9
    },
    {
      "name": "Cafe",
      "quantity": 1,
      "unit_price": 0.7,
      "total_price": 0.7,
      "category": "Beverages",
      "accounting_category": "Food and Beverage",
      "category_confidence": 0.9
    },
    {
      "name": "Comp.Pera",
      "quantity": 1,
      "unit_price": 1.3,
      "total_price": 1.3,
      "category": "Bakery",
      "accounting_category": "Food and Beverage",
      "category_confidence": 0.9
    }
  ],
  "summary": {
    "total_items": 4,
    "rounding": 0.0,
    "change_due": 0.0
  },
  "ocr_metadata": {
    "source_image": "zenodo_20210508_205300.jpg",
    "extraction_engine": "gpt-4o-vision",
    "model_version": "2024-05-13",
    "confidence": 0.95
  },
  "ocr_raw": {
    "full_text": "CASA DO PRETO\nCasa do Preto - Fabrica de Queijadas de S\nntra, Lda\nEstrada de Chao de Meninos n.40\n2710-194 Sintra\nTelf: 219 230 436\nN. Contrib. 502911263\nRegisto na Cons. Sintra n.2025\nCapital Social 5,000 euros\n\nN.C. 510776914\n\nFatura simplificada FS 002/916167\n2018-07-15 12:22:41\nOriginal\n\nQt Artigo Preco IV Total\n4 Travesseiro e 1.40 13 e 5.60\n0.27U Queijadas Kg e 30.23 e 8.10\n1 Cafe e 0.70 13 e 0.70\n1 Comp.Pera e 1.30 23 e 1.30\n\nTotal e 15.70\nTroco: e 0.00\nTaxa Base IVA Total\n13.00  e 5.58 e 0.72 e 6.30\n23.00  e 7.65 e 1.75 e 9.40\nTotal e 13.23 e 2.47 e 15.70\n\nEmp: tania | Mesa: V.Rapida 100\nconsultas:\n\nIVA incluido\n\n1S+L-Processado por programa\ncertificado n. 0071/AT"
  }
}